	sentiment	review
2870	1	Cookie Functions Cookie Purposes
5360	0	Furthermore, you have the right to have your personal data erased where one of the following grounds applies, see Article 17 of the GDPR:the personal data are no longer necessary in relation to the purposes for which they were collected or otherwise processed,
848	1	In the event of contact with our technical department, we can process other information that we will need, in order to provide you with technical assistance, in particular data collected in crash logs, from your device or the technical parameters of the equipment you use to use the Services.
1379	1	Where we rely on your IP address or MCC, we cannot apply the terms of this section to any user that masks or otherwise obfuscates their location information so as not to appear located in the Designated Countries. If any terms in this section conflict with other terms contained in this Policy, the terms in this section shall apply to users in the Designated Countries.
1959	1	I want to inform you that whenever you use my Service, in a case of an error in the app I collect data and information (through third party products) on your phone called Log Data. This Log Data may include information such as your device Internet Protocol (“IP”) address, device name, operating system version, the configuration of the app when utilizing my Service, the time and date of your use of the Service, and other statistics.
5274	1	Cookies are small text files containing a string of alphanumeric characters. We may use session cookies, persistent cookies and targeting cookies, as well as Google Analytics (a web analytics service provided by Google, Inc.). A session cookie disappears after you close your browser. A persistent cookie remains after you close your browser and may be used by your browser on subsequent visits to our Services.
3660	1	We use cookies and similar technologies to facilitate and customize your use of our Services. A cookie is a small data file, which we store on your computer or mobile device that can later be retrieved to identify you to us. We may use cookies and similar technologies, among other things, to:(a) allow us to recognize you and your device;(b) allow our Services to interact with a third-party social network or platform (where you have chosen to allow such interaction);(c) allow our payment processors to process your payment instructions;(d) provide you with more customized Services, for example to provide our Services in your preferred language; or(e) obtain data which will allow us to understand how people are using our Services so that we can improve them.
1672	0	Contract personnel
3801	1	Any use of Cookies - or of other tracking tools - by this Application or by the owners of third party services used by this Application, unless stated otherwise, serves to identify Users and remember their preferences, for the sole purpose of providing the service required by the User.
2656	0	detect and fight fraud or other illegal or unauthorized activities, as identified in our Terms of Use or other related policies, by gathering and analyzing user data (including text, images, or other content) which may constitute user related illegal or unauthorized activities.
5090	1	Cookies and similar technologies. When you use the App, we may use cookies and similar technologies like pixels, web beacons, scripts to collect information about how you use our App and provide features to you. A cookie is a text file containing small amounts of information which is downloaded to your device when you access the App. The text file is then sent back to our server each time you use the App. This enables us to operate the App more effectively. For example, we will know how many users access specific areas or features within our App and which links or ads they clicked on. We use this aggregated information to understand and optimize how our App is used, improve our marketing efforts, and provide content and features that are of interest to you. We may ask advertisers or other partners to serve ads or services to the App, which may use cookies or similar technologies.
1132	1	Most web browsers have cookies enabled. Please review your web browser’s “Help” file to learn the proper way to modify your cookie settings. Please note that if you delete or choose not to accept cookies from the Service, you may not be able to utilize the features of the Service to their fullest potential.
1467	0	When we have a good-faith belief it is necessary to: detect, prevent and address fraud, unauthorized use of the Products, violations of our terms or policies, or other harmful or illegal activity; to protect ourselves (including our rights, property or Products), you or others, including as part of investigations or regulatory inquiries; or to prevent death or imminent bodily harm. For example, if relevant, we provide information to and receive information from third-party partners about the reliability of your account to prevent fraud, abuse and other harmful activity on and off our Products
1730	1	 We use both first party cookies (cookies that are set by us at Alibaba and serve mainly to enable basic functionality on our Sites, including web analytics cookies that help us understand how users use our web pages and how we can improve their use) and third party cookies (these cookies are not set by Alibaba, but by our selected partners)
582	1	We and our advertising networks and their partners may use cookies and similar technologies, such as mobile “SDK”, to provide and personalize our Services and to provide targeted advertisements. Some of these technologies can synchronize behavior across different mobile apps, devices, and websites so that advertisements can be tailored to your interests. This process is called personalized advertisement experience. In addition, we and certain advertising networks may access your inventory of installed apps to avoid advertising already installed apps. If you'd like to opt-out from having advertisements personalized in this way on your mobile device, please see below ‘Opt-out of targeted advertising’.
1321	1	In addition, you may see our games advertised in other services.  After clicking on one of these advertisements and installing our game, you will become a user of our Service.  In order to verify the installs, a device identifier, Advertiser ID or IDFA may be shared with the advertiser
3935	1	Information contained in a cookie may be linked to your personal information, such as your user ID, for purposes such as improving the quality of our Service, tailoring recommendations to your interests, and making the Service easier to use. You can disable cookies at any time, although you may not be able to access or use features of the Service.
3038	1	9.3 By means of various tracing technologies as mentioned above, we can trace the domain names, IP addresses and the type of explorer used by the users who access our websites and use our products or services. We use such information to trace the traffic modes congregating on the whole CXZH.LTD website. Such information is independent of any personal information the user may otherwise provide in using CXZH.LTD’s products and services.
4493	0	The Jasmin Chat uses this information to enhance the quality of the video services that the Jasmin Chat provide and to improve the effectiveness to better tailor our services to the User’s interests and needs under the privacy protection rules as follows.
1779	1	Cookies and logs etc.
3725	0	You are responsible for all orders, and for the accuracy of all information, sent via the internet using your user ID, password or any other personal identification used to identify you on the Services.
3438	1	The Internet pages use what are known as cookies Cookies are small text files that are stored on your computer and saved by your browser. Cookies as such cannot be used to identify the user. Cookies do not harm your computer and do not contain viruses.
2856	0	The App may further ask you to allow us to post on such Third Party Social Networks on your behalf (e.g. photos, e-cards, videos and status updates). Please keep in mind that we will only do that if specifically allowed by you and we will store ID and your full name for the purposes of user identification. Other information will be merely stored within the App on your device so that the App will be able to communicate with Third Party Social Network directly; Voice recordings from Apps are also only being collected and stored within the Apps solely upon your request.
4967	1	You may choose to delete cookies or other tracking mechanisms on your browser anytime you want through your browser's settings. You may also choose to have non-essential cookies (and similar technologies) not used by us when you access and use UCWeb Services by amending your settings at your browser's settings (if applicable).
22	1	 In addition, most advertising networks offer you a way to opt out of targeted advertising.  If you would like to find out more information, please visit http://www.aboutads.info/choices/ or http://www.youronlinechoices.com
5258	0	Information we collect using cookies and similar technologies (Note: You can refer to our Cookies Policy to learn more about opting out of such technologies)
2625	1	D. Information on Cookies:We collect information through technology to make our Services more interesting and useful to you and for various purposes related to our internal business. For instance, when you visit https://learnwithhomer.com, we collect your IP address. An IP address is associated with the access point through which you access the internet, and is typically controlled by your Internet Service Provider (ISP). Standing alone, your IP address is not personally identifiable information. We may use the IP address to assist in populating registration forms. We may use IP addresses to collect information regarding the frequency with which our guests visit various parts of our sites, and we may combine IP addresses with PII.
916	0	shared information that you provide to another party by using our services, and the information stored when you use our services. You shall ensure that you have obtained the authorization and consent of such party before you provide Tantan with the aforementioned personal information of the party.
2878	0	We may share information about you in the following ways:
1587	0	In case of sale of our company
2006	1	Cookies are files with a small amount of data that are commonly used as anonymous unique identifiers. These are sent to your browser from the websites that you visit and are stored on your device's internal memory.
4602	1	Remembering user preferences and settings
2714	1	Cookies. A cookie is a small string of text that we, or service providers acting on our behalf, send to your computer’s or mobile device’s browser. Other types of cookies exist, but the cookies in the Services are only used to obtain browser or device-specific information.
2156	0	If you are located in the European Economic Area, we only process your Personal Information based on a valid legal ground, including:When we need your Personal Information to provide our services, including for account registration, to respond to your inquiries, or for customer support;We have a legal obligation to use your Personal Information (such as to enforce our terms and conditions);When we or a third party have a legitimate interest in using your Personal Information. In particular, we have a legitimate interest in using your Personal Information to troubleshoot issues, perform product improvement, conduct business analytics, conduct and optimize user acquisition, serve non-personalized ads, and otherwise monitor and improve the safety, security, and performance of our Service. We only rely on our or a third party’s legitimate interests to process your Personal Information when these interests are not overridden by your rights and interests;If you otherwise consent to the processing of your Personal Information.
1269	1	9.1.2 Cookies are used to personalize webpages and / or recognize you when you are accessing our websites, in order to conveniently browse and access our websites after having registered for our products, services and/or other support services.
3729	1	Security Cookies. We use Security Cookies for security purposes.
4110	0	When you register with us on one of the Services, we may ask you for personally identifiable information, whether directly or indirectly, that can be used to contact or identify you (“Personal Information”). We also collect other information that you provide as part of registration and the administration and personalization of your account.
5004	1	Log file information is automatically reported by your browser or mobile device each time you access the Service. When you use our Service, our servers automatically record certain log file information. These server logs may include anonymous information such as your web request, Internet Protocol (ﾡﾰIPﾡﾱ) address, browser type, referring / exit pages and URLs, number of clicks and how you interact with links on the Service, domain names, landing pages, pages viewed, and other such information.
3245	0	In order maximize the benefits of the App, this mobile short notice lists the App's optimal collection practices. You'll be able to opt-in or modify collection settings according to your phone's privacy settings.
1152	1	Other passively collected information. UBISOFT may on its own, or with the help of third party analytics tools, collect non-personally identifiable information concerning your and other users’ gaming hardware, habits, behaviours and use of our Services. UBISOFT collects such information to better adapt our Services to users’ interests and for a better quality of our Services. The information collected may contain the following, without limitation: device unique identity, including MAC address, console, mobile, tablet and console unique identifier or other device identifiers and settings, internet provider, carrier, operating system, hardware information, localization information, date and time spent on the Services, game scores, game metrics, achievements, rankings, time played and statistics, feature usage, advertising conversion rates, monetization rate, purchase history and other similar information. UBISOFT uses third party ad serving technologies that may collect information as a result of ad serving in the Services and that may display behavioural and non-behavioural advertisements on our Services. The information collected and used for the targeted advertising may contain the following, without limitation: age and gender, number views of an advertisement, device unique identity or other device identifiers and settings, information about Your use of the products and Services, Compatible Mobile Terminal, and other Internet sites (including third party web pages and mobile Internet sites) viewed by you (as well as date and time viewed), advertisement(s) served, the advertisement(s)’ in game location and length, and your response to the advertisement(s) (if any). The analytics tools and ad serving technologies may use server log files, web beacons, cookies, tracking pixels and other technologies to collect said information and may combine the information collected on other UBISOFT Services with information collected from other third party websites, products and services and with demographic, advertisement, market and other analytics surveys. Standing alone, this information is not personal data; however, if UBISOFT combines any of this information with personal data, UBISOFT will treat this information as personal data pursuant to this Privacy Policy. You will find a list of our partners whose analytic tools and ad serving technologies are used in our Services at https://legal.ubi.com/cookies/. UBISOFT makes its best efforts to provide You with the links to our partners’ own privacy policies according to which their tools and technologies are used and when available the link to allow You to opt-out from their services
3380	1	This Service does not use these “cookies” explicitly. However, the app may use third party code and libraries that use “cookies” to collect information and improve their services. You have the option to either accept or refuse these cookies and know when a cookie is being sent to your device. If you choose to refuse our cookies, you may not be able to use some portions of this Service.
5361	0	The Services and this Site are offered and made available only to users 13 years of age or older. YOU MUST BE 13 YEARS OF AGE OR OLDER TO USE THE SERVICES AND THIS SITE. By accessing and using this Site, you represent that you are 13 years old or older; and if you are between the ages of 13 and 18, you represent that your legal guardian has reviewed and agreed to these Terms.
4896	1	You can control or reset your cookies through your web browser, which will allow you to customise your cookie preferences and to refuse all cookies or to indicate when a cookie is being sent. However, some features of the Service may not function properly if the ability to accept cookies is disabled.
1931	0	 When we believe in good faith that disclosure is necessary to protect our rights, protect your safety or the safety of others, investigate fraud, or respond to a government request;
4262	1	Any use of Cookies – or of other tracking tools – by this Application or by the owners of third party services used by this Application serves the purpose of providing the service required by the User, in addition to any other purposes described in the present document and in the Cookie Policy, if available.
827	1	Like many websites, we use “cookies” to collect information.A cookie is a small data file that we transfer to your computer’s hard disk for record-keeping purposes. We use cookies for two purposes. We utilize session ID cookies to enable certain features of the Services, to better understand how you interact with the Services and to monitor aggregate usage by Users and web traffic routing on the Services. Unlike persistent cookies, session cookies are deleted from your computer when you log off from the Services and then close your browser. Third party advertisers on the Services may also place or read cookies on your browser.
3262	0	Information You submit
658	0	(“Basic Information”)
2042	1	Who serves these cookies
1031	0	Users are responsible for any Personal Data of third parties obtained, published or shared through this Application and confirm that they have the third party's consent to provide the Data to the Owner.
1302	0	Your Data Protection Rights Under General Data Protection Regulation (GDPR)
5250	0	We share personal data with third parties that we hire to provide services or perform business functions on our behalf, based on our instructions. We share your personal information with the following types of service providers:• cloud storage providers• data analytics providers• marketing partners (in particular, social media networks, marketing agencies, email delivery services)
5312	1	"We use first and third party cookies for several reasons. Some cookies are required for technical and/or security reasons in order for our Platform to operate, and we refer to these as ""essential"" or ""strictly necessary"" cookies. First party cookies are mainly served to enable basic functionality on our Platform; including web analytics cookies that help us understand how users use our web pages and how we can improve their use. For example we use essential or strictly necessary cookies to enable us to remember goods added to your Alibaba.com shopping basket and to recognize you when you sign into your Alibaba.com account."
2413	1	"Logfiles. Log files are files that log actions that have occurred on a website. Level Eight may collect data in the form of log files and may use such log files to gather statistics about End Users user habits and to assess overall Game activity, including how many ""hits"" a particular web page is getting and other navigational data. These entries are generated anonymously, and enable Level Eight to track interest in specific promotions, troubleshoot technical concerns, and provide End Users with content that may be of interest to them. Log files are used internally only, and are not associated with any particular user, computer, or browser."
3734	1	This Service does not use these “cookies” explicitly. However, the app may use third party code and libraries that use “cookies” to collection information and to improve their services. You have the option to either accept or refuse these cookies and know when a cookie is being sent to your device. If you choose to refuse our cookies, you may not be able to use some portions of this Service.
5059	1	We use cookies to store visitors preferences, customize Web page content based on visitors browser type or other information that the visitor sends. Cookies are required to use Todoist.
3638	0	Medium won’t transfer information about you to third parties for the purpose of providing or facilitating third-party advertising to you. We won’t sell information about you to a third-party.
1524	0	Of course, you’ll also provide us whatever information you send through the services. Keep in mind that the users you send texts, images, and any other content to can always save that content or copy it outside the app. So, the same common sense that applies to the Internet at large applies to HOLLA as well: Don’t send messages or share content that you wouldn’t want someone to save or share.
1851	1	Cookies: We collect technical information and usage data, which may be linked and identified with your account, by using cookies and other tracking technologies. We may use cookies to store certain types of information each time you use our Services. To find out more about how we use cookies, please review the additional information in this Privacy Policy under the Section entitled “Do we use cookies or other tracking technologies?”
4056	0	Are asked to provide your information, products or services, or information you are interested in; conduct market analysis and survey
4370	1	We want to inform you that whenever you use our Service, in a case of an error in the app we collect data and information (through third party products) on your phone called Log Data. This Log Data may include information such as your device Internet Protocol (“IP”) address, device name, operating system version, the configuration of the app when utilizing our Service, the time and date of your use of the Service, and other statistics.
1432	0	We process your personal data:To provide our Service
2737	1	Cookies. A cookie is information a website places on your computer’s hard drive so that the website is able to remember your preferences and/or which pages you visited on the website and make your visit more efficient and enjoyable. Level Eight may use cookies to determine the number of unique players of the Game over a given period, or to remember user account details, etc. so that the need for multiple log-ins is eliminated. It may combine information collected through cookies to any Personal Data submitted online when using the Game to help personalize a user’s access to and playing of the Game. Cookies may be disabled on your computer by indicating this in the preferences or options menus in your browser.
2123	1	Cookies
4603	1	This site uses third-party cookies to discover how users use the site. Here is a list of the cookies it uses
434	0	This Kids Apps Privacy Policy is appointed to provide the legal guardian of a child under the age of 13 with guidance regarding our privacy policies that concern collecting, using and disclosing personal information of children under 13.
5286	1	Our site and Services may use cookies and tracking technology which are useful for gathering information such as browser type and operating system, tracking the number of visitors to the site, and understanding how visitors use the Services. Personal information cannot be collected via cookies and other tracking technology, however, if you previously provided personally identifiable information, cookies may be tied to such information. Third parties such as our advertisers may also use cookies to serve ads to you based on your visit to our site and other sites on the internet.
1461	1	On our websites :We use cookies to personalise content and ads, to provide social media features and to analyse our traffic. We also share information about your use of our site with our social media, advertising and analytics partners. 
918	0	This Policy and other information on the Services may be updated periodically and without prior notice to you, and any changes will be effective immediately upon the posting of the revised Policy on the Services. However, we will use your Personal Information in a manner consistent with the Policy in effect at the time you submitted the information, unless you consent to the new or revised notice. We will post a prominent notice on the Services to notify you of any significant changes to our Policy and indicate at the top of the notice when it was most recently updated.
584	0	Based on consent: provide you with marketing information about products or services that you request from us and which we feel may interest you where you have asked us to do so; and send you push notifications on mobile devices where you have agreed to this. 
4862	0	If you do not want our Mobile App to collect such information from you, you can remove the Mobile App from your mobile device entirely and access our services through our website instead.
