	sentiment	review
5076	1	Web beacons. The Game may use a variety of technical methods for tracking purposes, including “Web beacons” etc. Web beacons are small pieces of data that are embedded in images on the pages of the Game. We may also use these technical methods to analyze the traffic patterns in the Game such as the frequency with which End Users accesses various parts of the Game etc. These technical methods may involve the transmission of information either directly to us or to another party authorized by us to collect information on our behalf. The information from use of these technical methods may be collected in a form that is personally identifiable.
968	1	Google Analytics Help Center: https://developers.google.com/analytics/devguides/collection/analyticsjs/cookie-usage
990	1	Advertisers may also place cookies in your browser that may allow them to collect certain information about your browsing history. To find out more about how to exercise choices with respect to certain third party cookies, including opting out of receiving such cookies, visit the Digital Advertising Alliance’s Self-Regulatory Program for Online Behavioral Advertising at www.aboutads.info, or the Network Advertising Initiative at www.networkadvertising.org. If you use Tunnellight VPN VIP, the VIP subscription based version of our product, we will not serve any ads and thus no information will be collected by our third party ad partners on the Tunnellight VPN Premium product.
1489	1	Our website uses cookies and similar technologies to make the site work and improve your user experience. By using this website, you consent to the use of cookies. Read our updated Cookie Policy to learn more.
2820	0	camel.game@gmail.com
3860	0	Product research and development: We use the information we have to develop, test and improve our Products, including by conducting surveys and research, and testing and troubleshooting new products and features.
1747	0	Financial institutions and third-party payment agencies: When you place a booking, apply for a refund, or purchase insurance, we will share the related information with the relevant financial institutions or the third-party payment agencies, and as we believe is necessary for fraud detection and prevention, we will further share other necessary information (i.e. email address, phone number, and IP address) with the relevant financial institutions.
3910	1	You have the right to decide whether to accept or reject cookies. If you choose to set your web browser controls to reject cookies, you may still use our website though your access to some functionality and areas of our website may be restricted.
3394	0	You also have other rights such as to correct your data, have your data deleted, object how we use or share your data, and restrict how we use or share your data. You also have the right to withdraw consent where you have previously given your consent to the processing of your personal data, for example by turning off camera access in your mobile device settings. This will not affect any data processed before such a withdrawal.
2357	1	We employ or our third party tracking utility partner employs a software technology called clear gifs (a.k.a. Web Beacons/Web Bugs), that help us better manage content on our site by informing us what content is effective. Clear gifs are tiny graphics with a unique identifier, similar in function to cookies, and are used to track the online movements of Web users. In contrast to cookies, which are stored on a user’s computer hard drive, clear gifs are embedded invisibly on Web pages or e-mails and are about the size of the period at the end of this sentence. We may associate this information with your IP address or device identifier but do not tie the information gathered by clear gifs to our customers’ personal information.
3047	0	Enforce our Terms of Service and other usage polices.
1733	1	Cookies will expire once the user closes the browser or logs out of the browser.
2458	1	This Service does not use these “cookies” explicitly. However, the app may use third party code and libraries that use “cookies” to collect information and improve their services. You have the option to either accept or refuse these cookies and know when a cookie is being sent to your device. If you choose to refuse our cookies, you may not be able to use some portions of this Service.
5094	1	IP addresses. Ubisoft also keep tracks of Internet Protocol (IP) addresses for safety and security reasons. An IP address is a number that is used by computers on the network to identify your computer every time you log on to the Internet.
3774	1	Clear gifs/web beacons information
2298	0	You can also edit the name, phone number and email address associated with your account through the Settings menu in Uber's apps. You can also look up your trips, orders and deliveries history in the Uber apps.
2462	1	The only cookies we use are those to operate and provide our Services on the web. We do not use cookies for profiling or advertising. The cookies we use are small text files that allow us to provide and customize our Services, and in doing so provide you with an enhanced user experience. Your browser should allow you to control these cookies, including whether or not to accept them and how to remove them. You may choose to block cookies with your web browser, however, if you do disable these cookies you will not be able to log in to Telegram Web.
3556	1	6.4 You can find out more about internet advertising by visiting the following websites:www.allaboutcookies.org, www.yourchoicesonline.eu, andwww.networkadvertising.org. Some of these sites enable you to opt out of online behavioural advertising and other tracking cookies (in addition to the control settings on your browser).
3059	0	We do not share your information with others except as indicated below, or otherwise agreed by you.
166	1	You are entitled to choose whether or not you would like to use cookies. If you do not approve to the use of cookies, please be sure to opt out, as in block or disable them using your browser settings. If you disable cookies, however, you may not be able to use all portions or functionalities of the Services.
5317	1	"Cookies are not the only way to recognise or track visitors to our Platform.  We may use other, similar technologies from time to time, like web beacons (sometimes called ""tracking pixels"" or ""clear gifs"").  These are tiny graphics files that contain a unique identifier that enable us to recognise when someone has visited our Platform or opened an e-mail that we have sent them.  This allows us, for example, to monitor the traffic patterns of users from one page within our Platform to another, to deliver or communicate with cookies, to understand whether you have come to our Platform from an online advertisement displayed on a third-party website, to improve site performance, and to measure the success of e-mail marketing campaigns.  In many instances, these technologies are reliant on cookies to function properly, and so declining cookies will impair their functioning."
5435	1	Do Not Track (“DNT”) is a privacy preference that users can set in certain web browsers and devices. DNT is a way for users to inform websites and services that they do not want certain information about their webpage visits collected over time and across websites or online services. Please note that we do not respond to or honor DNT signals or similar mechanisms transmitted by web browsers.
3383	1	Advertising Cookies. Advertising Cookies are used to serve you with advertisements that may be relevant to you and your interests.
3479	0	Address: Belarus, Minsk, ul. Platonova 20b/112-1
3179	0	Like most online services, we and our partners may use cookies and similar technologies to provide and personalize our services, analyze gaming usage, target advertisements and prevent fraud. Cookies are small text files stored by browser(s) on your desktop computer or mobile device. Most web browsers automatically accept cookies, but you can modify browser setting to decline cookies if you wish so. In that case, some aspects of the service may then not function properly.
4542	0	The security of your personal information is important to us. We follow generally accepted industry standards to protect the personal information submitted to us, both during transmission and once we receive it.
5462	0	request that we delete all personal data we process about you if those data are no longer necessary for the purposes for which they were collected.
4518	0	Emir Kuljanin, Kristian Andersson and Julijana Mijailovic built the Vampire’s Fall Origins app as a Commercial app. This SERVICE is provided by Emir Kuljanin, Kristian Andersson and Julijana Mijailovic and is intended for use as is.
2893	1	We may feature advertisements served by third parties that deliver cookies to your computer/device so the content you access and advertisements you see can be tracked. Since the third party advertising companies associate your computer/device with a number, they will be able to recognize your computer/device each time they send you an advertisement. These advertisers may use information about your visits to our Service and third party sites and applications in order to measure advertisement performance and to provide advertisements about goods and services of interest to you. This Policy does not apply to, and we are not responsible for the data collection practices of these third party advertisers, and we encourage you to check their privacy policies to learn more about their use of cookies and other technology.
1272	0	Where you give us consent:1) We will send you electronic direct marketing content in relation to our relevant products and services, or other products and services provided by our affiliates and partners.
1945	0	You may update your account at any time by logging in and changing your profile settings. If you have any questions about reviewing or modifying your account information, please contact us directly at support@GOGO LIVE.com.
1646	1	When you access the Service by or through a mobile device (including but not limited to smart-phones or tablets), we may access, collect, monitor and/or remotely store one or more ﾡﾰdevice identifiers,ﾡﾱ such as a universally unique identifier (ﾡﾰUUIDﾡﾱ). Device identifiers are small data files or similar data structures stored on or associated with your mobile device, which uniquely identify your mobile device. A device identifier may be data stored in connection with the device hardware, data stored in connection with the deviceﾡﾯs operating system or other software, or data sent to the device by Canva. A device identifier may convey information to us about how you browse and use the Service. A device identifier may remain persistently on your device, to help you log in faster and enhance your navigation through the Service. Some features of the Service may not function properly if use or availability of device identifiers is impaired or disabled. Device Identifiers used by Canva include the Android Advertising ID and iOS Advertising Identifier.
297	1	By adjusting the web browser, the Members can choose whether to accept all cookies, to be notified when cookies are installed, or deny all cookies; provided, however, if a Member refuses to install cookies, he/she cannot use some of the services that require the Member to log in.
1480	1	Authentication These cookies help us to identify our members so that when you’re logged in, you can enjoy Topface s offerings, experiences and various features, such as uploading photographs, chatting and can localise your experience, such as when you’ve requested to view Topface’s site in your local language or when you’ve asked Topface to ‘remember me’. These cookies also help to remember who invited you to join Topface
5048	0	4. Data Retention
4076	0	Whenever you use any website, mobile application or other internet service, certain information gets created and logged automatically. The same is true when you use Pinterest. Here are some of the types of information we collect:Log data. When you use Pinterest, our servers record information (“log data”), including information that your browser automatically sends whenever you visit a website, or that your mobile app automatically sends when you’re using it. This log data includes your Internet Protocol address, the address of and activity on websites you visit that incorporate Pinterest features (like the “Save” button—more details below), searches, browser type and settings, the date and time of your request, how you used Pinterest, cookie data and device data. If you’d like, you can get more details on the types of information we collect in our logs.
945	1	"In addition we also use social media cookies. Some pages on our Sites allow you to ""share"" content through social media such as Facebook and Twitter. Sometimes we embed videos from websites like YouTube. These websites set their own cookies on which we have no influence. To refuse their cookies, please follow the instructions on their websites. In addition, these websites have their own privacy policy, which you can find on the respective websites."
4526	0	We care about the safety of your data and, we have implemented industry recognized measures to protect it, but unfortunately we canﾡﾯt guarantee that nothing bad will ever happen to it. (A troop of rabid baboons springs to mind).
889	0	To allow you to access your chat history, photos, videos and missed calls for your own purposes.
1583	0	Candivore
5143	1	Cookies are files with a small amount of data that are commonly used as anonymous unique identifiers. These are sent to your browser from the websites that you visit and are stored on your device’s internal memory.
2758	1	Personalization cookies may also include social media cookies which are used to enable you to log into our Platform using your social media accounts and to share pages and content that you find interesting on our Platform through third party social networking and other websites.  These cookies may also be used for advertising purposes too.
3195	1	Information we automatically collect when you use our Services:  Some Personal Data is automatically collected when you use our Services, such as the following:Device identifiers
476	1	We use cookies and similar technologies such as local storage within our apps to provide and optimise our Service. You can control which cookies you get and which you keep on your device through your browser settings. Unless you have adjusted your browser settings so that it will refuse our cookies, our system will issue cookies when you visit our website. However, if you do not accept cookies you may not be able to take advantage of many of the special features of the Service
1529	0	● Right to restriction. You have the right to restrict our processing your personal information where one of the following applies:● You contest the accuracy of your personal information that we processed. We will restrict the processing of your personal information, which may result in an interruption of some or all of the Services, during the period necessary for us to verify the accuracy of your personal information;● The processing is unlawful and you oppose the erasure of your personal information and request the restriction of its use instead;● We no longer need your personal information for the purposes of the processing, but it is required by you to establish, exercise or defense of legal claims; or● You have objected to processing, pending the verification whether the legitimate grounds of our processing override your rights.
5184	0	However, we cannot guarantee the security of your personal information or that loss, misuse, unauthorized acquisition, or alteration of your data will not occur. We also have no way of protecting any of your personal information that is not in our control, such as any information transmitted via email or wireless connections.
2442	1	You can find out more about our use of cookies and such technologies in our Cookie Policy here. The Cookie Policy forms part of this Privacy Policy.
5057	1	Cookie data.  We also use “cookies” (small text files sent by your computer each time you visit our website, unique to your Pinterest account or your browser) or similar technologies to capture log data. When we use cookies or other similar technologies, we use session cookies (that last until you close your browser) or persistent cookies (that last until you or your browser delete them). For example, we use cookies to store your language preferences or other settings so you don‘t have to set them up every time you visit Pinterest. Some of the cookies we use are associated with your Pinterest account (including information about you, such as the email address you gave us) and other cookies are not. For more detailed information about how we use cookies, please review our Cookies Policy.
2063	0	We may use your email address when you contact our customer service group to contact you about your gaming experience with Mobirate games and notify you about company news and promotions.
2608	1	Analyzing site traffic and trends, and generally understanding the online behaviors and interests of people who interact with our services We may also allow others to provide audience measurement and analytics services for us, to serve advertisements on our behalf across the Internet, and to track and report on the performance of those advertisements. These entities may use cookies, web beacons, SDKs, and other technologies to identify your device when you visit our site and use our services, as well as when you visit other online sites and services. Please see our Cookie Statement for more information regarding the use of cookies and other technologies described in this section, including regarding your choices relating to such technologies.
168	1	Cookies. We use “cookies” – small data files – to collect this information, which allows us to identify your browser and to improve your use of our services when you access our website. You can reset your web browser to refuse all cookies or to indicate when a cookie is being sent, however, some features of our services may not function properly if the ability to accept cookies is disabled.
1838	0	To customize your experience
2677	0	To collect aggregated data from your chat history. We use the data to build language models which help us improve the Service. We will only collect this data on an aggregated basis, and in a manner which does not reveal any personally identifiable information about any individual user. We will use this data to help us understand our users’ interests, analyze trends, and customize the user experience.
2918	0	1.1 Information that you submit
3373	1	"A cookie is a small data file that LONG TECH NETWORK LIMITED transfers to users’ computer’s hard disk, generally to quickly identify a user's computer and to ""remember"" things about the user's visit, such as the user’s preferences or a user’s name and password. The Service sends cookies to users’ computers when users access or view content of an LONG TECH NETWORK LIMITED game. Information contained in a cookie may be linked to users’ personal information for purposes such as improving the quality of our service, tailoring recommendations to users’ interests, and making the Service easier to use. Users can disable cookies at any time, although users may not be able to access or use features of the Service."
4165	1	We and/or our web-space providers collect data about every access to our services (that includes our websites) (via what is referred to as server log files). This data includes: user’s activity data in applications, including progress in the game, ID numbers generated automatically, the user’s operating system, the referrer URL (the previously visited page), the IP address and the requesting provider. We only use the log data for analyses, bug tracking, for the purposes of operating, fraud prevention, securing and optimizing the offer and/or the product.
2281	1	Medium doesn’t track you across the Internet. We track only your interactions within the Medium network (which encompasses Medium.com and custom domains hosted by Medium).
4320	0	Data retention periods for other Processors are indicated by the links above.
4389	1	In some cases, the site feature you choose may allow a third party to place cookies or local storage devices on your computer. The third party who places cookies on your device is responsible for how they process their data and Topface recommends that you read their privacy policies. Third parties who place cookies on your device when you use Topface include, and we have included a link to their privacy policies:Twitter, https://twitter.com/privacyFacebook, https://en-gb.facebook.com/policy.phpYouTube, http://www.google.co.uk/intl/en/policies/privacy/VK.COM, https://vk.com/privacyOK.RU, https://ok.ru/privacy
5064	1	The specific categories of first and third party cookies served through our Platform and the purposes they perform are described in the table below (please note that the specific cookies served may vary):Types of cookie
2865	0	The text to the right is aimed to give a plain English summary of our Privacy Policy. Please ensure you read the main text on the left, as the plain English summary on the right is just a summary and doesnﾡﾯt capture all of the terms.
3606	1	This Policy does not apply to, and we are not responsible for the data collection practices of these third party advertisers, and we encourage you to check their privacy policies to learn more about their use of cookies and other technology. You may visit https://help.chartboost.com/legal/privacy for information about Chartboost, http://www.admob.com/home/privacy for information about Google AdMob, and https://www.facebook.com/about/privacy/advertising for information about Facebook. We reserve the right to work with advertising networks other than those mentioned above.
117	0	1. In General
3402	1	"In addition we also use social media cookies. You may register for Platform membership and ""share"" Platform content through social media such as Facebook and Twitter. Sometimes we embed videos from websites like YouTube. These websites have their own privacy policies which govern their use of information, which you can find on the respective websites."
736	0	You may modify your account information on your profile page at any time. If you believe the personal information we have about you is inaccurate, you may also email us at any time to update such inaccurate information.
2557	1	To ensure the normal operations of the website, secure easier access for you and recommend content that may be of interest to you, we will store small data files called cookies on your computer or mobile device. Cookies often contain identifiers, site names and some numbers and characters. Cookies allow the website to store your preferences and other data.
3788	0	This includes enabling you to use the Service in a seamless manner and preventing or addressing Service errors or technical issues.
2927	1	We may feature advertisements served by third parties that deliver cookies to your computer/device so the content you access and advertisements you see can be tracked. Since the third party advertising companies associate your computer/device with a number, they will be able to recognize your computer/device each time they send you an advertisement. These advertisers may use information about your visits to our Service and third party sites and applications in order to measure advertisement performance and to provide advertisements about goods and services of interest to you. This Policy does not apply to, and we are not responsible for the data collection practices of these third party advertisers, and we encourage you to check their privacy policies to learn more about their use of cookies and other technology.
4612	0	Our automatic algorithms can also use anonymized sets of phone numbers to calculate the average number of potential contacts an unregistered phone number may have on Telegram. When you open the ‘Invite friends’ interface, we display the resulting statistics next to your contacts to give you an idea of who could benefit most from joining Telegram.
931	0	Overmobile processes information that the User provides about him/her on registration or authorization, as well as during further use of the Application, including filling in User’s profile, approaching Overmobile for technical support or using the feedback form, taking part in promotions, etc.
2605	0	if Stanga or Shine Media is involved in a merger, acquisition, or sale of all or a portion of its assets, you will be notified via email and/or a prominent notice on our Website of any change in ownership or uses of this information, as well as any choices you may have regarding this information.
740	0	Grounds for retention: E-Commerce Act
