	sentiment	review
1644	1	We may use cookies, including Flash cookies, transparent GIFs, server log analysis and other tracking technologies, currently existing and as they are developed, to enhance your experience with the Applications and Services and track information about your use of our Applications and Services. Like many websites, our Site and third parties acting on our behalf, like Google Analytics, also store log files and use cookies and other tracking technologies to collect information. A cookie is a small data file that is transferred to your computer’s hard drive or mobile device for record-keeping purposes. Some cookies allow us to make it easier for you to navigate our Site and use our Applications and Services, while other cookies are used to enable a faster log-in process or to allow us to track your activities at our Site and Applications. Third party advertisers may also use, place or read cookies or other technologies on your browser, and those practices are subject to their own policies. We automatically collect the following information about you from your use of our Applications and Services through these technologies: language information, referring and exit pages, and URLs; your geo-location (with your permission), unique device identifier (as permitted), your computer or mobile device’s operating system and platform, the communication network associated with your computer or mobile device, and mobile device name and model, the date and time of your use of the Site, Applications and Services, and the length of time you play our Applications, and/or visit or use our Site and Services. We may use this information in the aggregate or we may combine it with personal information about you.
305	0	Tracking data is collected and processed separately from data specified in Article 2 of this Policy and cannot be merged with it.
2427	0	We welcome feedback about this policy at legal@medium.com.
2960	0	Our business may require us to transfer your Personal Data to countries to countries such as the People’s Republic of China or Singapore. We take appropriate steps to ensure that recipients of your Personal Data are bound to duties of confidentiality and security requirements.
2378	1	Information We Collect Automatically; Cookies and Other Tracking Technologies
1487	1	The Company uses cookies to save and occasionally search through data related to Members. Cookies are small text files sent from website servers to the user’s computer browser (e.g., Internet Explorer, Safari, Chrome, Firefox). Cookies identify the computers used by the Members but do not identify the individual Members themselves.
25	1	Web Beacons. Certain pages on the Services may contain “web beacons” (also known as Internet tags, pixel tags, tracking beacons and clear GIFs). A web beacon is a transparent graphic image placed on a web page or in an email, which indicates that a page or email has been viewed or that an email has been forwarded. In addition, a web beacon allows third parties to obtain information such as the IP address of the computer that downloaded the page on which the beacon appears, the URL of the page on which the beacon appears, the time the page containing the beacon was viewed, the type of browser used to view the page, and the information in cookies set by the third party. A web beacon may also tell your browser to get content from another server.
3494	1	When you visit the publicly available sections of Topface, a session ID cookie is placed on your computer that only lasts while you’re visiting. We also place persistent cookies (also known as local storage devices) on members’ computers, so that Topface remembers them and makes their login experience faster and easier. We may use persistent tracking cookies on your mobile device, mainly for security protection purposes, such as to prevent phishers, scammers, unauthorised log in attempts, and to help you access your hacked account. We do not use any information whilst you are logged off.
236	1	Cookies are files with small amount of data that is commonly used an anonymous unique identifier. These are sent to your browser from the website that you visit and are stored on your device internal memory.
4861	1	Information passively collected by Ubisoft may be used in an aggregated form or to identify specific patterns of you or any individual.
2035	0	We may use some aggregated data about how you use Telegram to build useful features. For example, when you open the Search menu, Telegram displays the people you are more likely to message in a box at the top of the screen. To do this, we calculate a rating that shows which people you message frequently. A similar rating is calculated for inline bots so that the app can suggest the bots you are most likely to use in the attachment menu (or when you start a new message with “@”). To turn this feature off and delete the relevant data, go to Settings > Privacy & Security > Data Settings and disable “Suggest Frequent Contacts”.
1601	0	Prineside built the Infinitode 2 app as a Freemium app. This SERVICE is provided by Prineside at no cost and is intended for use as is.
3516	0	If we intend to further process your data for any other purpose to those set out in this Privacy Policy, we shall provide you with details of this further purpose before we commence processing.
4559	1	The Websites may use cookies, small text files that are placed on your computer, smartphone and/or stored by the browser. If the respective server of our Website is again accessed by you, your browser sends the afore received cookie back to the server. The server can evaluate the information received in this manner in various ways. Cookies can, for example, be used in order to manage advertisements on the Website or to facilitate navigation on a webpage.
4876	1	The Game doesn`t use cookies to ensure proper.
2399	0	Users who are uncertain about which Personal Data is mandatory are welcome to contact the Owner.
5239	1	We need to use certain cookies and local storage devices to ensure our members have the best possible experience, such as assisting with your navigation of our site, ensuring pages load up quickly and respond faster to your requests for Topface services
3745	1	You may set your browser and your mobile settings to block cookies and local storage devices, but if you do so, you may not be able to access the features that Topface offers.
5346	0	Personal data is only collected in so far as it is technically required to provide the service, improve it (including games) and running analyzes. In no case will the data collected be sold or unlawfully passed on to third parties for any other reasons.
227	0	Finally—and this is important—you should understand that users who see the content you provide can always save it using any number of techniques: screenshots, in-app functionality, or any other image-capture technology. It’s also possible, as with any digital information, that someone might be able to access messages forensically or find them in a device’s temporary storage. If any deletion of user information of our App happens, we cannot promise that deletion will occur within a specific timeframe. And we may also retain certain information in backup for a limited period of time or as required by law.
5332	0	c – Information we obtain from our partners
4401	0	Through our third party advertising network partners, we may gather information about your devices when you install or play our Games, depending on the permissions you’ve granted. This may include:the make, model and operating system of your device;properties of your device, such as screen size and orientation, audio volume and battery;the mobile network operator linked to your device;the Games played;the country, time zone and locale settings on your device (i.e. country and preferred language);network connection type and speed;IP Address;MAC address;internet browser used to access the Games; andthe advertiser ID, which is an identifier unique to you if you use an Apple or Android device, but which doesn’t reveal your name.
4893	0	903 26 Umeå
4828	1	For some of our Apps we use third party tracking and data collection tools from our service providers for the purposes of tracking performance, ad visibility and privacy compliance of third party SDKs in our Apps.
3234	1	Cookies are small text files placed on your device to store data that can be recalled by a web server in the domain that placed the cookie. We use cookies and similar technologies for storing and honoring your preferences and settings, enabling you to sign in, providing interest-based advertising, combating fraud, analyzing how our products perform, and fulfilling other legitimate purposes. Microsoft apps use additional identifiers, such as the advertising ID in Windows described in the Advertising ID section of this privacy statement, for similar purposes.
3617	0	For external processing
292	1	You have the right to decide whether to accept or reject cookies. If you choose to set your web browser controls to reject cookies, you may still use our website though your access to some functionality and areas of our website may be restricted
2295	0	We use encryption (HTTPS/TLS) to protect data transmitted to and from our site. However, no data transmission over the Internet is 100% secure, so we can’t guarantee security. You use the Service at your own risk, and you’re responsible for taking reasonable measures to secure your account.
4154	1	Performance/Analytical Cookies: Performance/Analytical Cookies allow us to understand how users use our Services such as by collecting information on how often users use a particular feature of the Services. These aggregated statistics are used internally to improve the Services in a way that makes the Services interesting to as many users as possible. Performance/Analytical Cookies also help us measure the performance of our advertising campaigns in order to help us improve our campaigns and the Services’ content for those who engage with our advertising.
125	1	We also use ﾡﾰweb beaconsﾡﾱ to help deliver cookies and gather usage and performance data. Our websites may include web beacons, cookies, or similar technologies from third-party service providers.
4915	0	We may use and disclose personal data to enforce our Terms and Conditions of Use, to protect our rights, privacy, safety, or property, and/or that of our affiliates, you or others, and to respond to requests from courts, law enforcement agencies, regulatory agencies, and other public and government authorities, or in other cases provided for by law
1013	0	If you decide to object to processing Personal data concerning you, or you otherwise demand us to remove your Personal data, you accept that you will not be able to use our games and services. We will ask you to cease to use our apps and services.
3921	0	To send you marketing communications
4768	0	 Advertisements contained on Our Games operate as links to that advertiser’s websites and as such any information they collect by virtue of Your clicking on that link will be collected and used in accordance with the privacy policy of that advertiser.
4985	0	It probably goes without saying, but we’ll say it anyway: When you contact HOLLA Support or communicate with us in any other way, we’ll collect whatever information you volunteer.
2800	0	Analysis of your content (e.g., activity logs, and direct feedback from you) which is sent or received using an online feature of an Adobe app or website, or which is stored on Adobe servers.
5042	1	In addition, our Partners may use their own tracking technologies (including and without limitation: SDKs, cookies, Web beacons, HTTP cache, local shared objects and other technologies) in order to track impressions, clicks, installs or other advertising campaign performance indicators for the purposes of measuring third party advertising campaign performance.
2518	0	4(F) Maintain Legal or Regulatory Compliance Processing is necessary for compliance with our legal obligations, the public interest, or in your vital interests.
2946	0	To contact us with your questions or comments regarding this Privacy Policy or the information collection and dissemination practices of the Site, Applications or Services, please email us at privacy@bolegames.com
2814	0	To make a request, please us know by sending an email to privacypolicy@kwalee.com.
851	0	FACE CAM, OPERATED BY NIXI TECHNOLOGY CO.,LTD., YOUR 3D AVATAR FACE CAMERA. YOUR PRIVACY IS A TOP PRIORITY TO US AND WE APPRECIATE THAT YOU PUT YOUR TRUST IN US. WE ARE COMMITTED TO THE RESPONSIBLE MANAGEMENT, USE AND PROTECTION OF PERSONAL INFORMATION.
2993	0	We use Google Analytics' Demographics and Interest Reporting feature to collect information about use of the Site. Google Analytics collects information such as how often users visit the Site, what pages they visit when they do so, and what other sites they used prior to coming to the Site. We will not facilitate the merging of your Personal Data with non-personally identifiable information collected through Google Analytics unless we have given you notice of that merger. You may opt-out of Google Analytics tracking with the Google Analytics opt-out browser add-on.
1699	1	We use two types of cookies: session cookies (which are erased once you close the browser or shut down the device) and persistent cookies (which remain even after closing the browser or shutting down the device/application and which are activated each time you visit the Sites).  The session cookies use encrypted data to unambiguously authenticate you. The persistent cookies do not store account numbers or passwords.
4065	1	You can delete cookies that already exist on your computer from your hard disk manually at any time.
3798	0	If someone from the invitees does not register within a few days after the invitation, we can send them a reminder of your invitation. You can invite all your friends or just some of them, but please remember the minimum age for Topface. You are responsible for the consent of your friends to receive invitations.
4766	0	To communicate with you about any career requests, contact forms, helpdesk support and to understand how you use our Services so that we can continuously improve our offerings, our legal basis is performance of a contract, legitimate interests or consent depending on the particular case to keep our users updated about our Services and our new features in accordance with your preference, and to continue to improve the Services we offer.
3894	1	 Provide differentiated information depending on the individual’s area of interest.
4680	0	Medium may periodically update this Policy. We’ll notify you about significant changes to it. The most current version of the policy will always be here and we will archive former versions of the policy here.
2821	0	Where we have relied on our legitimate interests to process your information, you may contact us to obtain more information, including in relation to our assessment of the impact on you.
3518	0	Last modified:2019/02/15
3347	0	In-Service communication features are enabled by default, in order that Camsurf may transmit important information regarding your usage, if necessary. Such communications may not be subject to certain opt-out provisions, as discussed below, for all classes of Users. If you have any questions about communications features, you may contact Camsurf at Privacy@Camsurf.com. We may require Users that have not registered an account to provide additional information, in order to remedy any privacy questions or concerns they may have.
3856	0	(c) Right to restrict the use of your personal information.
2089	1	We collect information by placing cookies on a computer or mobile phone. Cookies is a piece of text stored on your device by your web browser. Cookies stores information about visiting a website, recognizes you and your preferences every time you visit Topface, and provides the functionality of the site, allowing us to provide services to our users upon request.
3763	0	You have the right to access information held about you. Your right of access can be exercised in accordance with the Republic of Cyprus Law on Legal Protection of Personal Data. Any access request may be subject to a small administrative fee to meet our costs in providing you with details of the information we hold about you. Contact us at: info@icongames.info for details.
3161	0	With this list, we try to be as clear and complete as possible, but we find it important to keep this Privacy Policy legible, so there may be some other information that we may collect.
3920	1	Uber and its partners use cookies and other identification technologies on our apps, websites, emails, and online ads for purposes described in this policy.
2947	1	 Provide personalized service to Members on their next visit/use by tracking content that the Members showed an interest in.
282	0	If we deleted your profile because you violated our minimum age rule, we can save your email and IP addresses so you do not try to bypass our rules by creating a new profile.
2969	0	We will not sell, trade, rent or disclose any of the personal information you provide to us for any reason, without your prior consent. Otherwise, your Personal Information will only be disclosed where required or allowable by law. We may share generic aggregated demographic information not linked to any personal identification information regarding visitors and users with our business partners, trusted affiliates and advertisers for the purposes outlined above.
1535	1	"You can determine if and how a cookie will be accepted by configuring the privacy setting of the browser you are using to access the Platform or the ""privacy setting"" of your device. As the means by which you can refuse cookies through your web browser controls vary from browser-to-browser, you should visit your browser's help menu for more information. If you adjust the privacy setting in the browser, your device will continue collecting data unless you adjust the privacy setting of the device, and vice versa"
2505	0	Changes. We will notify you of changes to the data processing activities described in this Privacy Policy by posting a prominent notice on the Website or the Apps or as otherwise required by law.
2390	1	9.1.4 If you do not want CXZH.LTD to transfer Cookies into your web browser, you may change your web browser setting to refuse Cookies or notify you when any website is attempting to this transaction. This refusal shall affect your option to use certain products and/or services provided on our websites.
4730	1	More information on how third parties may use cookies in our Services go to Appendix A and Appendix B further below.
1734	0	We store your up-to-date contacts in order to notify you as soon as one of your contacts signs up for Telegram and to properly display names in notifications. We only need the number and name (first and last) for this to work and store no other data about your contacts.
1303	1	Do we use 'cookies'?
4037	0	Your driver rating is available in the Ratings tab of the Uber Partner app.
4963	0	In certain circumstances, you have the following data protection rights:The right to access, update or to delete the information we have on you. Whenever made possible, you can access, update or request deletion of your Personal Data directly within your account settings section. If you are unable to perform these actions yourself, please contact us to assist you.
3512	0	Information We Collect Automatically
2782	1	"A cookie is a small text file that we transfer to your computer and/or device, to identify a user's computer/device and to ""remember"" things about your visit, such as your preferences or a user name and password."
3912	1	We use cookies and other technologies to track the use of our websites and apps. To learn about opportunities to choose not to allow cookies, click here. If you are using our Site in a browser, this information is also available in our Cookies Policy.
3026	0	"This privacy and data policy (“Privacy Policy”) applies and has effect in respect of all games, related online services (including online network play connectivity and interactivity) and other software and products made available by us (together the ""Game(s)""), as well as any other online features relating to the Games including our website (http://www.kwalee.com/).  Together the Game(s) and the Website are referred to as the “Online Services”."
3319	0	Page view and actions statistics
3175	0	If you would like to find out more about the way Fabric, Tenjin, AppsFlyer, Game Analytics, AppOnboard and SOOMLA collects and processes this information this is likely to be set out in their privacy policies and/or terms and conditions. Please refer to https://docs.fabric.io/android/fabric/data-privacy.html, https://www.appsflyer.com/privacy-policy, https://apponboard.com/legal/privacy-policy/, https://soomla.com/privacy-policy, https://www.tenjin.io/privacy/, https://gameanalytics.com/privacy
3619	1	Do Not Track (“DNT”) is a privacy preference that users can set in certain web browsers and devices. DNT is a way for users to inform websites and services that they do not want certain information about their webpage visits collected over time and across websites or online services. Please note that we do not respond to or honor DNT signals or similar mechanisms transmitted by web browsers.
3679	1	"This section explains how we use cookies and similar technologies (we'll refer to them collectively as ""cookies"") to recognize you when you visit our Platform. It explains what these technologies are and why we use them, as well as your rights to control them. "
1566	0	We use your information to perform our own analytics and to enable analytics provided by third parties and other essential functions. We use analytical information for supporting business analysis and operations, business intelligence, product development, improving the Services, personalizing content, providing advertising, and making recommendations. In order to learn about how your information is used by our analytics service providers, you can follow the hyperlinks in the list below to each provider’s privacy notice.
3403	1	Whenever you interact with our Services, we automatically receive and record information on our server logs from your browser or device, which may include your IP address, device identification, “cookie” information, the type of browser and/or device you’re using to access our Services, the page or feature you requested and the Content that you have already accessed. “Cookies” are identifiers we transfer to your browser or device that allow us to recognize your browser or device and tell us how and when pages and features in our Services are visited and by how many people.  You may be able to change the preferences on your browser or device to prevent or limit your device’s acceptance of cookies, but this may prevent you from taking advantage of some of our features.
4419	1	6.3 All of the major browsers offer tips and guidance for managing the cookies available on your browser. There are also lots of different third party browser plugins and extensions available which you can download to make it easier to see and control your cookies.
1257	0	This section of the Privacy Policy applies only if you use our Sites or services covered by this Privacy Policy from a country that is a Member State of the European Union, and supplements the information in this Privacy Policy.
1999	0	Information you provide to us
3093	1	Cookies are files with a small amount of data that are commonly used as anonymous unique identifiers. These are sent to your browser from the websites that you visit and are stored on your device's internal memory.
5414	0	Unfortunately, no method of transmission over the Internet, or method of electronic storage, is 100% secure. We do our best to protect your personal data, nevertheless, we cannot guarantee its absolute security. In the event that your personal information is compromised as a breach of security, we will promptly notify you in compliance with applicable law.
1499	1	We want to inform you that whenever you use our Service, in a case of an error in the app we collect data and information (through third party products) on your phone called Log Data. This Log Data may include information such as your device Internet Protocol (“IP”) address, device name, operating system version, the configuration of the app when utilizing our Service, the time and date of your use of the Service, and other statistics.
1328	0	send you, with your prior consent, promotions or marketing materials (we will provide you with the opportunity to opt out of receiving such materials in the future)
1703	0	Note regarding international users. Your information will be transferred to and maintained on computers located in the United States (or any other country where we operate) and processed there. By providing us with your information, you are accepting and agreeing to that transfer.
4646	1	How can I control cookies?
4267	1	9.4 We use mobile analytics software to allow us to better understand the functionality of our Mobile Software on your phone. This software may record information such as how often you use the application, the events that occur within the application, aggregated usage, performance data, and where the application was downloaded from. We do not link the information we store within the analytics software to any personal identifiable information you submit within the mobile applications.
