	sentiment	review
677	0	"We have established relationships with other parties and websites to offer you the benefit of products and services which we do not offer. We offer you access to these other parties and their websites either through the use of hyperlinks to these sites from our Sites or through offering ""co-branded"" sites in which both we and other parties share the same uniform resource locator (URL), domain name or pages within a domain name on the Internet. In some cases you may be required to submit Personal Data to register or apply for products or services provided by such third parties or co-branded partners. This Privacy Policy does not apply to these third party sites or co-branded sites. The privacy policies of those other parties may differ from ours, and we have no control over the information that you submit to those third parties. You should read the relevant privacy policy for those third party sites and co-branded sites before responding to any offers, products or services advertised by those parties"
3771	0	This page is used to inform visitors regarding my policies with the collection, use, and disclosure of Personal Information if anyone decided to use my Service.
644	1	You can also make choices about the collection and use of your data by Microsoft. You can control your personal data that Microsoft has obtained, and exercise your data protection rights, by contacting Microsoft or using various tools we provide. In some cases, your ability to access or control your personal data will be limited, as required or permitted by applicable law. How you can access or control your personal data will also depend on which products you use. For example, you can:
2014	0	In the interests of security and to improve the user experience, all users must undergo verification of the account. For verification, we send a letter to your e-mail address. This is necessary only to make sure that the email address belongs to you. In addition, we are struggling with the creation of fake accounts that can be used to harm other users, as well as to commit cybercrimes - such accounts pose a threat to the Topface community and prevent other users from enjoying communication. We use your e-mail address based on the above legitimate interests and to prevent fraud and cybercrime.
4205	0	Uber retains transaction, location, usage and other information for 7 years in connection with regulatory, tax, insurance or other requirements in the places in which it operates. Uber thereafter deletes or anonymizes such information in accordance with applicable laws.
1719	0	This section only applies to users of our Services that are located in the European Economic Area, United Kingdom and/or Switzerland (collectively, the “Designated Countries”) at the time of data collection. We may ask you to identify which country you are located in when you use some of the Services, or we may rely on your IP address, MCC (mobile county code) to identify which country you are located in.
2872	0	Tantan Cultural Development Beijing Limited and its affiliates (hereinafter referred to as 'we', 'us' or 'our') are well aware of the importance of your personal information to you and will exercise our best efforts to protect the security and reliability of your personal information. We are committed to maintaining your trust in us and abiding by the following principles to protect your personal information: accountability, purpose limitation, opt-in, data minimization, security, subject participation, openness and transparency, etc. At the same time, we promise that we will use well-developed security solutions in the industry and take the corresponding security protection measures to protect your personal information. NOW, THEREFORE, we have drafted this Tantan Privacy Policy (hereinafter referred to as the 'Policy / Privacy Policy') and remind you of the following:This Policy applies to the products and services of Tantan, and prior to using the products and services of Tantan, you must read this Policy carefully and thoroughly understand this Policy, and use the relevant products or services upon confirming that you fully understand and agree to this Policy. By starting to use the various products or services of Tantan, you have fully understood and agreed to this Policy. If you have any questions, opinions or suggestions concerning the content of this Policy, please use the various contact details provided by Tantan to contact us.
243	1	the necessity for the purposes of the legitimate interests pursued by the Company or by a third party.
4083	1	Offer, obtain, provide or facilitate insurance or financing solutions in connection with our services.
4086	0	For security purposes, you may need to provide a written request or prove your identity through other means. We may first request you to verify your identity before processing your request.
1558	1	We use the facial tracking and mapping information we collect to enable facial effect features when using the Service.
3850	1	Where it is necessary for the performance of a contract with you
4927	1	provide you with advertising that better suits your interests and profile and is age-/gender-appropriate and targeted to your general location
5162	0	The User declares to be aware that the Data Controller may be required to reveal personal data upon request of public authorities.
2285	1	offer you the opportunity to take part in playtesting (game tests)
2616	1	We use this information to notify winners and award prizes, to monitor traffic or personalize the Service. We may use a third party service provider to conduct these sweepstakes or contests; that company is prohibited from using your users’ personal information for any other purpose.
864	1	Adobe uses the information we collect about you for the following purposes:
539	1	• To better understand how users access and use our Applications and Services, both on an aggregated and individualized basis, in order to improve our Applications and Services, analyze player traffic and activity, respond to user desires and preferences, and for other research and analytical purposes.
1963	0	when you use our Services, we may process some of the following information about you:Name and surname;e-mail address;User name;IP address;Technical information about the devices that you use as part of using the Services;Information related to the use of the Services by you, in particular metric information;Information on your use of social media, in case where you associate the use of the Services with your social media accounts – to the extent necessary to provide you with all the functionalities of the Services;Any other data that you provide to us through our Services.
1698	1	We collect information in a few different ways:1. When you give it to us or give us permission to obtain it
1623	1	FINDNOW may use the collected information so as to obtain, develop, analyze and personalize the Services Users, partners and third party providers. More specifically, FINDNOW can use this information for all purposes in all projects the Company possesses, and additionally for other applications and projects which the Company does not own for the purposes indicated below:a.    To ensure use and sharing your information with respect to the use of your session or payment service providers, online services, social networking sites and utilization of other third party services,
786	1	Analytics and research: understanding and analyzing trends in connection with the usage of the Apps, gathering demographic information about our user base, data about where the App was downloaded from. We may also create reports and analysis for the purposes of research or business intelligence, for example to track potential problems or trends with our Apps and services, or to test our new game features and content. We use the data we receive from Third Party Social Network only for internal analytics. For opting out from analytics please visit Opt-Out Section of this Privacy Policy.
2840	0	Deleting your personal data. You can request erasure of your personal data by sending us an email at support@get-headway.com.
5059	0	We use cookies to store visitors preferences, customize Web page content based on visitors browser type or other information that the visitor sends. Cookies are required to use Todoist.
339	0	By using our Site and our Services you understand and agree to the terms of this privacy policy and you expressly consent to the collection, use and disclosure of your Personal Data in accordance with this policy. If you do not agree to this policy, do not install, use, or access our Site or our Services. We may update this policy from time to time and will post updates to this policy on this web page, including the policy's effective date.
4490	1	Codigames does not sell or rent your Personal Information to third-parties for marketing purposes without your consent. Codigames may share your Personal Information you provide with Codigames subsidiaries and related companies. Codigames may share Personal Information with business partners that assist Codigames in providing you services. Codigames is committed to giving you the choice whether or not Codigames uses your information for marketing purposes or shares information with business partners.
1842	1	We use your data to help maintain the safety, security and integrity of our services and users. This includes, for example:Screening drivers and delivery partners prior to enabling their use of our services and at subsequent intervals, including through reviews of background checks where permitted by law, to prevent use of our services by unsafe drivers.
3133	0	● Information we automatically collect about you:● Activity Data.We collect information about your use of the Services through third-party analytics tools. These tools collect information sent by your device or our Services, including the web pages you visit, add-ons, and other information that assists us in improving the Service. We anonymize or aggregate such information so that it cannot reasonably be used to identify any individual User.● Device Information.When you use a mobile device (e.g., a tablet or smartphone) to access our Services, we may access, collect, monitor, store on your device, and/or remotely store one or more 'device identifiers.' Device identifiers are small data files or similar data structures stored on or associated with your mobile device, which uniquely identify your mobile device. A device identifier may be data stored in connection with the device hardware, data stored in connection with the device's operating system or other software, or data sent to the device by GOGO LIVE. A device identifier may deliver information to us or to a third party partner about how you browse and use the Service and may help us or others provide reports or personalized content and ads. Some features of the Service may not function properly if use or availability of device identifiers is impaired or disabled.● Log File Information.Log file information is automatically reported by your browser each time you make a request to access (i.e., visit) a web page or app. It can also be provided when the content of the web page or app is downloaded to your browser or device. When you use our Service, our servers automatically record certain log file information, including your web request, Internet Protocol ('IP') address, browser type, referring / exit pages and URLs, number of clicks and how you interact with links on the Services, domain names, landing pages, pages viewed, and other such information. In addition, in Settings, other user log information including all your activities in our Product, such as gifting, commenting, logging in, recharging details, will be uploaded to us to help fix bugs, etc. The information allows for more accurate reporting and improvement of the Services.
130	1	This helps us to better understand our business, analyze our operations, maintain, improve, innovate, plan, design, and develop the App and our new products. We also use such data for statistical analysis purposes, to test and improve our offers. This enables us to better understand what features and categories of books our users like more, what categories of users use our App. As a consequence, we often decide how to improve the App based on the results obtained from this processing. For example, if we discover that users more often read book summaries from “Productivity & time management” category, we may create and introduce more of book summaries into this category.
1124	1	This includes enabling you to use the Service in a seamless manner and preventing or addressing Service errors or technical issues.
877	0	We do not knowingly collect personally identifiable information from anyone under the age of 18. If you are a parent or guardian and you are aware that your child has provided us with Personal Data, please contact us. If we become aware that we have collected Personal Data from children without verification of parental consent, we take steps to remove that information from our servers.
5406	1	To prepare statistics relating to the use of our Services by you and other customers Legitimate interests so we can understand the use of, and therefore improve, our Services
3979	1	We use third party tracking and data collection tools from our service providers, such as AppsFlyer and 24metrics, for the purposes of measuring performance and optimizing our advertising campaigns, displaying advertisements, conducting analysis to improve our services and for fraud prevention purposes. Such tools may use cookies, APIs, and SDKs in our Apps to enable them to collect and analyze user and device related data and information, such as impressions, clicks, installs or other advertising campaign performance indicators and post-install in-app events.
4719	0	Our company keeps its privacy policy under regular review and places any updates on this page and the revised version will be effective when it is posted. Please take a look at the “LAST UPDATED” date at the top of this page to see when this privacy policy was last revised; this privacy policy was last updated on 27th May. If we materially change the ways in which we use or share personal information previously collected from you through the Services, we will notify you through the Services, by email, or other communication. If you do not agree to the new version, you must stop using the Services completely – in order to make the Services work properly we need to have everyone using them under the same rules instead of different people having different rules.
3447	0	Some of the Services may be characterized by interaction with our Trusted Partners. Therefore, we may share some of your personal information with our Trusted Partner, which will be protected based on their privacy policies. Due to the optionality of such access, it will be preceded by your explicit consent, which you can always withdraw.
4796	1	When you become a user of the Service, we will collect the statistic about users’ behavior and location. By learning and analyzing the statistic, we will improve the service and product to be better. In the course of interacting with Tunnellight VPN, we may need specific information from you to enable Tunnellight VPN to solve the problem and improve the service as soon as possible. Please note that access to your personal information is in accordance with Tunnellight VPN’s retention and access policy.
1006	0	Updated 5/31/18
4152	1	To provide you with information about, and support for, our Services, including changes to our Services, technical updates to our Services, and changes to the Terms (including this Privacy Policy) Necessary for the performance of a contact and necessary to comply with a legal or regulatory obligation
551	0	8. How to Contact us.
1356	0	When you use the App, some information about your device and your user behaviour may be processed automatically. This information is generally non-personal, and we may access it only in aggregated form. We process this information on the ground of our legitimate interest in improving our App and giving our users the best experience. Otherwise we may not be able to provide you with all the requested services and features of the App.
533	1	Whenever you use our services, we aim to provide you with access to your personal information. If that information is wrong, we strive to give you ways to update it quickly or to delete it – unless we have to keep that information for legitimate business or legal purposes.
1525	0	Protection of Company and Others
336	0	2. What personal information does Ubisoft collect?
2881	1	The purposes of the technical information are (i) to operate and update the Software and the Services and provide you with existing and new functionality and features; (ii) to improve and customize the Software and the Services; (iii) to provide you personalized content, including through the delivery of targeted interest-based advertisements from us or our partners; (iv) to maintain and improve the quality and operation of the Software and the Services; and/or (v) to notify you of Software and Services updates.
4017	0	Domain name: http://codigames.com
2683	1	Contact you for administrative and informational purposes. This may include providing customer service or sending communications, including changes to our terms, conditions, and policies.
681	0	Please be aware, however, that no method of transmitting information over the Internet or storing information is completely secure. Accordingly, we cannot guarantee the absolute security of any information.
40	1	Relying on our legitimate interests
1192	1	To be in accordance with CANSPAM, we agree to the following:
1731	0	Should you request so by informing us on privacy@outfit7.com, we will send you all the updates of this Privacy Policy to your e-mail. We will also inform you about any material updates of our Privacy Policy with an in-app banner and a link.
3466	0	You have an option to opt out from sharing your information and data for the purposes of interest-based advertising at all times. When you opt out, you will not stop receiving ads, they just won't be based on topics you like, your interest, behavior, demographics, etc. You can opt out by choosing one of the following options (for more information please read the ''Opt Out'' Section of our Privacy Policy):
2121	1	We use the information we have to improve our advertising and measurement systems so we can show you relevant ads on our Games and products and measure the effectiveness and reach of ads and services.
1341	0	- If you choose to make use of any public forum, comment section, or chat function, we may collect any Personal Information you may disclose through such means. 
3768	0	To help us improve our service we keep info about how you use our service.
1575	1	We may use this information to create a user profile and provide you services.
5074	0	To prevent the rights and interests of others from material detriments;
326	0	You may also request a copy of your personal data collected during your use of the App at support@get-headway.com.
1294	1	To notify you about changes to our Service
5031	0	Where we process personal information for marketing purposes or with your consent, we process the information until you ask us to stop and for a short period after this (to allow us to implement your requests). We also keep a permanent record of the fact that you have asked us not to send you direct marketing or to process your information so that we can respect your request in future.
2344	1	To keep you informed of offers and promotions relating to our Services and those of other entities within our group, provided that you don’t “opt-out” from this option Legitimate interests so we can send you information about our Services (and promotions and offers) that you may be interested in
2929	1	c.    Providing content for 3rd party applications
1809	0	o marketing and advertising platforms, such as Google, Twitter, Facebook and Instagram, and providers of analytics services relating to users’ behavior, in order to tailor the content you see when visiting our Platform. These platforms may combine information they collect on our Platform with data on their platforms and data they collect from other websites or through other sources in order to conduct targeted advertising.  The processing activities of these third party marketing platforms are governed by their own privacy policies, not this Privacy Policy;
5077	0	With third parties as part of a merger or acquisition. If HOLLA gets involved in a merger, asset sale, financing, liquidation or bankruptcy, or acquisition of all or some portion of our business to another company, we may share your information with that company before and after the transaction closes.
2612	0	Digital Advertising Alliance (Canada) – http://youradchoices.ca/choices
1503	0	If there is a breach of security involving your personal information, including credit card information, from our Services, we will inform you immediately according to your local regulations relating to the notification of information Breaches, and take commercially reasonable steps to rectify such breach.
3329	0	We also guarantee that employees of CarX Technologies Limited and all its affiliates that deal with Your personal data are under confidentiality and non-disclosure of personal data agreements.
112	1	We use information collected through our Service for purposes described in this Policy or disclosed to you in connection with our Service. For example, we may use your information to:- Create game accounts and allow users to play our games;- Identify and suggest connections with other Mobirate users;- Operate and improve our Service;- Understand you and your preferences to enhance your experience and enjoyment using our Service;- Respond to your comments and questions and provide customer service;- Provide and deliver products and services you request;- Deliver advertising and marketing and promotional information to you;- Send you related information, including confirmations, invoices, technical notices, updates, security alerts, and support and administrative messages;- Communicate with you about promotions, rewards, upcoming events, and other news about products and services offered by Mobirate and our selected partners;Enable you to communicate with other users; and- Link or combine it with other information we get from third parties, to help understand your preferences and provide you with better services.
889	1	To allow you to access your chat history, photos, videos and missed calls for your own purposes.
3844	1	Uber may use the information we collect to communicate with you about products, services, promotions, studies, surveys, news, updates and events.
2390	0	9.1.4 If you do not want CXZH.LTD to transfer Cookies into your web browser, you may change your web browser setting to refuse Cookies or notify you when any website is attempting to this transaction. This refusal shall affect your option to use certain products and/or services provided on our websites.
5079	0	the personal data have to be erased for compliance with a legal obligation in Union or Member State law,
652	0	“ICBC Mobile Banking” provides financial services to overseas users, and users who use the client should be those with independent financial capacity. We do not collect information on minors who do not have independent financial capacity.
1561	0	The information you choose to provide above may be shared with your contacts on our service. You have total control over your profile information and you can access to modify at any time. In addition, if you register to our service with your Facebook account (e.g. Facebook Connect), we may store your Facebook ID and corresponding token on our servers and, if you give us your expressed consent, we will have access to and may collect certain information that you make available on Facebook (for example, your first and last names, email address, profile picture, your friend lists and birthdays). Your Profile is available to other users of the Service who are connected to you on our service. In addition, unless you opt-out (which you may do so at any time in the settings of our application), your Profile is discoverable by other users. You may choose to “block” any user on our platform to prevent unwanted access of your Personal Information.
5367	1	We use the information we collect about you for the following purposes:
1941	0	We will retain Your information for the duration of Your membership of the Games and/or whilst you continue to have access to the Games and for a reasonable period thereafter or as long as the law requires or permits. Your personal information will be deleted when You explicitly gives up the Games usage namely request your account deletion or request Us to delete Your personal data. If you send us such requests, We will delete your personal data as soon as technically possible. The period process of erasing personal data can take up to one month. Considering the complexity and number of requests, this period may be extended by a further two months.
439	0	After you have deleted your account we only store Data if it is legally necessary (because of warranty, limitation or retention periods) or otherwise required.
3892	1	Understand and analyze aggregate usage trends, improve the Services, and develop new products, services, features, and functionality.
2208	0	We ask that you keep the information that you provide to us updated. You can correct any information you have provided to us by contacting us through support@ngames.mobi
2818	1	To customize your experience, to conduct research and development to test and introduce new features and products, and to improve and monitor the effectiveness of our Service.
