	sentiment	review
3840	1	 We collect and use your Personal Data for the following purposes:verifying your identity;verifying your eligibility to register as a user of the Sites or become a blogger or an influencer of the Sites;processing your registration as a user, providing you with a log-in ID for the Sites and maintaining and managing your registration;providing you with customer service and responding to your queries, feedback, claims or disputes;facilitating communication between buyers and sellers on the Sites, processing transactions and payments, assessing advance withdrawal requests from sellers and providing delivery services;assessing account security and transaction risks of members, detecting and preventing fraud and other security incidents;personalizing our communication with you based on your browsing records, equipment information we collected and your order history, and performing research or statistical analysis in order to improve the content and layout of the Sites, and to improve our product offerings and services, including, for example, using anonymized data for machine learning purposes;identifying, developing and marketing products and services that we believe you will value, including across browsers and devices, in accordance with applicable laws. Cookies or other similar technologies may be used to provide you with advertising based upon your browsing activities and interests (see section E. COOKIES below).  Where we are required by applicable law, we will seek your consent prior to sending you communications for marketing purposes; andWe may also use your Personal Data for other purposes that are not incompatible with the purposes we have disclosed to you (such as archiving purposes in the public interest, scientific or historical research purposes, or statistical purposes) if and where this is permitted by applicable data protection laws.
141	0	When you access or use the App, we automatically collect general information about you, including:Log Information: We log information about your use of the App, including the type of device you use, the features you use, access times and your IP address.
3755	0	I value your trust in providing us your Personal Information, thus we are striving to use commercially acceptable means of protecting it. But remember that no method of transmission over the internet, or method of electronic storage is 100% secure and reliable, and I cannot guarantee its absolute security.
855	0	If Merger Game is involved in a merger, acquisition or asset sale, we will continue to ensure the confidentiality of any personal information and give affected users notice before personal information is transferred or becomes subject to a different privacy policy.
1097	1	In addition to the information contained in this privacy policy, this Application may provide the User with additional and contextual information concerning particular services or the collection and processing of Personal Data upon request.
2287	0	You may also deactivate your account. To deactivate your account, please email us indicating in English that you would like to deactivate your account and you will receive the deactivation instructions from us. You will need to complete the steps in order to deactivate your account. Once your account is deactivated, you will not be able to restore your account again and your data on LIKE will be erased after certain period of time (usually within 24 months).
2931	0	Candivore may share your information in connection with any merger, sale of our assets, or a financing or acquisition of all or a portion of our business to another company.
5372	1	This Application uses identifiers for mobile devices (including Android Advertising ID or Advertising Identifier for iOS, respectively) and technologies similar to cookies to run the Firebase Analytics service.
588	0	In addition, we take reasonable steps to assure that third parties who collect personal information on our behalf provide sufficient protection of personal information in addition to requiring their compliance with this Privacy Policy at all times.
5417	1	• to send you marketing communications
1838	1	To customize your experience
2521	0	This may include:User profile: We collect information when you create or update your Uber account. This may include your name, email, phone number, login name and password, address, payment or banking information (including related payment verification information), government identification numbers such as Social Security number, driver’s license or passport if required by law, birth date, photo and signature. This also includes vehicle or insurance information of drivers. This also includes the preferences and settings that you enable for your Uber account.
2066	0	Information from other service providers: We receive information about you from some of our service providers who assist us in offering and improving our Services by providing information about how you use our Services and by helping us to maintain the security and integrity of our platform.
43	0	Disclosure and Transfer of Personal Data
585	0	f you wish to make a complaint over the processing of your personal data, you have the right to lodge a complaint to the relevant supervisory authority.
515	0	Your personal data may also be subject to processing, storage or transfer outside your country of residence and outside of the European Economic Area (EEA). Due to the fact that regulations concerning the protection of personal data in these countries may not guarantee the same level of protection as in your country or in the EEA, each time we will base our actions on standard EU clauses or Privacy Shield Framework, allowing you to transfer your data and provide the right level of protection.
2261	0	This Privacy Policy was promulgated on June 3, 2019. Any changes (e.g., addition, deletion or revision) to this Privacy Policy pursuant to amendments in the Company’s or Korean government’s policy will be notified in advance to the Members on the Company’s website. For material changes that may significantly impact the Members’ rights, notice will be given 30 days prior to the scheduled effective date of such changes.
1579	0	For legal reasons
5148	0	In particular, if we transfer personal data originating from the EEA to countries with not adequate level of data protection, we use one of the following legal bases: (i) Standard Contractual Clauses approved by the European Commission (details available here), or (ii) the EU-U.S. Privacy Shield Framework (details available here), or (iii) the European Commission adequacy decisions about certain countries (details available here).
575	1	To connect you with other imo users in your mobile device address book.
1116	1	For advertising purposes
2446	0	We may update this Privacy Policy from time to time in response to changing legal, technical or business developments. When we update our Privacy Policy, we will take appropriate measures to inform you, consistent with the significance of the changes we make.  We will obtain your consent to any material Privacy Policy changes if and where this is required by applicable data protection laws.
4469	0	Adobe apps and websites
3703	1	The services contained in this section enable Us to monitor and analyze game data and can be used to keep track of User behavior.
1225	1	Personal Information. In the course of using the Service, we may collect personal information that can be used to contact or identify you (“Personal Information”). Personal Information is or may be used: (i) to provide and improve our Service, (ii) to administer your use of the Service, (iii) to better understand your needs and interests, (iv) to personalize and improve your experience, and (v) to provide or offer software updates and product announcements. If you no longer wish to receive communications from us, please follow the “unsubscribe” instructions provided in any of those communications, or update your account settings information.
943	1	We use your personal information to provide and improve our Services, provide you with a personalized experience on our sites, contact you about your account and our Services, provide you customer service, provide you with personalized advertising and marketing, and to detect, prevent, mitigate and investigate fraudulent or illegal activities.
4996	0	Log file information is automatically reported by your browser each time you make a request to access a web page or app. It can also be provided when the content of the webpage or app is downloaded to your browser or device. We may also collect similar information from emails sent to our Users which then help us track which emails are opened and which links are clicked by recipients. The information allows for more accurate reporting and improvement of the Service.
5001	0	Turning the Wuma VPN on encrypts all of the traffic between your device and our servers using TLS 1.2 with perfect forward secrecy (ECDHE), 128-bit/256-bit AES data encryption, and HMAC message authentication. This means that your web traffic on unsecured networks such as public Wi-Fi at cafés, airports, etc. will be securely encrypted by Wuma.
1320	1	We process your personal data to respond to your requests for technical support, Service information or to any other communication you initiate. This includes accessing your account to address technical support requests. For this purpose, we may send you, for example, notifications or emails about the performance of our Service, security, payment transactions, notices regarding our Terms and Conditions of Use or this Privacy Policy.
2050	0	It probably goes without saying, but we’ll say it anyway: If you contact us directly, we may receive additional Personal Information about you. For example, when you contact customer support, we receive the contents of messages or attachments that you send to us, and other information you choose to provide.
1641	1	We are conducting surveys in order to improve our services and you may freely decide whether you would like to help us or not.
4885	0	Changing or Removing Account Information
4714	1	Your mail address may be used if we have merchandise or other physical promotional materials that we want to send to you.
3803	0	We do not share personal information with companies, organizations and individuals outside of Merger Game unless one of the following circumstances applies:With your consent
1518	0	Email: privacy@roosterteeth.com
3422	1	GameAnalytics ApS https://gameanalytics.com/privacy
1477	0	Grounds for retention: E-Commerce Act
5328	0	We collect technical data necessary for you to use our App and additional technical data that enables us to maintain and analyze the functioning of the App, to personalize the content of the App, and to display advertisements.
4701	0	 Information Collection and Use
3196	1	Location-related information: We use location-related information-such as your current location, where you live, the places you like to go, and the businesses and people you're near-to provide, personalize and improve our Products, including ads, for you and others. Location-related information can be based on things like precise device location (if you've allowed us to collect it), IP addresses, and information from your and others' use of Facebook Products (such as check-ins or events you attend).
1331	1	To administer and protect our Services (including troubleshooting, data analysis, testing, support, fraud, reporting and hosting of data), our legal basis for processing is legitimate interests for running our business, provision of administration and services.
2627	0	• When you visit our websites, we may collect device-specific information, such as the unique mobile ID, hardware model, operating system version, browser type, language, internet service providers and mobile network names. We only use it to provide and improve the website, troubleshoot, and perform analytics.
4715	0	You can withdraw your consent to cookies on our website at any time. Please note that such withdrawal may mean that you will no longer have access to all the functions offered by our website as explained in the COOKIES section of this Privacy Policy.
1358	1	We use the information we have (including from research partners we collaborate with) to conduct and support research and innovation on topics of general social welfare, technological advancement, public interest, health and well-being. For example, we analyze information we have about migration patterns during crises to aid relief efforts. Learn more about our research programs.
1276	1	Provide Customer Support. We process your personal information when you contact us to help you with any questions, concerns, disputes or issues, or to provide us with your feedback. Without your personal information, we cannot respond to you or ensure your continued use and enjoyment of the Services.
500	0	We may update this Privacy Notice from time to time in response to changing legal, technical or business developments. When we update our Privacy Notice, we will take appropriate measures to inform you, consistent with the significance of the changes we make. We will obtain your consent to any material Privacy Notice changes if and where this is required by applicable data protection laws.
4616	0	By default all content you post on Canva is private. If you do choose to make designs or other information public, that information may remain visible even after your remove it via cached and archived pages, or if other users have made copies.
4070	1	To communicate with you regarding your use of our Service
5159	1	7 Information that is created by you while placing requests to our Services support We use this information in order to verify your identity and to fullfil your support request. We may also use this data in order to investigate any complaints on your behalf and to provide you with a more efficient service. Legitimate interests
2726	0	In principle, we will not charge you for reasonable requests, but for repeated requests that exceed a reasonable level, we will charge you for certain costs as the case may be. We may reject requests that are repeated without just cause, require excessive technical means (such as requiring the development of a new system or a fundamental change in existing practices), expose the legitimate rights and interests of others to risks or are extremely impractical.
4283	1	How Does Trip.com Use My Personal Information and What are the Related Lawful Bases?
2724	0	"Your right to object to the processing of your personal data for direct marketing purposes is free of charge and can be exercised without having to state grounds by clicking the ""unsubscribe"" link in any promotional or commercial e-mail we send you."
2063	1	We may use your email address when you contact our customer service group to contact you about your gaming experience with Mobirate games and notify you about company news and promotions.
4853	1	Enforce our Terms of Service
2569	0	To protect against legal liability
4738	1	To cross-advertise our Services and products and to send push notifications for changes to our Services, to allow you to participate in new features of our Services when you choose to do so, our legal basis is legitimate interests to be able to advertise our Services and products to our users and keep our users updated about our Services and our new features in accordance with your preference.
1197	1	monitor and analyze trends and usage.
5083	0	When you use the Software and the Services, for analytical, business and operational purposes, we automatically collect and store the following information:Technical Information. Certain technical information regarding your device, and your use of the Software and the Services, including the type, name and version of operating system and other software including, without limitation: (i) ISP (Internet Service Provider), Internet protocol (IP) address, Media Access Control (MAC) address, anonymous user identifiers, device configuration and identifiers; (ii) Advertising ID (Identifier for Advertisers used in Android, such as Google advertising ID (GAID)); (iii) location; (iv) Android ID.
5055	1	• operate and improve our service;
725	0	Last updated:31/1/2018
134	0	Additional data you provide when you edit your Services profile or settings section such as avatar picture and language preferences.
0	1	Ensure Compliance, by recording Consents and Opt-out Requests related to the information automatically collected or voluntarily given, as required under GDPR and other data protection laws. Assist law enforcement, and other agencies by reporting illegal activity if brought to our attention, and we believe in our discretion such action is warranted.
5197	0	I may employ third-party companies and individuals due to the following reasons:To facilitate our Service;To provide the Service on our behalf;To perform Service-related services; orTo assist us in analyzing how our Service is used.
1969	0	In this section, we are letting you know what legal basis we use for each particular purpose of processing. For more information on a particular purpose, please refer to Section 2. This section applies only to EEA-based users.
3794	1	We process your personal data, such as physical characteristics and food preferences, to adjust the content of the Service and make offers tailored to your personal preferences. As a result of such processing, you get access, for example, to a nutrition plan containing only vegetarian products.
5388	1	To comply with the law
87	0	4. WHAT PERSONAL INFORMATION DO WE SHARE WITH THIRD PARTIES?
3649	1	To operate our business and to enhance your gaming experience, we may use your information in the following ways:· To operate, improve, develop and provide you with our games, apps and Services· To provide you with recommendations and game offers that you may like· To respond to inquiries or comments from you· To verify your identity in order to prevent unauthorized access· To provide you with software updates· To understand trends in usage· To calculate marketing conversion rates and other elements of advertising performance· To help tracking and correcting errors and bugs in games and services· To customize your user experience· To maintain the integrity and security of the Services· To process transactions and communicate with you regarding these transactions· To maintain or administer your DoubleUGames account, including contacting you in order to update your DoubleUGames account details if necessary· To create reports, analyses or similar for the purpose of research and business intelligence and be able to track potential problems, behaviour and trends· To enforce our Terms of Service and this Privacy Policy· To send you newsletters and promotional notices and offers· To keep our Services fair, investigate and prevent fraud and illegal behavior· To comply with applicable laws and regulations
4904	0	Firebase Analytics
4984	1	Displaying advertisements: displaying third party advertisements in our Apps and showing advertisements for our Apps in other publisher’s apps. Please see more in Advertising Section of this Privacy Policy.
5026	0	object to the processing of your personal data if you have serious and legitimate reasons relating to your specific circumstances that justify such an objection.
4973	1	Wherever we rely on your consent, you will always be able to withdraw that consent, although we may have other legal grounds for processing your data for other purposes, such as those set out above. In some cases, we are able to send you direct marketing without your consent, where we rely on our legitimate interests. You have an absolute right to opt out of direct marketing, or profiling we carry out for direct marketing, at any time. You can do this by contacting us using the details set out below.
4132	1	To manage your account and provide you with customer support
543	0	dwords is an app add-on used to attribute users that have discovered our app via the Adwords advertisement services. The attribution is performed based on a referral ID or other link that informs where the user has found our app.
3835	0	We do not knowingly collect personally identifiable information from children under 13. If you are a parent or guardian and you learn that your Children have provided us with Personal Information, please contact us. If we become aware that we have collected Personal Information from a children under age 13 without verification of parental consent, we take steps to remove that information from our servers.
4755	1	The Data concerning the User is collected to allow the Owner to provide its services, as well as for the following purposes: Access to third party services' accounts, Analytics, Contacting the User, Advertising, Registration and authentication, Managing contacts and sending messages.
76	0	For more information on how AdMob uses the collected information, please visit the Privacy Policy of Google: http://www.google.com/policies/privacy/
3267	1	To customize your experience
4548	1	The GDPR requires that companies processing the personal data of EU users do so on the basis of specific legal grounds. As described below, Uber processes the information of EU users based on one or more of the grounds specified under the GDPR:a. The processing is necessary to provide the services and features you request
1769	1	Where necessary, a copy of your identity or  another document containing your name, surname, photograph, number of the principal identity document of you or your representative, payment details and another additional data, with that you may provide us, including through our support service. We may take additional verification steps where we consider reasonable in order to verify your account. We use this data in order to identify you, verify your account and prevent abuse and infringements of your or other persons' rights.
3501	0	We may provide links to third-party Web sites. The Site may also carry advertisements from other companies. When you click on links of third parties in an Application, the Services or the Site, you may leave the Application, the Services or the Site. We do not collect your information on and through and this Privacy Policy does not address, and we are not responsible for, the privacy practices of Web sites operated by third parties, whether they are linked to or otherwise accessible from an Application, the Services or the Site. The inclusion of a link or accessibility of third party Websites does not imply endorsement of such third party Website by us.
2227	0	We may modify this Policy, our Terms of Use and our Cookie Policy from time to time. If we make material changes to it, we will provide you notice through the Service, the Website, via email or by other means, to provide you the opportunity to review the changes before they become effective. You shall be responsible for reviewing and becoming familiar with any such modifications. We agree that changes cannot be retroactive. If you object to any changes, you may close your account or discontinue use of the Services. Your continued use of our Services after we publish or send a notice about our changes to these terms means that you are consenting to the updated terms.
4767	0	Transfer your information in the event that imo is involved in a merger, acquisition, divestiture, consolidation, reorganization, asset sale, or bankruptcy
3326	0	We will store your personal data for as long as it is reasonably necessary for achieving the purposes set forth in this Privacy Policy (including providing the Service to you), which includes (but is not limited to) the period during which you have an account with the App. We will also retain and use your personal data as necessary to comply with our legal obligations, resolve disputes, and enforce our agreements.
5008	0	Sharing with Third-Party Partners
3356	0	We provide our partners with some information about the way you use our app so they can advertise products and services that are more likely to be relevant to you.
2189	0	It will be up to you to decide to give such permission or not. Yet please understand that if you deny such permissions, certain functions may be disabled. For example if you do not allow UC Browser to access to your location information, online map will not know where you are and search engine will not be able to provide location based search results; if you do not allow UC Browser to read your files, you may not upload attachments to your mailbox. You can always manage the permissions via your phone setting.
625	1	To enable communications to or between users
4656	0	3.1. In order to implement the agreement between you and us, and provide you with access to the use of the Services, we will improve, develop and implement new features to our Services, and enhance the available Services functionality. To achieve these objectives, and in compliance with applicable laws, we will collect, store, aggregate, organise, extract, compare, use, and supplement your data (hereinafter “processing”). We will also receive and pass this data, and our automatically processed analyses of this data to our affiliates and partners as set out in the table below and section 4 of this Privacy Policy.
4325	1	To gather analysis or valuable information so that we can improve our Service
3199	1	We may analyze, evaluate, and/or aggregate this information to help us understand your interests and the interests of our other users, to analyze trends, to optimize your user experience and improve the Service.
1468	1	We may process non identifiable Analytics so that we can analyse and improve our Games and Online Services.
3263	0	If you have any questions or concerns about our use of your personal information, then please contact us using the contact details provided at the bottom of this Privacy Notice.
