	sentiment	review
3043	0	A minor must not create his or her own user account without the consent of his or her parent or guardian. If you are a minor, we recommend that you ask your parent or guardian to read this Privacy Policy carefully, and obtain the consent of your parent or guardian before using our services or providing us with information.
2698	0	If you wish to review or change the information we have about your children, email us at privacysupport@pikpok.com.
4501	0	The Userhas the right to withdraw his or her consent at any time. The withdrawal of consent shall not affect the lawfulness of processing based on consent before its withdrawal. Withdrawal is made by the mere notification of the LLC “WebmartGroup” via its Support service, i.e. by sending an e-mail to the address info@adwebmart.com with the topic “Consent withdrawal” or in the Settings menu of the application.
2682	0	Information You Provide To Us:You may choose to provide Personal Information through the Services. The Organization will collect Personal Information when you contact us through the Services or otherwise communicate or interact with us.  In addition, you may submit Personal Information about other people. The Organization will use any information that we collect from you about another person to carry out your request. If you do not want your Personal Information collected, please do not submit it.
3908	0	Adobe® Digital Editions Adobe Sign Adobe Stock
1048	1	 The personal data that is moved to the separate database will not be used for purposes other than required or permitted by law.
395	1	to provide non-child users that have given us consent to share their advertising IDs with our ad network partners (as further specified under Sharing of Information) for the purpose of serving them with personalized advertisement in the App (behavioral advertising).
181	1	Other things you should know:We may share aggregated information about the Service and our users, without seeking additional consent, with third parties (including, without limitation, advertisers, media, and actual or potential partners or investors) for informational, marketing, and/or promotional purposes.
4783	0	The right to data portability
238	0	You can enable or disable Do Not Track by visiting the Preferences or Settings page of your web browser.
1512	0	If you use our Services via mobile devices, after obtaining your prior consent, we can send you push notifications or local notifications to inform you about updates.
2945	0	We want to inform you that whenever you use our Service, in a case of an error in the app we collect data and information (through third party products) on your phone called Log Data. This Log Data may include information such as your device Internet Protocol (“IP”) address, device name, operating system version, the configuration of the app when utilizing our Service, the time and date of your use of the Service, and other statistics.
576	0	We have implemented security measures to safeguard and help prevent unauthorised access, maintain data security, and correctly use the personal information collected through the Services.
545	1	In addition to any opt out offered by any of the services below, the User may opt out of a third-party service's use of cookies by visiting the Network Advertising Initiative opt-out page
5212	0	At Wuma, we stand behind our commitment to user privacy and security. When you access our websites and use our best-in-class VPN products, you’ll share some information with us, which we use to provide and improve our products, send notifications and updates, troubleshoot, and to support our free product through advertising. Our goal is to be upfront about what we collect, how we use it, and whom we share it with, and that’s why we’ve written this Privacy Policy. This Privacy Policy also tells you about your rights and choices with respect to your information, and how you can contact us if you have any questions or concerns. Below is a snapshot of some of our important privacy practices, but please read the full Policy for more detail. If you have any questions about anything in this Policy.
97	1	Provide customized reading experience
1675	1	How we use information we collect
4966	1	We process your personal data, such as reading preferences, to adjust the content of the Service and make offers tailored to your personal preferences. As a result of such processing, we will show on the home screen of the App more books from, for example, “Motivation & Inspiration” category.
3806	1	contact you to promote our Services and contests we may offer
2647	1	In principle, once the personal data’s purpose of collection/use is achieved, the Company destroys the subject personal data without delay in accordance with the respective retention/use period. The procedure, method, and time for destroying personal data are as follows:Procedures for destroying personal data
4240	0	PLEASE READ THIS PRIVACY POLICY CAREFULLY. BY ACCESSING OR USING THE SERVICE, YOU AGREE TO BE BOUND BY THE TERMS AND CONDITIONS DESCRIBED HEREIN AND ALL TERMS AND CONDITIONS INCORPORATED BY REFERENCE. IF YOU DO NOT AGREE TO ALL OF THE TERMS AND CONDITIONS SET FORTH BELOW, YOU MAY NOT USE THE NaveedZafar SERVICE.
2699	0	The App offers social sharing features and other integrated tools (such as the Facebook “Like” button), which let you share actions you take in the App with other media. You must be over the minimum age limit that is prescribed by the legislation in the individual jurisdictions to use any social sharing features integrated in the App. The use of such features enables the sharing of information with your friends or the public, depending on the settings you establish with the entity that provides the social sharing feature.
3222	1	 Personalize Your Experience. We allow you to personalize your experience on our Services via social media plugins on our Services (e.g., Facebook, Google, Instagram, WhatsAppp, etc.), by keeping track of your preferences (e.g., nickname or display name, time zone, language preference, etc.), and more. Without such processing, you may not be able to access or personalize part or all of our Services.
958	0	We want to inform users of this Service that these third parties have access to your Personal Information. The reason is to perform the tasks assigned to them on our behalf. However, they are obligated not to disclose or use the information for any other purpose.
2436	0	We may rely only on non-manual automatic decision-making mechanisms including information systems and algorithms to make decisions for certain operation functions. If such decisions significantly impact your legitimate rights and interests, you have the right to request an explanation from us, and we will also provide a method of appeal without prejudice to the trade secrets of Tantan, or the rights and interests of other users and the interests of the general public.
3281	0	User Provided Information 
1325	0	If you have a Medium account, you can access, modify or export your personal information, or delete your account here.
597	1	·      To solve problems,
273	0	BY USING THE SERVICE, YOU PROMISE US THAT (I) YOU HAVE READ, UNDERSTAND AND AGREE TO THIS PRIVACY POLICY, AND (II) YOU ARE OVER 16 YEARS OF AGE (OR HAVE HAD YOUR PARENT OR GUARDIAN READ AND AGREE TO THIS PRIVACY POLICY FOR YOU). If you do not agree, or are unable to make this promise, you must not use the Service. In such case, you must (a) delete your account using the functionality found in “Settings” in the App, or contact us and request deletion of your data; (b) cancel any subscriptions using the functionality provided by Apple (if you are using iOS) or Google (if you are using Android); and (c) delete the App from your devices.
347	0	In order to use, or process your information as described above, we rely on the following legal bases:We will only process your information for as long as we have a relevant legal basis to do so, in order to provide you with the services you have requested, and as required in performance of the Agreement you have entered into with us by accepting our Terms of Use.
2067	1	Uber may also use the information to promote and process contests and sweepstakes, fulfill any related awards, and serve you relevant ads and content about our services and those of our business partners. You may receive some of these communications based on your profile as an Uber user. Users in the EU have have the right to object to this type of processing; see Section II.I.1.d for more information.
1709	1	Protect against or deter fraudulent, illegal or harmful actions
2317	0	The Company collects personal data of the Members as above, but it does not collect sensitive personal data (e.g., race and ethnicity, ideology and beliefs, birthplace and domicile, political views and criminal record, health status and sex life) that may infringe upon the basic human rights of the Members and particular identification data.
847	0	c. Deletion
4740	0	Please note that we may ask you to verify your identity before responding to such requests.
1720	0	Please note: the app will never store your contacts and your call history. The app accesses the contacts on the phone in order to display the contacts and so the app can record or ignore calls from specific contacts. While we are intensity focused on protecting you from unknown calls, we are just as concerned with making sure important calls are not missed. Access to contacts helps us filter out numbers that may look spam, but are actually legitimate (like your Doctor’s office). We also access contacts to identity callers under the name you prefer to see, to enable your ability to add numbers to your blocklist.
4418	1	Google Privacy Policy: https://policies.google.com/privacy
2073	0	We may ask for certain information such as a username, your first and last name, birthdate, phone number, profession and e-mail address when you register for a Canva account, or if you correspond with us. We may also retain any messages you send through the Service, and may collect information you provide in User Content you post to the Service. We use this information to operate, maintain, and provide to you the features and functionality of the Service. We may also use this information to correspond with you, and to address any issues you raise about the Service.
5410	0	Contact and complaints
3248	1	 We may also use Your information to contact You about the Games or to send You other content We think may be of interest to You. We will only do this if You have so consented or requested to receive such information when you downloaded the Games. If at any time You no longer wish to be contacted, please let Us know in writing and We will arrange this
1710	1	Uber collects and uses personal information to the extent necessary for its legitimate interests. This includes collecting and using information:To maintain and enhance our users' safety and security. For example, we collect background check information (where permitted by law) to prevent unsafe users from providing services through our apps. We also use personal information to prevent use of our services by users who have engaged in inappropriate or dangerous behavior, such as by retaining information of banned users to prevent their use of Uber's apps. We also use usage information to prevent matching of riders and drivers for whom there is higher risk of conflict (e.g., because they have been the subject of prior complaints from other users).
5037	1	3) On other occasions where we ask you for consent, we will use the data for the purpose which we explain at that time.
2624	1	For marketing purposes, such as sending marketing messages, or campaign attribution and optimization for user acquisition
2862	1	How does Adobe use the information it collects about me, and what are the legal bases for these uses?
1337	0	Personal Data
5280	0	Information collected through the Game
5289	0	We do not knowingly collect, maintain, or use personal information from children under 13 years of age, and no part of our Services are directed to children. Legally you must be at least 13 years old to use the Services (but this might be older depending on whether or not a particular Service has a required minimum age rating) as per our Terms of Service. If you learn that a child has provided us with personal information in violation of this Privacy Policy, then you may alert us at support@ftxgames.com.
590	1	Duration of Processing of Personal Data.
2479	1	1 Data you provide for registering in the Services including your email and/or mobile phone number We use this information in order to manage and administer the Services provided to you.
1549	0	There are two general categories of information we can process.
2335	1	To allow you to access your chat history, photos, videos and missed calls for your own purposes.
3289	0	Device signals: Bluetooth signals, and information about nearby Wi-Fi access points, beacons, and cell towers.
5058	1	We only use the information that we collect from you for internal purposes. The following are the ways we may use information that we collect:Operate, maintain, deliver, and communicate with you about information, advertisements, content, and promotional offerings found on the Sites;Monitor the effectiveness of our content;Aggregate usage metrics (such as total number of visitors to the Sites and pages viewed and application usage and downloads);Understand usage trends and preferences;Improve the way the Services work and look;Improve our marketing and promotional efforts;Provide you with a personalized experience on the Services (such as recognizing your system so that you will not have to re-enter information during your current or future visit to the Sites);Provide you with external product and service suggestions based on your preferences and interests;Provide you with customized Site preferences;Create new features and functionality;For customer service purposes, including billing, where applicable.
2831	1	The data we collect depends on the context of your interactions with us, the choices you make, including your privacy settings, and the products and features you use. The data we collect can include SDK/API/JS code version, browser, Internet service provider, IP address, platform, timestamp, application identifier, application version, application distribution channel, independent deice identifier, iOS ad identifier (IDFA), Android ad master identifier, network card (MAC) address, and international mobile device identification code (IMEI) The equipment model, the terminal manufacturer, the terminal device operating system version, the session start / stop time, the location of the language, the time zone and the network state (WiFi and so on), the hard disk, the CPU, and the battery use, etc.
2801	0	Your IP address, however, which only determine the coarse location and cannot identify your physical location. 
3	1	Google Analytics for Firebase (Google Inc.)
2982	1	• understand you and your preferences to enhance your experience and enjoyment using our service;
4448	0	"The terms ""GI""/""we""/""our""/""us"" when used in this Privacy Policy means Monster Game, and ""you""/""your"" means you as a user of our Service."
4778	0	Users in the EU have the right to object to Uber's processing of personal data, including for marketing purposes based on profiling and/or automated decision making. Uber may continue to process your information notwithstanding the objection to the extent permitted under GDPR.
2500	0	3.Under the condition that no private information of an individual user is disclosed, LIKE has the right to analyze the entire user database and utilize the database for commercial purposes.
353	1	Engage in Marketing Activities. We may process your contact information or information about your interactions on our Services to: send you marketing communications; deliver targeted marketing; inform you about events, webinars, or other materials, including those of our partners; and, keep you up-to-date with our relevant products and Services. Transactional communications about your account or our Services are not considered “marketing” communications. In addition, when you share your friends’ contact information with us, we may reach out to them to invite them to our Services and to continue receiving our communications. You can unsubscribe from marketing communications at any time without charge.
3056	1	Uber may also use the information to inform you about elections, ballots, referenda and other political and policy processes that relate to our services.
239	1	Meet contract or legal obligations
702	0	We may also share information with others in an aggregated and anonymous form that does not reasonably identify you directly as an individual.
3294	0	It is a natural person who can be identified directly or indirectly, in particular by reference to an identification number or to one or more factors specific to his or her physical, physiological, mental, economic, cultural or social status.
3660	0	We use cookies and similar technologies to facilitate and customize your use of our Services. A cookie is a small data file, which we store on your computer or mobile device that can later be retrieved to identify you to us. We may use cookies and similar technologies, among other things, to:(a) allow us to recognize you and your device;(b) allow our Services to interact with a third-party social network or platform (where you have chosen to allow such interaction);(c) allow our payment processors to process your payment instructions;(d) provide you with more customized Services, for example to provide our Services in your preferred language; or(e) obtain data which will allow us to understand how people are using our Services so that we can improve them.
4506	1	To market our products and services and to provide you with materials about offers, products, and Services that may be of interest, including new content or Services, including tailoring content, advertisements, and offers, and to notify you of offers, products and services that may be of interest to you, for other purposes disclosed at the time that you provide your information, or otherwise with your consent.
4759	1	Provide support and assistance for the Services
5358	0	We do not use cookies for tracking purposes
4398	0	Chat Data: In an ongoing effort to better understand and serve the users of the Services, Chatous often conducts research on its customer demographics, interests and behavior based on the Personal Data and other information provided to us. This research may be compiled and analyzed on an aggregate basis, and Chatous may share this aggregate data with its affiliates, agents and business partners. This aggregate information does not identify you personally. Chatous may also disclose aggregated user statistics in order to describe our services to current and prospective business partners, and to other third parties for other lawful purposes.
4953	1	If we use your user information in excess of the purposes stated at the time of collection and the scope of direct or reasonable association, before using such information, we will inform you by online notice or other means and obtain your express consent or authorization.
1708	0	Transaction Information
1967	0	We may choose to buy or sell assets. In these types of transactions, customer Information is typically one of the business assets that would be transferred. Also, if we (or our assets) are acquired or merged, or if we go out of business, enter bankruptcy, or go through some other change of control, Information would be one of the assets transferred to or acquired by a third party.
1377	0	If we ask you to provide Personal Data to comply with a legal requirement or to enter into a contract with you, we will make this clear at the relevant time and advise you whether the provision of your Personal Data is mandatory or not (as well as of the possible consequences if you do not provide your Personal Data). In some instances, you may be required to provide us with Personal Data for processing as described above, in order for us to be able to provide you all of our services, and for you to use all the features of our Sites.
2804	0	Any third-party platform that you use to access the Services may also retain backup copies of your information even after your account is deleted or terminated and may use them subject to their policies.
3485	0	In addition, the Application may collect certain information automatically, including, but not limited to, the type of mobile device you use, your mobile devices unique device ID, the IP address of your mobile device, your mobile operating system, the type of mobile Internet browsers you use, and information about the way you use the Application.
2681	1	Magic Seven may use collected personal data for purposes of analyzing usage of the Services, providing customer and technical support, managing and providing Services (including managing advertisement serving) and to further develop the Services and other Magic Seven services and products. Magic Seven may combine non-personal data with personal data.
1179	0	You may contact us at any time for details regarding this Privacy Policy and its previous versions. For any questions concerning your account or your personal data please contact us at support@betterme.tips.
1691	0	If you do not want Ubisoft to send you communications about special rebates or promotional offers, you may opt-out from receiving these communications at the time your personal information is collected or by contacting us by:email at emea-email-support@ubisoft.com
680	1	5. Other Purposes
3577	1	Communications from Uber
732	0	Our Data Protection Officer (DPO) e-mail is: dpo@nekki.com. You may contact Our DPO in order to enforce Your rights provided in Section 4 Privacy Policy or receive additional information concerning processing of Your personal data. Our DPO performs its functions on behalf of the whole Nekki Limited
2035	1	We may use some aggregated data about how you use Telegram to build useful features. For example, when you open the Search menu, Telegram displays the people you are more likely to message in a box at the top of the screen. To do this, we calculate a rating that shows which people you message frequently. A similar rating is calculated for inline bots so that the app can suggest the bots you are most likely to use in the attachment menu (or when you start a new message with “@”). To turn this feature off and delete the relevant data, go to Settings > Privacy & Security > Data Settings and disable “Suggest Frequent Contacts”.
3241	0	For Users in the European Union: what rights do you have related to the processing of your personal data?
3978	1	 We deem confidential any information about You that has not been officially disclosed, published and/or revealed, is not publicly available or commonly known, as well as legally or illegally circulated by any third party, and that may represent economic, financial, commercial, legal or any other value by virtue of its being unknown to a third party. Your personal data may become available for third parties only in cases provided in this Privacy Policy.
3120	1	The information demanded from the users that will respond to periodic or non-periodic surveys organized within the Applications by NUMBER FINDER, can be used for direct marketing to customers, statistical analysis and to create a custom database by NUMBER FINDER and persons or institutions in cooperation with NUMBER FINDER.
2174	0	a) The User gives us a clear instruction for certain products and services of any third party which requires the User’s personal information;
2079	0	For users of the desktop imo app, we automatically collect your IP address;
5376	1	We use personal data to enforce our agreements and contractual commitments, to detect, prevent, and combat fraud. As a result of such processing, we may share your information with others, including law enforcement agencies (in particular, if a dispute arises in connection with our Terms and Conditions of Use).
4794	0	Information requested by an investigative agency pursuant to a search and seizure warrant
1948	1	analyze your profile and that of other users to recommend meaningful connections.
1255	1	For example, we use this information to verify your identity if you lose your credentials and wish to access your account with us.
3161	0	With this list, we try to be as clear and complete as possible, but we find it important to keep this Privacy Policy legible, so there may be some other information that we may collect.
2457	0	Information we may receive from third parties
499	0	You have the right to opt out of certain uses and disclosures of your personal information.
5347	1	- contact you to promote our Websites/Apps, contests and any specials we may offer; 
4864	0	We also share information with third parties when you have given us consent to do so (as indicated at the point such information is collected).
1308	0	"We encourage parents to visit the GetNetWise.org site and look through the ""Kids Safety"" section together. Your efforts to instill responsible information practices will help steer your children to age-appropriate sites and will go a long way toward ensuring that your children have enriching experiences online."
1814	1	We also use this information in order to provide you with updates and information on our and selected third parties' products and services we think you may be interested in. Legitimate interests
4113	0	If you withdraw your consent, we will cease processing of the data for which you have withdrawn consent, unless we have a legal obligation to keep some or parts of your data.
