	sentiment	review
1410	0	Friends Matching:  With your consent, we may periodically access your contacts and friends list on your mobile device and/or your social network account(s) that you use to sign in to our Website or Application.  We will use your contacts’ information to help you find your friends and play our Games socially with them.  
1644	0	We may use cookies, including Flash cookies, transparent GIFs, server log analysis and other tracking technologies, currently existing and as they are developed, to enhance your experience with the Applications and Services and track information about your use of our Applications and Services. Like many websites, our Site and third parties acting on our behalf, like Google Analytics, also store log files and use cookies and other tracking technologies to collect information. A cookie is a small data file that is transferred to your computer’s hard drive or mobile device for record-keeping purposes. Some cookies allow us to make it easier for you to navigate our Site and use our Applications and Services, while other cookies are used to enable a faster log-in process or to allow us to track your activities at our Site and Applications. Third party advertisers may also use, place or read cookies or other technologies on your browser, and those practices are subject to their own policies. We automatically collect the following information about you from your use of our Applications and Services through these technologies: language information, referring and exit pages, and URLs; your geo-location (with your permission), unique device identifier (as permitted), your computer or mobile device’s operating system and platform, the communication network associated with your computer or mobile device, and mobile device name and model, the date and time of your use of the Site, Applications and Services, and the length of time you play our Applications, and/or visit or use our Site and Services. We may use this information in the aggregate or we may combine it with personal information about you.
4090	1	We use mobile analytics software to allow us to better understand the functionality of our Mobile Software on your device. This software may record information such as how often you use the application, the events that occur within the application, aggregated usage, performance data, and where the application was downloaded from. We do not link the information we store within the analytics software to any personal information you submit within the mobile application.
364	0	The right to data portability
53	1	Uber may process personal information, including disclosing data with law enforcement authorities in case of threats to the safety of users or of others.
5428	0	Medium is hosted in the United States. By using the Services, you authorize Medium to transfer, store, and use your information in the United States and any other country where we operate. Where your data is disclosed to our processors, it is subject by contract to at least the same level of data protection as that set out in this statement.
4526	0	We care about the safety of your data and, we have implemented industry recognized measures to protect it, but unfortunately we canﾡﾯt guarantee that nothing bad will ever happen to it. (A troop of rabid baboons springs to mind).
3048	0	Our third-party ad tracking and analytics company never sends emails, notifications, or other communications to Our end users. Your choice to opt out of ad tracking and analytics services does not limit Our ability to email You or collect other information from You for other vendors, subject to the terms of this Privacy Policy.
4766	1	To communicate with you about any career requests, contact forms, helpdesk support and to understand how you use our Services so that we can continuously improve our offerings, our legal basis is performance of a contract, legitimate interests or consent depending on the particular case to keep our users updated about our Services and our new features in accordance with your preference, and to continue to improve the Services we offer.
4330	0	Mimo may change, update, suspend, make improvements to, or discontinue aspects of the services.
2060	1	To track the progress of your ride or delivery.
137	0	NOVA GEIMS, OOO, including its subsidiary companies (“NOVA GEIMS, OOO”), collects, stores, and uses your information as a data controller in connection with, and in order to provide and develop, NOVA GEIMS,OOO, mobile applications, services and websites (together referred to as the “Services”) in accordance with this privacy policy (“Privacy Policy”).
672	0	If you have previously consented to any direct marketing communication from us or subscribed to our newsletters, you can unsubscribe by clicking on a link available in each communication and newsletter we send you.
4310	1	This processing is also necessary for us to pursue our legitimate interests of (i) ensuring that our Online Services function properly so that you and other users have the best experience when playing any of our Game(s) and using the other Online Services; (ii) improving the quality of our Online Services, and providing a better experience to our users; (iii) identifying and correcting any bugs in the Games and Online Services and iv) understanding the effectiveness of our marketing to attract new users and re-engage our current users at an aggregated level.
2540	0	Filmigo cares about the security of your information and uses commercially reasonable physical, administrative, and technological safeguards to preserve the integrity and security of all information we collect and that we share with our service providers. However, no security system is impenetrable and we cannot guarantee the security of our systems 100%. In the event that any information under our control is compromised as a result of a breach of security, we will take reasonable steps to investigate the situation and where appropriate, notify those individuals whose information may have been compromised and take other steps, in accordance with any applicable laws and regulations.
4103	0	FINDNOW may change this Privacy Policy at any time without serving any notices or without serving any notices whatsoever. You should monitor this Policy from time to time. In the event of significant changes, FINDNOW will inform and notify the Users when using the message or Services. It will be deemed that you agree to the changes of the policy that you continue to use the Services once you have received the change notice or have posted the notice of change.
3417	1	Firebase Analytics may share Data with other tools provided by Firebase, such as Crash Reporting, Authentication, Remote Config or Notifications. The User may check this privacy policy to find a detailed explanation about the other tools used by the Owner.
4539	1	We process your personal data for our marketing campaigns. We may add your email address to our marketing list. As a result, you will receive information about our products, such as for example, special offers. If you do not want to receive marketing emails from us, you can unsubscribe following instructions in the footer of the marketing emails.
618	1	Provide, test, promote, and improve the Services
1531	1	What do we do with the information we collect? The short answer is: Provide you with an amazing set of products and services that we relentlessly improve. But we do a lot more as well, such as:Develop, operate, improve, deliver, maintain, and protect our products and services.Communicate with you.
1754	1	Where you give Adobe your consent or otherwise consistent with your choices:Sending you information about Adobe products and services, special offers and similar information, and sharing your information with third parties for their own marketing purposes (where your consent is required);Placing cookies and using similar technologies on our websites, on our apps and in email communications, in accordance with our Cookies Policy and the information provided to you when those technologies are used;Accessing information stored on your device relating to your use of, and engagement with, websites and apps (e.g., Adobe Connect meetings) and crash reports;Using automated systems to analyze your content using techniques such as machine learning in order to improve our services and the user experience (where your consent is required);On other occasions where we ask you for consent, we will use the information for the purposes which we explain at that time.
4153	0	Access times.
442	1	We may use the information you provided us to contact your from time to time to provide you with important information, required notices and marketing promotions.
3727	0	i. information that you provide us directly
5061	1	To provide you with information, products or services that you request from us or which we feel may interest you, where you have consented to be contacted for such purposes Legitimate interests so we can send you information about our Services (and promotions and offers) that you may be interested in, and Consent
998	0	Information that we automatically collect
2936	0	In connection with any sale of our company or any line of business (including the assets relating thereto), customer information generally is one of the transferred business assets, and such customer information (including your Personal Information) will be transferred or sold to the acquirer in the event of any such sale or disposition of any or all of our business. 
4753	1	  Use Of Your Information
617	0	Data Retention Policy, Managing Your Information
1747	0	Financial institutions and third-party payment agencies: When you place a booking, apply for a refund, or purchase insurance, we will share the related information with the relevant financial institutions or the third-party payment agencies, and as we believe is necessary for fraud detection and prevention, we will further share other necessary information (i.e. email address, phone number, and IP address) with the relevant financial institutions.
383	1	Telegram has two fundamental principles when it comes to collecting and processing private data:We don't use your data to show you ads.
346	0	Data Processor (or Service Provider) means any natural or legal person who processes the data on behalf of the Data Controller.
3647	0	We encourage law enforcement agencies to contact us via email (legal@bigo.tv) regarding the availability of user information before serving the formal request.
4331	1	By completing a guest review, you are agreeing that your guest reviews can be displayed by Trip.com as described in detail in our Terms of Use.
3671	0	I may employ third-party companies and individuals due to the following reasons:To facilitate our Service;To provide the Service on our behalf;To perform Service-related services; orTo assist us in analyzing how our Service is used.
3529	1	 Understand and analyze aggregate usage trends, improve the Services, and develop new products, services, features, and functionality
682	1	6 Information that is obtained by the “Main” account from your “extra” accounts such as Information that is received as the result of your behavioral actions when using the Services, that is received as the result of your using payment functionality of the Services (e.g. first and last four digits of your card number that are required in order to match these details with your account), etc. We use this information in order to manage and administer the Services including providing our services to you. Legitimate interests, which inter alia, include the processing of manifestly made public by you data where it is accessible by other users of the Services
4989	0	Identifiers: unique identifiers, device IDs, and other identifiers, such as from games, apps or accounts you use, and Family Device IDs (or other identifiers unique to Facebook Company Products associated with the same device or account).
3473	1	How Do We Use Your Personal Data? We process Personal Data to operate, improve, understand and personalize our Services. For example, we use Personal Data to:Create and manage user profiles
2408	1	The Personal Information you submit to us is used either to respond to requests that you make, or to help us serve you better. We use your Personal Information in the following ways:For improvement of PoleStarVPN Services Management;For improvement of PoleStarVPN Services experience;For better customer service;For feedback purposes;For product development and content improvement;In general, the Personal Information you provide to us is used to help us communicate with you. For example, we use Personal Information to contact users in response to questions, solicit feedback from users, provide technical support etc.
2823	1	In case we request you to provide us with your email address, which is highly rare; it will be used for the following purposes:Service emails (regarding updates, new design, new features, (new) games etc.);Administrative purposes, such as notification of a violation of our terms of use; delivering messages you have allowed us to forward (e.g. from other users in your social network).
2996	0	Welcome to use the service of Merger Game, when you use our service, you trust us with your information. So we’ve developed a Privacy Policy that covers how we collect, use, disclose, transfer, and store your information. Please take a moment to familiarize yourself with our privacy practices and let us know if you have any questions.
2748	0	Google Inc. https://policies.google.com/terms?hl=ru,https://firebase.google.com/terms/analytics/
4799	0	As noted in the Terms of Use, we do not knowingly collect or solicit personal information from anyone under the age of 13. If you are under 13, please do not attempt to register for the Services or send any personal information about yourself to us. If we learn that we have collected personal information from a child under age 13, we will delete that information as quickly as possible. If you believe that a child under 13 may have provided us personal information, please contact us at support@inkitt.com.
4525	0	We tried to follow your preferences for your service. We use Cookies to save and recorded information about you. Cookie refers sent to your browser by a web server a small portion of the data, the data stored on your computer's hard drive.
5242	1	We use this information in order to manage and administer the Services including providing our  Services to you.
2610	0	The online advertising industry also provides websites from which you may opt-out of receiving targeted ads from our data partners and our other advertising partners that participate in self-regulatory programs. You can access these, and also learn more about targeted advertising and consumer choice and privacy, at http://www.networkadvertising.org/managing/opt_out.asp, or http://www.youronlinechoices.eu/ and http://www.aboutads.info/choices/.
5340	1	facilitate sharing on social networks
2561	1	Personally identifiable information is used internally by Camel Games to deliver, develop and improve products, content and services, to which users have subscribed, and to answer users' requests. In addition, Camel Games may allow third parties performing services under contract with Camel Games, such as order or payment processors or merchandise warehouse and fulfillment services, located in and outside the European Union, to access and use personally identifiable information, but only to the extent necessary to provide those services.
5269	1	Perform data analysis in the interest of improving user experience, and developing countermeasures against illegal or unauthorized activities.
3931	0	Go to your Settings > Select Privacy > Select Advertising > Enable the “Limit Ad Tracking” setting
4955	1	We may also use this data in order to tailor and improve the adverts that are presented to you to and measure the effectiveness of these advertisements.
2346	1	Facial tracking and mapping information remains on your device and is not uploaded to our servers.
4318	1	To improve the security of your use of the services provided by us and our affiliates and partners, protect the personal safety of and prevent infringement of the property of yourself, other users, or the public, take better measures against phishing websites, fraud, network vulnerabilities, computer viruses, cyberattacks, network intrusions and other security risks, and more accurately recognize violations of laws and legislations or the provisions of relevant agreements and regulations of Tantan,we may use or combine your user information, transaction information, device information, related network logs and information shared by our affiliates and partners with your authorization or in accordance with the law to comprehensively determine your account and transaction risks, conduct identity verification, detect and prevent security incidents, and conduct the necessary recording, audit, analysis and disposal measures in accordance with the law.
4815	1	3. How Does GeoZilla Use Personal Information?
4903	0	Types of Data Collected
1072	1	We use this information to notify winners and award prizes, to monitor traffic or personalize the Service. We may use a third party service provider to conduct these sweepstakes or contests; that company is prohibited from using your users’ personal information for any other purpose.
2119	0	Grounds for retention: E-Commerce Act
1077	1	If any new purposes for processing your personal data arise, we will let you know we start to process information on that other purpose by introducing the corresponding changes to this Privacy policy.
3595	0	Your information collected through the App may be stored and processed or any other country in which Filmigo or its subsidiaries, affiliates or service providers maintain facilities. If you are located in the European Union or other regions with laws governing data collection and use that may differ from law of the company's location, please note that we may transfer information, including personal information, to a country and jurisdiction that does not have the same data protection laws as your jurisdiction, and you consent to the transfer of information to any other country in which Company or its parent, subsidiaries, affiliates or service providers maintain facilities and the use and disclosure of information about you as described in this Privacy Policy.
619	0	By using our application, you consent to our privacy policy.
3072	1	Whenever you use our services, we aim to provide you with access to your personal information. If that information is wrong, we strive to give you ways to update it quickly or to delete it – unless we have to keep that information for legitimate business or legal purposes.
17	0	(“Third Party Log In Information”)
1384	0	This policy sets out how Canva collects and uses the information that we collect about you when you use the Canva services. This policy also explains the choices that you can make about the way that we use your information.
456	0	The owner of an Uber for Business or Uber Family profile that you use.
1834	1	• link or combine it with other information we get from third parties, to help understand your preferences and provide you with better services.
4007	1	The purposes of collection of such information are: (1) to operate and update the Software and the Services; (2) to improve and customize the Software and the Services; (3) to maintain, test and monitor the quality and operation of the Software; (4) to comply and satisfy with any applicable law, regulation, legal process or enforceable governmental request.
1264	0	"This Privacy Policy (the ""Policy"") explains how your information is collected, used, stored and shared by us with respect to your access and use of our services. By using or accessing our App or our Service, you agree to the privacy policies outlined below."
4931	0	This Policy was last revised on, and effective as of, 10/01/15
489	0	We may provide your or your child’s personal information to companies that provide services to help us with our business activities such as processing your payments, providing mapping services or offering customer service. These companies are authorized to use your and your child’s personal information only as necessary to provide these services to us;
4102	0	Aeria Canada Studio Inc. will take all steps reasonably necessary to ensure that your data is treated securely and in accordance with this Privacy Policy and no transfer of your Personal Data will take place to an organization or a country unless there are adequate controls in place including the security of your data and other personal information.
3352	1	are being processed:to provide and deliver the products and services you request and send you related information;
3358	1	Information from other sources
2039	0	The Site is hosted in the United States. If you visit Chatous from the European Union or other regions of the world with laws governing data collection and use that may differ from laws of the United States, then please understand that you are transferring your Personal Data outside of those jurisdictions to the United States for the uses identified above in accordance with this Privacy Policy. By providing your Personal Data to Chatous you consent to that transfer.
4464	0	"To exercise any of these rights (including deactivating your Adobe ID account), you can get in touch with us – or our data protection officer – using the details set out below. Additionally, many of our websites and apps allow you to edit your personal information by accessing the ""my account,"" ""my profile,"" or a similar feature of the app or website you are using. Likewise, you can delete files or photos you have stored in our websites and apps by logging in and using the deletion functions that are available."
269	1	• to enforce our Terms and Conditions of Use and to prevent and combat fraud
2388	1	To communicate with you regarding your use of our Service
735	1	Aeria Canada Studio Inc. uses the collected data for various purposes:To provide and maintain our Service
2127	0	In accordance to Article 15 of the GDPR you may request access to processed Personal Data. This includes confirmation as to whether or not personal data concerning him or her are being processed, and, where that is the case, access to the personal data and the following information:the purposes of the processing;the categories of Personal Data concerned;the recipients or categories of recipient to whom the Personal Data have been or will be disclosed, in particular recipients in third countries or international organizations;where possible, the envisaged period for which the personal data will be stored or, if not possible, the criteria used to determine that period;the existence of the right to request from the controller rectification or erasure of personal data or restriction of processing of personal data concerning the data subject or to object to such processing;the right to lodge a complaint with a supervisory authority;where the Personal Data are not collected from you, any available information as to the source;the existence of automated decision-making, including profiling, referred to in Article 22(1) and (4) and, at least in those cases, meaningful information about the logic involved, as well as the significance and the envisaged consequences of such processing for the data subject.
4015	0	If you would like further information about your legal rights under applicable law or would like to exercise any of them, please contact us using the information in the “Contact Us” section below at any time. Your local laws may permit you to request that we:● Provide access to and/or a copy of certain information we hold about you;● Prevent the processing of your information for direct-marketing purposes (including any direct marketing processing based on profiling);● Update information which is out of date or incorrect;● Delete certain information which we are holding about you;● Restrict the way that we process and disclose certain of your information;● Transfer your information to a third-party provider of services;● Revoke your consent for the processing of your information.
2768	1	When you access our Applications by or through a mobile device, we may receive or collect and store a unique identification numbers associated with your device or our mobile application (including, for example, a UDID, Unique ID for Advertisers (“IDFA”), Google Ad ID, or other identifier), mobile carrier, device type, model and manufacturer, mobile device operating system brand and model, phone number, and, depending on your mobile device settings, your geographical location data, including GPS coordinates (e.g. latitude and/or longitude), WiFi location or similar information regarding the location of your mobile device.
