	sentiment	review
1968	1	Who does A Thinking Ape share my personal information with?
1800	1	We do not sell your personal information to third parties. We will not share your or your child’s information with third parties other than the necessary service providers as indicated below.
930	0	Irrespective of the above, Lima Sky may still retain some of the data to the extent such retention is necessary to resolve disputes, enforce Lima Sky user agreements, and comply with technical and legal requirements and constraints related to the security, integrity, and operation of Services.
2657	1	Share with our service providers and partners
3758	1	Provided that the disclosure conforms to the laws, in cases where it is mandatory to ensure the safety and security of the users or the public or the other items which have public significance, it may disclose the personal information.
925	1	We do not rent or sell your Personal Data in personally identifiable form to anyone. We may share your Personal Data with third parties as described in this section:Data that's been de-identified: We may de-identify your Personal Data so that you are not identified as an individual, and provide that information to our partners. We may also provide aggregate usage information to our partners (or allow partners to collect that information from you), who may use such information to understand how often and in what ways people use our Services, so that they, too, can provide you with an optimal online experience. However, we never disclose aggregate usage or de-identified information to a partner (or allow a partner to collect such information) in a manner that would identify you as an individual person.
621	1	7.1 We may from time to time use third party advertisers or sponsors on our Service. In the event that we do so we will not disclose identifiable information about individuals but we may provide them with aggregated information about our users. We may also use such aggregated information to help advertisers reach the kind of audience they want to target (for example, men in London). We may make use of the personal information we have collected from you to enable us to comply with our advertisers' and sponsors' wishes by displaying their advertisement to that target audience.
4800	0	If you are accessing Our Games via Facebook, you may update, amend or delete Your information on Facebook, that we may receive from Facebook, by amending Your Facebook account information in accordance with Facebook’s terms and conditions of use.
5380	0	We process Personal Data for the purposes set out in this Privacy Policy, as described above. Our legal basis to process personal data includes processing that is: necessary for the performance of the contract with you (for example, to provide you with the services you request and to identify and authenticate you so you may use the Sites); necessary to comply with legal requirements (for example, to comply with applicable accounting rules and to make mandatory disclosures to law enforcement); necessary for our legitimate interests (for example, to manage our relationship with you, to ensure the security of our services, to communicate with you about our products and services); and based on consent by our customers (for example, to place certain cookies and to share your information with third parties for advertising purposes).
4271	0	I value your trust in providing us your Personal Information, thus we are striving to use commercially acceptable means of protecting it. But remember that no method of transmission over the internet, or method of electronic storage is 100% secure and reliable, and I cannot guarantee its absolute security.
3083	1	Twilio USA Transmitted via network during sign-ups Emails listed in Article 1 above
1877	1	We do not use the facial tracking and mapping information to identify individuals or to target advertising. We do not share facial tracking and mapping information with third parties.
2449	0	any other information that the third party shares with us
5106	0	Research and development
1789	0	5.3 As an international company, CXZH.LTD provides company information to our local branch offices all over the world to further aid in providing products and services. It is possible that the personal information you submit to us may be transmitted to these other CXZH.LTD branch offices. For example, the personal information provided by a European customer at the time of product registration may be transmitted to a server in the USA and then transmitted to one or more servers of our branch offices in Europe. Meanwhile, in some countries or regions, our subcontractors may handle your information in the process of helping CXZH.LTD provide products and services to you and/or in handling information collection, transmission, storage and processing for us.
4645	0	"When you install the software for using the Service (""Application"") on your device and register with the Service, personally identifiable information about you may be collected during the download process of the Application for the Service (as requested from you during the download process). For registration through the Service, you are required to provide your mobile phone number or your email address, city location, gender, name, depending on the device(s) you are using for the Service. You may also provide additional information, but that is optional. When you log in using your Facebook or Google account, we may collect additional information you make available to us (please see ""Your User Profile"" below)."
218	1	Business Transfers. Your Personal Information may also be used by us or shared with our affiliates controlled by the Organization for internal reasons. If another entity acquires us or all or a portion of our assets, Personal Information, Usage Information, and any other information that we have collected about the users of the Services may be disclosed to such entity as part of the due diligence process and will be transferred to such entity as one of the transferred assets. Should such a sale or transfer occur, we will use reasonable efforts to direct the transferee to use information you have provided through the Services in a manner that is consistent with this Policy. Also, if any bankruptcy or reorganization proceeding is brought by or against us, all such information may be considered an asset of ours and as such may be sold or transferred to third parties.
2523	0	If you are aware of changes or inaccuracies in your information, you should inform us of such changes so that our records may be updated or corrected. You may lodge a complaint with a supervisory authority if you consider that our processing of your Personal Data infringes applicable law.
328	0	Chatous uses the Personal Data you provide in a manner that is consistent with this Privacy Policy. If you provide Personal Data for a certain reason, we may use the Personal Data in connection with the reason for which it was provided. For instance, if you contact us by email, we will use the Personal Data you provide to answer your question or resolve your problem. Also, if you provide Personal Data in order to obtain access to the Services, we will use your Personal Data to provide you with access to such services and to monitor your use of such services. Chatous and its subsidiaries and affiliates (the “Related Companies”) may also use your Personal Data and other personally non-identifiable information collected through the Services to help us operate, maintain, enhance, and deliver the various features and services found on the Site; as well as to track user-generated content and users to comply as a service provider with the DMCA and other applicable laws. Chatous uses all of the Personal Data and other personally non-identifiable information that we collect from users to understand and analyze the usage trends and preferences of our users, to improve the way the Site works and looks, and to create new features and functionality. Further, Chatous may use Personal Data and other personally non-identifiable information to: (a) remember your information so that you will not have to re-enter it during your visit or the next time you visit Chatous; (b) monitor your participation in various sections of the Chatous; (c) customize our service to you, including by providing you with recommendations and (c) monitor aggregate site usage metrics such as total number of visitors and pages viewed. We may use your e-mail address for administrative communications such as notifying you of major Chatous updates, for customer service purposes, and to send privacy or security-related notices.
2642	1	Adobe has its own pages on many social networking sites (for example, the Adobe® Photoshop® team’s Facebook page). We will collect information which you have made publicly available on your social networking account, such as name and interests in our products and services, when you interact with our social networking pages.
4146	0	8. Rights related to automated decision making including profiling: there are several rights in this area where processing carried out on a solely automated basis results in a decision which has legal or significant effects for the individual. In these circumstances your rights include the right to ensure that there is human intervention in the decision-making process.
5457	1	Other parties authorized by you
1910	0	To allow you to participate in interactive features of our service, when you choose to do so.
4019	1	4.6. Our selected third party partners with our permission, using their own ad servers, can show advertisements to you.
2326	0	We are the controller of the personal information collected. We only collect, use, store and transfer (“process”) your personal information in accordance with applicable data protection legislation, including but not limited to, the (EU) General Data Protection Regulation (2016/679) (“GDPR”) and applicable national data protection legislation.
685	1	There may be other third parties collecting analytics data from you depending on the platform you access our Services from.
2230	1	We will transfer your Personal Information to countries outside the EU and EEA that may not have as strict privacy legislation as where you live
2513	1	If you do not agree with all of the terms of this Privacy Policy, please do not use our service. Community safety is our number one priority and some of the above user information are mandatory in order to create a safe community for all users.
1488	0	NOVA GEIMS, OOO is headquartered in Russia, and we may have operations, entities and Services provided throughout the world. We have taken measures to ensure that your personal information is treated securely and lawfully, and that it receives an adequate level of protection in the jurisdictions in which we process it. If you are located in the European Economic Area (“EEA”) or Switzerland, we provide adequate protection for the transfer of personal information to countries outside of the EEA or Switzerland based on the standard contractual clauses authorised by the European Commission or other appropriate safeguards defined in Article 46, EU General Data Protection Regulation 2016/67 (GDPR).
1631	0	This Policy was last revised on, and effective as of 24 May 2018.
130	0	This helps us to better understand our business, analyze our operations, maintain, improve, innovate, plan, design, and develop the App and our new products. We also use such data for statistical analysis purposes, to test and improve our offers. This enables us to better understand what features and categories of books our users like more, what categories of users use our App. As a consequence, we often decide how to improve the App based on the results obtained from this processing. For example, if we discover that users more often read book summaries from “Productivity & time management” category, we may create and introduce more of book summaries into this category.
4551	1	Devices and operating systems providing native versions of Facebook and Instagram (i.e. where we have not developed our own first-party apps) will have access to all information you choose to share with them, including information your friends share with you, so they can provide our core functionality to you.
3843	1	CXZH.LTD will not read or disclose to any third party any private email communication information that is transmitted using our products and services, unless given appropriate explicit consent to do so.
483	1	How and With Whom Do We Share Your Data? We share Personal Data with vendors and third party service providers who work on our behalf and provide us with services related to the purposes described in this Privacy Policy or our Terms of Service. These parties include:Payment processors
2817	1	We are not responsible or liable for your interaction with such third parties, the information requests initiated by such third parties, or the subsequent use, treatment or dissemination of information you voluntarily choose to provide to them.
520	1	For providing customized advertisement, the third-party advertising companies may collection or use your personal information (not including your name, address, email address or telephone number) when you use the APP or Service.
1944	0	We communicate with you, for example, by push notifications. These may include reminders and motivational messages encouraging you to follow your training and nutrition plan, or other information about the App. As a result, you may, for example, receive a push notification every day at a particular time reminding you to work out. To opt out of receiving push notifications, you need to change the settings on your device.
3245	0	In order maximize the benefits of the App, this mobile short notice lists the App's optimal collection practices. You'll be able to opt-in or modify collection settings according to your phone's privacy settings.
4152	0	To provide you with information about, and support for, our Services, including changes to our Services, technical updates to our Services, and changes to the Terms (including this Privacy Policy) Necessary for the performance of a contact and necessary to comply with a legal or regulatory obligation
654	0	Where we rely on contract, we will ask that you agree to the processing of personal data that is necessary for entering into or performance of your contract with us. We provide a voluntary service; you can choose whether or not you want to use the Services. However, if you want to use the Services, you need to agree to our Terms of Use, which set out the contract between the Company and you. As we operate in countries worldwide (including the US) and use technical infrastructure in the US to deliver the Services to you, in accordance with the contract between us, we may need to transfer your Information to the US and to other jurisdictions as necessary to provide the Services.
4322	1	customer service providers to provide after-sale services
2851	1	4.2. Sometimes we may also need to share your data with a third party in order to provide our Services to you or to administer the Services, for example if you choose to share your data across other social media platforms.
1237	1	Protection of Narvii and Others: We reserve the right to access, read, preserve, and disclose any information that we reasonably believe is necessary in response to a lawful request by public authorities, including to meet national security or law enforcement requirements; enforce or apply our Terms of Use http://narvii.com/tos and other agreements; or protect the rights, property, or safety of Narvii, our employees, our users, transferor others.
4931	0	This Policy was last revised on, and effective as of, 10/01/15
4975	1	We may provide aggregated or anonymized data to third parties, but when we do so, the information we share is in a de-identified format that does not personally identify you. 
4356	0	Should you wish to report a complaint or if you feel that Our company has not addressed your concern in a satisfactory manner, you may contact the Office of the Commissioner for Personal Data Protection http://www.dataprotection.gov.cy/dataprotection/dataprotection.nsf/page1i_en/page1i_en?opendocument
2800	0	Analysis of your content (e.g., activity logs, and direct feedback from you) which is sent or received using an online feature of an Adobe app or website, or which is stored on Adobe servers.
3505	1	Sharing On Our Games and products
1658	1	"Custom Content. We may work with trusted marketing partners to bring you more useful and interesting advertising content on our Services and on third party sites and services.  We may do this by sharing or matching the personal information you have provided us on the Services with the information (which may include personal information) you have provided third parties marketing partners.  If you do not want Ubisoft to match your personal information with trusted partners in order for us to tailor ads or other custom content for you on our Services and third party sites and services, please do not check the box labelled ""Share my information with selected third parties"" at the moment of creation of your Account or within your Account settings at any time.  If you do not check the box related to this Custom Content or otherwise opt-out from this Custom Content by unchecking the box within your Account settings at any time, Ubisoft will no longer share your personal information with partners to tailor ads or other custom content for you following the date of your request.  Please note that opting-out from the Custom Content will not change the behavior of third parties collecting information on the Services. Please see how to opt-out of third party collection in ""Other passively collected information"" Section above. The list of such trusted marketing partners is available at legal.ubi.com/active-sharing/"
2565	1	Furthermore, if we choose to buy or sell assets, user information is typically one of the transferred business assets. Moreover, if we, or substantially all of our assets, were acquired, or if we go out of business or enter bankruptcy, user information would be one of the assets that is transferred or acquired by a third party, and we would share Personal Data with the party that is acquiring our assets. You acknowledge that such transfers may occur, and that any acquirer of us or our assets may continue to use your Personal Data as set forth in this policy.
813	0	"Generally, we only keep your user information for a period necessary for realizing customer services, e.g.:User account picture: If you need to use ""ICBC Mobile Banking"" services, we will keep the account picture uploaded by you, and will delete corresponding information within a time limit required by laws and regulations after you cancel the services."
4878	1	For example, if you are a rider, we may share your first name, average rider rating given by drivers, and pickup and/or dropoff locations with drivers. If you share an uberPOOL trip with another rider, that rider may be told your name and may see your pickup and/or dropoff location.
984	1	We may share your information as well as information from tools like cookies, log files, and device identifiers and location data, with third-party organizations that help us provide the Service to you. Our Service Providers will be given access to your information as is reasonably necessary to provide the Service under reasonable confidentiality terms. We may share user content and your information with businesses that are legally part of the same group of companies that Reports+ is part of, or that become part of that group. Affiliates may use this information to help provide, understand, and improve the Service and Affiliates' own services.
686	0	Use as criteria in deciding whether and how to improve the Service by analyzing the customers’ habits.
5386	0	If you request limitations to processing that are mandatory for NOVA GEIMS, OOO, or you object to such processing (in which case, we may not be able to provide you with the game or game Services).
330	1	Insurance and financing partners.
3664	0	When you request deletion of your personal data, we will use reasonable efforts to honor your request. In some cases we may be legally required to keep some of the data for a certain time; in such event, we will fulfill your request after we have complied with our obligations.
5253	1	Third party business partners, service providers and/or affiliates of Alibaba.com engaged by us or working with us to assist us to provide services to you or who otherwise process personal information for purposes described in this Privacy Policy or notified to you when we collect your personal information.  Categories of these partners or service providers include:
3149	0	Trials of Heroes may use collected personal data for purposes of analyzing usage of the Services, providing customer and technical support, managing and providing Services (including managing advertisement serving) and to further develop the Services and other Trials of Heroes services and products. Trials of Heroes may combine non-personal data with personal data.
113	1	Google Analytics for Firebase: If you wish to find out more information on Google Analytics for Firebase, please follow this link: https://www.firebase.com/terms/privacy-policy.html
3587	0	Device identifiers. When you use a mobile device (a tablet or a phone) to access our App, we may access, etc or monitor one or more “device identifiers”. Device identifiers are small data files or similar data structures stored on or associated with your mobile device, which uniquely identify your mobile device. Device identifier provides reports or personalized content and ads.
992	1	You should always be careful when submitting information about Yourself within the Games and You should only submit information that You consent to make public.
2907	1	We may process, use, or share your data when the law requires it, in particular, if a law enforcement agency requests your data by available legal means.
3002	0	Please note that device information, log information, etc., cannot be independently used to identify information on a specific natural person. If we combine such non-personal information with other information to identify a specific natural person, or use the same in combination with personal information, such non-personal information shall be deemed to be personal information during the period in which the information is used in combination with personal information, and unless authorized by you or otherwise provided for by laws and legislations, we will anonymize or de-identify such personal information.
762	1	Your information is shared with others in the following ways:Sharing on Facebook Products
4574	0	The right to restriction 
968	0	Google Analytics Help Center: https://developers.google.com/analytics/devguides/collection/analyticsjs/cookie-usage
4303	1	We also get information about you and your activity outside Pinterest from our affiliates, advertisers, partners and other third parties we work with, or other publicly available sources. For example:Some websites or apps use Pinterest features such as our “Save” button, or you may install our “Save” button for your browser. If so, we collect log data from those sites or apps. Learn more about these features.
5376	0	We use personal data to enforce our agreements and contractual commitments, to detect, prevent, and combat fraud. As a result of such processing, we may share your information with others, including law enforcement agencies (in particular, if a dispute arises in connection with our Terms and Conditions of Use).
1887	1	We provide advertisers with reports about the kinds of people seeing their ads and how their ads are performing, but we don't share information that personally identifies you (information such as your name or email address that by itself can be used to contact you or identifies who you are) unless you give us permission. For example, we provide general demographic and interest information to advertisers (for example, that an ad was seen by a woman between the ages of 25 and 34 who lives in Madrid and likes software engineering) to help them better understand their audience. We also confirm which Facebook ads led you to make a purchase or take an action with an advertiser.
2900	0	You can request a download of your account information. To request a download, navigate to the “Request Account Info” button inside the Settings section of the app. You may edit your account information via the app.
3797	1	We may disclose (or provide access to) personal information to the following categories of recipients:Other Platform Users where necessary in connection with the facilitation of purchases and communications made between you and the other users.
5045	0	"If you use the “Log in with” or “Connect to” feature we may access and store some or all of the following information, as allowed by you, Third Party Social Networks and your preferences: (i) your basic information from your public profile, such as your name, surname, profile picture, age range, gender, and other public information; (ii) email address, login ID and/or player identifier string (iii) list of your friends; (iv) any other information which is detailed and displayed to you in the notice which appears during the ""Log in with"" or “Connect to” process. We may share your name, profile picture and your game data (such as moves, App progress and scores) with respect to the applicable App, with your friends who have also used the “Log in with” or “Connect to” feature in connection with such App or with your contacts in applicable Third Party Social Media Network account."
