	sentiment	review
4439	1	We use third-party services that have limited access to your information for specific purposes, such as administration, analytics, optimisation, advertising, prize delivery, marketing assistance, customer service, and data analysis. They assist us with our operations.
5143	0	Cookies are files with a small amount of data that are commonly used as anonymous unique identifiers. These are sent to your browser from the websites that you visit and are stored on your device’s internal memory.
2967	1	We want our advertising to be as relevant and interesting as the other content on our Games and products. With this in mind, we use all of the information we have about you to show you relevant ads. We do not share information that personally identifies you (personally identifiable information is information like name or email address that can by itself be used to contact you or identifies who you are) with advertising, measurement or other partners unless you give us permission
2944	0	We are committed to ensuring that your information is secure. In order to prevent unauthorized access or disclosure, we have put in place suitable physical, electronic and managerial procedures to safeguard and secure the information that we collect.
2913	1	Furthermore, if we choose to buy or sell assets, user information is typically one of the transferred business assets. Moreover, if we, or substantially all of our assets, were acquired, or if we go out of business or enter bankruptcy, user information would be one of the assets that is transferred or acquired by a third party, and we would share Personal Data with the party that is acquiring our assets. You acknowledge that such transfers may occur, and that any acquirer of us or our assets may continue to use your Personal Information as set forth in this policy.
3659	1	- We will not sell, rent or transfer your Personal Information to third parties without your prior consent. 
1161	0	Company’s compliance with the Privacy Shield is subject to the investigatory and enforcement powers of the U.S. Federal Trade Commission.
4465	1	How is this information shared?
4235	0	Where Trip.com processes your personal information as allowed by law or with your consent, Trip.com will store your personal information i) only for as long as is required to fulfil the purposes mentioned previously, ii) until you object to our use of your personal information (where Trip.com has a legitimate interest in using your personal data), or iii) until you withdraw your consent, whichever is applicable. However, if Trip.com is required to retain your personal information by law or in order to address legal claims, Trip.com will retain your personal information until the end of the legally required period or until the claims in question have been settled.
3707	1	Additionally, you may see our games advertised in other services. After clicking on one of these advertisements and installing our game, you will become a user of our Service. In order to verify the installs, a device identifier may be shared with the advertiser.
567	1	protect the rights, property, and safety of us, our users, or others.
579	1	2.LIKE may collaborate with a third party (an affiliate or otherwise) to provide you with relevant Services. In this scenario, LIKE has the right to share your information with such third party, if such third party agrees to bear responsibility for providing privacy protection no less favorable to that of LIKE.
4994	0	You can contact us at http://apps.facebook.com/takefiveslots/?action=helpdesk or email to: support@take5slots.com any time to get a list of all the Personal Information we have collected from you or to get such Personal Information deleted or invoke your other rights as explained above. We will do our bests to answer your request in a timely manner but please note that it may take a couple of days.
4275	1	We may also share information with others in an aggregated and anonymous form that does not reasonably identify you directly as an individual.
1961	1	We may share your information within the Nordeus company group for the purpose of providing the Nordeus Services.
3607	1	Your information may be disclosed and transferred/assigned to our affiliates or to our subsidiaries or to the legal personalities which acquired our company through the acquisition of all or a substantial portion of our merger, consolidation or assets.
13	0	To prevent fraud and illegal activity
2342	1	If we are required by law to disclose your information, we may share your information with law enforcement or other competent authorities and any third party, as may be required (e.g., to detect, prevent or otherwise address fraud, security, or technical issues; to respond to claims or satisfy any legal process, subpoena, or governmental request; or to protect the rights, property, or personal safety of the Company's users, its partners, or the general public). In the event the Company goes through a business transition such as a merger or acquisition by another company, consolidation, change of control, reorganization, or sale of all or a portion of its assets, your information will be among the assets transferred.
4824	1	When you enter shipping information in the process of placing an order, we send it directly to the merchant bot developer. We can store your shipping information for you if you choose to save it for future purchases. We will delete this information immediately if you ask us to.
4945	0	The Jasmin Chat periodically makes changes to the privacy policy. If there are significant changes to the privacy policy, the Jasmin Chat will promptly notify users by posting the relevant terms in a prominent position on webpage.
2722	1	We may disclose User Provided and Automatically Collected Information:as required by law, such as to comply with a subpoena, or similar legal process;when we believe in good faith that disclosure is necessary to protect our rights, protect your safety or the safety of others, investigate fraud, or respond to a government request;with our trusted services providers who work on our behalf, do not have an independent use of the information we disclose to them, and have agreed to adhere to the rules set forth in this privacy statement.
601	1	Facebook Analytics (Facebook, Inc.) https://www.facebook.com/about/privacy/
2056	0	For the purposes of this Policy, a material change includes but is not limited to:(I) a material change in our mode of service, such as the purpose of processing personal information, the types of personal information processed, how we use personal information, etc.;(II) a material change in our controlling rights and other aspects, such as a change in ownership caused by a merger, acquisition, reorganization, etc.;(III) a change in the main objective of the sharing, transfer or publicly disclosure of personal information;(IV) a material change in your right to participate in the processing of personal information and how it is exercised;(V) an event when our department responsible for handling the security of personal information, the contact details and the complaint channel changes;(VI) an event when the personal information security impact assessment report indicates that there is a high risk.
3079	1	You understand and agree that we may be required to disclose any personal information if required to do so by law or in the good faith belief that such disclosure is reasonably necessary to avoid liability, to comply with legal process, including but not limited to a search warrant, subpoena, statute, or court order, or to protect our rights and property, or that of the public.
1685	0	Hongarden Limited's Services are designed to help you create and share Content. Most of the information you provide Hongarden Limited is information you are asking Hongarden Limited to make public. This includes the Content you create and the metadata associated with it, such as when you created it, the people you follow, the songs you mark as favorites or share, and your comments on Content provided by other users. We will associate this information with your Personal Data and we may use this information and other information that results from your use of the Site and/or Services to customize the content we show you, including ads. When you share information or Content via the Site or the Services, you should think carefully about what you are making public.
3547	1	Personal/institutional information on User/ Member is regarded as all kinds of information used for the identification of user including name and surname, address, phone number, e-mail address, age. NUMBER FINDER, unless otherwise specified in the hereby privacy statement, shall not disclose any of the personal / institutional information to non-cooperated companies and 3rd parties. NUMBER FINDER goes beyond the provisions of the hereby privacy statement and give information on users to third parties in the cases listed below. These cases are;
2112	1	Advertisers collect data regarding advertisement performance, user’s interaction with ads, our apps and user’s interests. Collected data may include user’s non-personal and personal information (unique identifiers, network and device information, age, gender and geo-location) in order to serve you ads and for the third parties’ legitimate business interests. We use this aggregated information to understand and optimize how our applications are used, improve our marketing efforts, and provide content and features that are of interest to you. The use of information by third parties is not covered by our privacy statement. We do not have access to or control over this information. Furthermore, Ferro Entertainment may advertise other Ferro Entertainment Apps within its apps.
3571	1	We will not share, sell or distribute any of the information You provide to Us without Your consent.
3010	0	Session numbers with timestamp; session detailed process (e.g. user entered this level, user lost this level, user entered this screen etc).
3406	0	"Use of Cookies. A cookie is a text file that a web server puts on your device with the following general purposes:To help us recognize your browser as a previous visitor and save and remember any preferences that may have been set while your browser was visiting our site. We also may keep you logged in if you checked the box entitled ""Sign me in automatically next time."""
876	1	When you choose to login to a third party website / services with UC Account, you agree to share your UC Account information with the third party, including but not limited to your user name, your name, your alias, your profile picture and your contact information. Such third party websites / services are not controlled by us. When you visit such website or services you do so at your own risk. These website or services may have their own privacy policies in place, which we recommend you review. We do not assume any responsibility or liability for such website or services, the content of such website or services and their privacy practices, nor do we endorse them. We encourage you to familiarize yourself with the privacy statements provided by such website or services prior to providing them with information about you or entering into any transactions on them.
3309	0	Social sharing features
2824	0	We conduct surveys and research, test features in development, and analyze the information we have to evaluate and improve Games and products, develop new products or features, and conduct audits and troubleshooting activities.
4948	1	Chatous is not in the business of selling your information. We consider this information to be a vital part of our relationship with you. There are, however, certain circumstances in which we may share your Personal Data with certain third parties without further notice to you. We may share your Personal Data with companies that provide services to us, including outside vendors, contractors, or agents who help us manage our business activities. Such entities only use your information in accordance with this Privacy Policy and for no other purpose than to provide us with necessary services. Chatous may disclose Personal Data if required to do so by law or under the good faith belief that such action is necessary to comply with state and federal laws (including, without limitation, U.S. copyright or trademark laws) or respond to a court order, subpoena, judicial or other governmental requirement or warrant in a manner required by the requesting entity. Chatous also reserves the right to disclose Personal Data that we believe, in good faith, is appropriate or necessary to take precautions against liability; enforce our Terms of Service; protect Chatous from fraudulent, abusive, or unlawful uses; to initiate, render, bill and collect for amounts owed to Chatous; to investigate and defend ourselves against third-party claims or allegations; to assist government enforcement agencies; to protect the security or integrity of the Site; or to protect the rights, property, or personal safety of Chatous, our Users, or others. As we develop our business, we might sell or buy businesses or assets. In the event of a corporate sale, merger, reorganization, dissolution or similar event, Personal Data may be part of the transferred assets. Chatous may also share your Personal Data with our Related Companies for purposes consistent with this Privacy Policy.
432	1	We do not sell, trade, or otherwise transfer to outside parties your personally identifiable information. We may disclose your Non-personal information:To trusted third parties who assist us in operating our website, conducting our business, cooperation with us or servicing you, so long as those parties agree to keep this information confidential. We will access, use or disclose your information with other organizations or entities for reasons that required by any applicable law, regulation, legal process or enforceable governmental request; Detect, prevent, or otherwise fraud, security or technical issues; Protect against harm to the rights, property or safety of FancyClean, our users or the public as required or permitted by law.
549	0	Your data may be used by us for the following purposes:fulfillment of our contractual obligations, as part of the agreement you have concluded with us;marketing, in particular to provide personalized and targeted marketing mails about the Services which you already use or which we think may interest you. This purpose is optional and we will first get your consent in the required cases;delivery of the Services ordered by you;communication with you as a User of our Services;enable participation in interactive elements of the Services, if that is your will;inform you about changes in our Services;improvements to our Services;organizing competitions by BOOMHITS, in particular for contact, mailing and tax purposes;determining the conversion rate and other components of our services;tax, legal and settlement;billing, resulting from EU regulations regarding the protection of personal data;targeting and personalization of marketing communication, offers and advertisements addressed to you.
3298	0	When you access the Service by or through a mobile device, this Usage Data may include information such as the type of mobile device you use, your mobile device unique ID, the IP address of your mobile device, your mobile operating system, the type of mobile Internet browser you use, unique device identifiers and other diagnostic data.
3626	1	Third party business partners who you access through the Services
2826	1	To the extent Camsurf may offer configurations, now or in the future, allowing you to opt-out of any such communications, or you may opt-out by direct request. Such choices shall be provided to you, or consents obtained if we believe it is advisable or necessary to do so in the event any feature, content, or communication may be outside the scope of the initial consent you have given us.
2568	1	From time to time, we may employ third parties to help us provide or improve our Service. These third parties, such as our analytics or hosting provider, may have limited access to databases of user information or registered member information solely for the purpose of helping us provide or improve the Service and they will not be able to use the information about our members or visitors for any other purpose. We may disclose personal Information in some other limited circumstances, but we will specifically describe them to you when we collect the information, such as in the terms of use for a new service or by revising this Privacy Policy.
1023	1	We reserve the right to access, read, preserve, and disclose any Information that we reasonably believe is necessary to comply with law or court order; enforce or apply our conditions of use and other agreements; or protect the rights, property, interests, or safety of our Company, our employees, our users, or others. This includes exchanging information with other companies and organizations for fraud protection and credit risk reduction.
2477	0	Ubisoft collects personal information via internet forms. For example, a new user to any of the Services may be asked to register by providing his or her name, date of birth or age, phone number, and home address. This information will then be associated with your Account, so that you may identify yourself during future visits to each of the Services. Ubisoft also stores and maintains personal information that you submit to us in an e-mail or that you post on our bulletin board.
594	1	We do not partner with or have special relationships with any ad server companies.
3772	0	If you are a California resident, California Civil Code Section 1798.83 provides you with the right to request certain information regarding disclosure of your Personal Information to third parties for direct marketing purposes, including a description of the categories of Personal Information disclosed. We do not share your Personal Information with third parties for their marketing purposes.
2754	1	Disclosure of the Personal Information and Non-Personal Information That We Collect
3067	1	We do not sell, trade, or otherwise transfer to outside parties your personally identifiable information. This does not include trusted third parties who assist us in operating our applications, conducting our business, or servicing you, so long as those parties agree to keep this information confidential. We may also release your information when we believe release is appropriate to comply with the law, enforce our application policies, or protect ours or others rights, property, or safety. However, non-personally identifiable visitor information may be provided to other parties for marketing, advertising, or other uses.
1513	1	These ones speak for themselves.
5025	1	he recipients' use of the disclosed information will not be covered by this Privacy Policy. If you have questions concerning the processing carried out by such third parties, you should review their privacy policy.
5074	1	To prevent the rights and interests of others from material detriments;
470	0	The Oval, 4103
1551	0	We may change this privacy policy from time to time. But when we do, we’ll let you know one way or another. Sometimes, we’ll let you know by revising the date at the top of the privacy policy that’s available on our website and mobile application. Other times, we may provide you with additional notice (such as adding a statement to our websites’ homepages or providing you with an in-app notification).
2401	1	Some of the Apps allow you to submit content generated in or by the Apps to third party sites like Facebook, Vkontakte, Google Play Games, Game Center and YouTube. These submissions follow the information transfer protocols of such third parties, which are designed to enable content sharing with such third parties.
1859	1	service providers for advertisement services,
2592	1	Service Providers, Business Partners and Others. We may use certain trusted third party companies and individuals to help us provide, analyze, and improve the Service (including but not limited to data storage, maintenance services, database management, web analytics, payment processing, and improvement of the Service’s features). These third parties may have access to your information only for purposes of performing these tasks on our behalf and under obligations similar to those in this Privacy Policy. As of the date this policy went into effect, we use Amazon’s S3 storage service to store some of your information (for example, your Files). You can find more information on Amazon's data security from the S3 site.
2828	0	You will be liable to us for all orders or transactions placed by use of your user ID and password, even if such use might be wrongful. We will not be liable to you for any loss that you may incur as a result of misuse of your user ID and password, and we accept no liability resulting from its unauthorised use, whether fraudulent or otherwise.
637	1	This Privacy Policy does not create rights enforceable by third parties or require disclosure of any personal information relating to users of the website.
5210	0	When you use any of the Crazy Maple Studio’ games or applications on a mobile platform, we may collect and record certain information such as your unique device ID (persistent / non-persistent), hardware type, media access control (“MAC”) address, international mobile equipment identity (“IMEI”), the version of your operating system (“OS”), your device name, your email address (if you have connected to Facebook or Google+), and your location (based on your Internet Protocol (“IP”) address). This information is useful to us for troubleshooting and helps us understand usage trends.
2537	0	4(B) Send Service-related Communications
1008	0	The processing is necessary to fulfill Uber's legal obligations
4495	1	Advertising network companies in order to serve contextual advertisements (the data include your IP-address, Device ID and advertising ID).
548	1	UCWeb Software and Services may includes third party software, such as widgets or SDKs. They are subject to separate Privacy Policy provided by independent third party developers. This Privacy Policy does not apply to third party software. UCWeb shall not be responsible for any third party software.
2849	0	or to perform functions or services as otherwise described to you at the time of collection.
2577	0	We’ll notify you before we make changes to this policy if it’s possible and give you the opportunity to review the revised policy before continuing to use our Games and products.
3911	1	Users understand and agree that LONG TECH NETWORK LIMITED may be required to disclose any personal information if required to do so by law or in the good faith that such disclosure is reasonably necessary to avoid liability, to comply with legal process, including but not limited to a search warrant, subpoena, statute, or court order, or to protect our rights and property, or that of the public. Note that LONG TECH NETWORK LIMITED is not required to question or contest the validity of any search warrant, subpoena or other similar governmental request that LONG TECH NETWORK LIMITED may receive.
615	0	to provide news and information about the App we think will be of interest to you;
4932	1	When required by applicable law, rule, regulation, legal process, in the process of negotiations of, any mergers and acquisitions, sale of company assets, financing or acquisition of all or a portion of our business by another company where personally identifiable information submitted to us may be transferred to the acquiring entity.
2049	0	This privacy policy constitutes an inseparable part of the Jasmin Chat User Agreement and must be read together with the Jasmin Chat User Agreement.
3661	1	When you use our Apps we may display contextual advertisements to you. In order to enable advertising we allow our advertising partners to collect online identifiers (such as Advertising ID on Android and IDFA on iOS) that might be considered as personal information under some legislations, but they should use it solely for the purposes of contextual advertising. For any other purposes they should use the information solely on anonymized and aggregated basis.
4986	1	We will not rent or sell your personal information to the third- party, but for your better use of the services provided by third-party organizations we may share your information with third-party organizations that provide automatic data processing technologies for the Software or providing service to the Software. We do not have power to control or influence these third- parties’ tracking technologies or how they may be used. Therefore, if you do not want to share your personal information with any third-party organizations, please do not use such service provided by that third-party organizations.
2969	1	We will not sell, trade, rent or disclose any of the personal information you provide to us for any reason, without your prior consent. Otherwise, your Personal Information will only be disclosed where required or allowable by law. We may share generic aggregated demographic information not linked to any personal identification information regarding visitors and users with our business partners, trusted affiliates and advertisers for the purposes outlined above.
