	sentiment	review
1814	0	We also use this information in order to provide you with updates and information on our and selected third parties' products and services we think you may be interested in. Legitimate interests
5434	1	We will share personal information with companies, organizations or individuals outside of Ready Player if we have a good-faith belief that access, use, preservation or disclosure of the information
4263	0	Records relating to processing of consumer complaints and dispute resolution
2878	1	We may share information about you in the following ways:
821	0	When you visit our websites
4310	0	This processing is also necessary for us to pursue our legitimate interests of (i) ensuring that our Online Services function properly so that you and other users have the best experience when playing any of our Game(s) and using the other Online Services; (ii) improving the quality of our Online Services, and providing a better experience to our users; (iii) identifying and correcting any bugs in the Games and Online Services and iv) understanding the effectiveness of our marketing to attract new users and re-engage our current users at an aggregated level.
2017	1	Corporate Group. We may transfer your information to any company within our group (including to their employees and sub-contractors) which assists us in providing our Services or which otherwise has a need to know such information, in accordance with applicable law.
5157	0	Additional privacy-related information is provided for certain Adobe apps and websites.
3077	0	This Privacy Policy may change from time to time, and we encourage you to review it periodically. Your continued use of our Services signifies your acceptance of changes to this Privacy Policy.
5132	0	This policy applies to users of Uber's services anywhere in the world, including users of Uber's apps, websites, features or other services.
124	0	Your personal data are deleted or anonymized as soon as it no longer serves one of the above mentioned purposes and in any event no later than three (3) years after your interaction with Alexadra Games has ceased.
1781	1	A driver using an account owned by a partner transportation company.
5198	1	LONG TECH NETWORK LIMITED has a parent's permission to share the information if user is a child under age 13. Parents have the option of allowing LONG TECH NETWORK LIMITED to collect and use their child's information without consenting to LONG TECH NETWORK LIMITED sharing of this information with people and companies who may use this information for their own purposes.
2174	1	a) The User gives us a clear instruction for certain products and services of any third party which requires the User’s personal information;
58	1	The Canva Privacy Policy does not apply to, and we cannot control the activities of, third-party advertisers. Please consult the respective privacy policies of such advertisers or contact such advertisers for more information.
1100	0	By using our Service you agree to the collection and use of your personal information by us in accordance with this Privacy Policy. If you do not agree to the terms of this Privacy Policy, please do not provide us with any information and do not use the Services.
5362	0	If you reside outside of North America, your relationship is with Adobe Ireland. Adobe Ireland will transfer your personal information to some organizations which are located outside the European Economic Area (EEA) and the United Kingdom and/or Switzerland, namely the US and India and other locations where we Adobe may have operations in the future.
3704	0	This page is used to inform website visitors regarding my policies with the collection, use, and disclosure of Personal Information if anyone decided to use my Service.
2061	1	Research partners, including those performing surveys or research projects in partnership with Uber or on Uber’s behalf.
2818	0	To customize your experience, to conduct research and development to test and introduce new features and products, and to improve and monitor the effectiveness of our Service.
3603	0	Third parties that provide advertising or other functionality on our Services may collect the same information about your mobile device that we automatically collect, as described above.
3114	1	We may disclose your personal information if it needed for objective reasons, due to public interest or in other unforeseen circumstances:- as required by law;- when we believe in good faith that disclosure is necessary to protect our rights, protect your safety or the safety of others, investigate fraud, or respond to a government request;- if we are involved in a merger, acquisition, or sale of all or a portion of its assets, you will be notified via email and/or a prominent notice in our App of any change in ownership or uses of your personal information, as well as any choices you may have regarding your personal information.
1378	0	If you choose to use my Service, then you agree to the collection and use of information in relation to this policy. The Personal Information that I collect is used for providing and improving the Service. I will not use or share your information with anyone except as described in this Privacy Policy.
1610	1	4.1 We may share your personal information with third parties in the following circumstances:4.1.1 for marketing purposes;4.1.2 to other members of the ICON Games Ltd. group of companies, our partners and service providers for the purpose of: managing or administering certain aspects of our Service; for analytics purposes; and to help us develop new services;4.1.3 to protect the rights, property or safety of us or other Service users;4.1.4 where we are obliged, or permitted, to do so by law; or4.1.5 if we (or substantially all of our assets) are acquired by a third party, in which case personal information held by us about our users will be one of the transferred assets.
3345	0	We may use your email address to contact you about your experience with our Sites and notify you about company news and promotions. Your gender and birthday may be used to analyze user trends and target certain promotions.
4031	1	Who Your Personal Data May Be Shared With
1252	0	Below are the steps for changing the settings for installation of cookies on Internet Explorer:Under the [Tools] menu, select [Internet Options].
4470	1	We will never share your information with third parties for their own marketing purposes without first obtaining your consent.
4464	0	"To exercise any of these rights (including deactivating your Adobe ID account), you can get in touch with us – or our data protection officer – using the details set out below. Additionally, many of our websites and apps allow you to edit your personal information by accessing the ""my account,"" ""my profile,"" or a similar feature of the app or website you are using. Likewise, you can delete files or photos you have stored in our websites and apps by logging in and using the deletion functions that are available."
1552	1	Law enforcement agencies and other public authorities
207	0	We take, and force applicable third parties to take, reasonable precautions to protect your personal information against loss, misuse, unauthorised disclosure, alteration, and destruction. However, please remember that no transmission of data over the Internet or any wireless network can be guaranteed to be 100% secure. As a result, while we strive to protect your information, we cannot guarantee the security of your information and do not assume any responsibility for the unauthorised use of, or access to, your information that is under our control.
5268	0	Camera : In order to use some of the features of the App (including but not limited to palm reading), you may voluntarily grant us the permission to access to the camera in your mobile device.if you donot want us to palm reading, please do not use this feature of our App.
5243	0	The right to object. You have the right to object to our processing of your Personal Data.
3299	0	Make a complaint to a Supervisory Authority
4432	1	If Ferro Entertainment is involved in a merger, acquisition, or sale of all or a portion of its assets, you will be notified of any change in ownership or uses of your information via our website.
54	0	Information and content you provide. We collect the content, communications and other information you provide when you use our Products, including when you sign up for an account, create or share content, and message or communicate with others. This can include information in or about the content you provide (like metadata), such as the location of a photo or the date a file was created. It can also include what you see through features we provide, such as our camera, so we can do things like suggest masks and filters that you might like, or give you tips on using camera formats. Our systems automatically process content and communications you and others provide to analyze context and what's in them for the purposes described below. Learn more about how you can control who can see the things you share.
2842	0	This Privacy Policy describes how AVCR Bilgi Teknolojileri A.S (AVCR, “we” or “us”) protects your privacy when you use Funimate application software, website (collectively our “App”or “Funimate app”).
3676	1	To the extent data is transferred from users in countries located in the European Economic Area (“EEA”),to other users outside the EEA, to the extent any of that data handling or processing should involve the services of a third party provider, our agreements with that provider shall include a standard contract clauses approved by the European Commission or other suitable safeguard to permit data transfers from the EEA to other countries, in order to bind them to the obligations to protect the privacy and security of your data that we undertake under the EU General Data Protection Regulation (GDPR)
4093	0	When we have location information, we use it to tailor our Games and products for you and others, like helping you to check-in and find local events or offers.
373	0	For more information on AdMob Partners, please visit: https://support.google.com/admob/answer/9012903
3687	0	track your use of the Services to help us learn more about your gaming activities and understand your preferences and tendencies, so that we can personalise your experience, provide you with in-game offers and notifications that are tailored to you, and otherwise enhance your gaming experience
1147	1	DMC System Co., Ltd. Customer service center system operation and customer consultation
3497	0	Connection information such as the name of your mobile operator or ISP, browser type, language and time zone, mobile phone number and IP address.
3910	0	You have the right to decide whether to accept or reject cookies. If you choose to set your web browser controls to reject cookies, you may still use our website though your access to some functionality and areas of our website may be restricted.
2958	0	We use the facial tracking and mapping information we collect to enable facial effect features when using the Service.
740	0	Grounds for retention: E-Commerce Act
312	0	Lima Sky does not knowingly collect Personal Information from persons under the age of 13 without parental consent. Lima Sky requires device owners to specify their age before any Personal Information is collected. If it comes to Lima Sky’s attention that Personal Information has been collected from a person under the age of 13, Lima Sky will delete this information as quickly as possible. If you believe that Lima Sky may have Personal Information from or about a child under the age of 13, please contact Lima Sky at info@limasky.com.
4320	0	Data retention periods for other Processors are indicated by the links above.
2940	1	To promote public interests without damaging your vital interests;
3673	0	We may use the personal data we collected from you to personalize the communication to you (including marketing communication). We may use the algorithms which would allow us to analyze your personal aspects, for example we may analyze your behaviour and decisions when using our apps to offer you targeted purchases or personalize your game experience.
4536	0	Parents can review, delete, manage or refuse with whom their child's information is shared through contacting us directly.
5277	0	In particular, if we transfer personal data originating from the EEA to countries with not adequate level of data protection, we use one of the following legal bases: (i) Standard Contractual Clauses approved by the European Commission (details available here), or (ii) the EU-U.S. Privacy Shield Framework (details available here), or (iii) the European Commission adequacy decisions about certain countries (details available here).
3364	0	Eyewind may use and disclose to Eyewind’s partners and contractors the collected non-personal data for purposes of analyzing usage of the Services, investigate, prevent or take action regarding unauthorized use of the services to further develop the Services and other Eyewind services and products.
1040	0	However, please be aware that no method of transmission over the internet, or method of electronic storage is 100% secure and we are unable to guarantee the absolute security of the Personal Information we have collected from you.
4911	1	4.4. Our ad management and recommendation system is designed so that your information will not be shared directly with our third party advertisers. An advertiser or maker of a recommendation can only choose to target advertisements to groups of users falling within criteria such as age, gender or location, or to target communities according to type, e.g. cars or fashion. If you fall within one of the target groups you will receive an advert or recommendation.
1643	1	We will only publicly disclose your personal information in the following circumstances:(I) we may publicly disclose your personal information upon obtaining your express consent or based on your proactive choice;(II) if we establish your violation of laws and legislations or severe violation of the provisions of relevant agreements and regulations of Tantan, or in order to protect the personal safety of and prevent infringement of the property of the users of Tantan and its affiliates or the public, we may disclose your personal information, including relevant violations and the measures taken by Tantan against you, upon obtaining your consent in accordance with laws and legislations or the provisions of relevant agreements and regulations of Tantan.
5091	0	Mimo:
796	0	Cookies are small text files that are stored on your browser or device by websites, apps, online media, and advertisements. Uber uses cookies and similar technologies for purposes such as:Authenticating users
2554	0	When you choose to opt-out, advertising networks will consider this choice as a withdrawal of consent to personalized advertisement experience and they will show contextual advertisements and not personalized advertisements based on your interests.
1360	1	We may share information about you with third party agents and contractors in order to provide the Game to you, for ongoing development, for analytical purposes etc. We will only provide information to such third party agents and contractors for their performances of their specific assignments for us and consistent with this Privacy Policy, and for no other purposes and provided that such third party agents and contractors have ensured an adequate level of protection of the Personal Data in accordance with all Applicable Data Protection Legislation and/or though agreements with us.
1420	1	Other people may use our Games and products to share content about you with the in-game audience. For example, people may share a photo of you, mention or tag you at a location in a post, or share information about you that you shared with them. If you have concerns with someone’s post, social reporting is a way for people to quickly and easily ask for help from someone they trust.
2806	1	The principle for limiting utilization and sharing 
3719	1	In case any competent government authority requests us to disclose any personal user identification information in accordance with relevant legal procedures, laws or regulations, we will provide such personal user information according to the requirements of the government authority or for the purpose of public safety. CXZH.LTD will assume no liability for any disclosure in such case.
4246	1	Fraud prevention service providers
3382	0	Skillz may process information (including Skillz Information) to understand how users use our TENS Tournament, and to compile statistical reports regarding that activity, as well as understanding how users progress, and their current status within the game. This processing is necessary for us and Skillz to pursue our legitimate interests of improving the game and increasing the amount of revenue generated via in-app purchases.
4940	0	Trip.com collects some information about you automatically. Specifically:
1932	1	We may pass information we collect from you such as technical information, advertising and application usage information (for example if a device has clicked on a sports ad within our Apps, for more information please see Information And Data We Collect From You Section of this Privacy Policy) as well as age & gender information to our advertising partners and they can reuse such data for targeted advertising. We allow our partners to serve targeted third party advertisements or other content. They may attach the information gathered from our App to info gathered from other apps, websites, or via other services, and then build profiles and transfer the info to another provider. For example we pass advertising IDs to Facebook and they match it with your Facebook ID, aggregate it and delete the initial identifier. By doing so the other provider may receive or gather information about you and use the information for displaying targeted ads. Advertisers may choose their audience by location, demographics, likes, keywords, age & gender, interests, behaviors, connections and any other information Facebook receives or infers about users. We cooperate with several providers of IBA that are listed herein in subsection a) and in Opt-Out Section of this Privacy Policy (''Third Parties''). When allowing Third Parties to conduct IBA we adhere to the DAA Principles available here http://www.digitaladvertisingalliance.org/principles/.
3061	0	We’d also like to remind you that our Nordeus User Agreement has more information about how we operate the Nordeus Services.
70	0	For the purposes of data storage, we recourse to the services of the hosting organizations. We take your privacy seriously and, therefore, encrypt your personal data before sending it to the hosting organizations for the purposes of its storage. Please note that we cooperate only with those hosting organizations that have passed our security and reliability check.
3085	0	“GDPR” means the General Data Protection Regulation (EU) 2016/679 of the European Parliament and of the Council of 27 April 2016 on the protection of natural persons with regard to the processing of personal data and on the free movement of such data.
5264	1	We do not sell, trade, or otherwise transfer to outside parties your Personally Identifiable Information.
2255	1	We may share certain information such as your location, browser and cookie data and other data relating to your use of our Service with our business partners to deliver personalized advertisements (ﾡﾰadsﾡﾱ) that may be of interest to you. Canva may allow third-party ad servers or ad networks to serve personalized advertisements either on the Service or on third party websites, including Facebook and Google. These third-party ad servers or ad networks use technology to send, directly to your browser or mobile device, these personalized ads and ad links, and will automatically receive your IP address when they do so. They may also use other technologies (such as cookies, JavaScript, device identifiers, location data, and clear gifs, see above) to compile information about your browserﾡﾯs or deviceﾡﾯs visits and usage patterns on the Service, and to measure the effectiveness of their ads and to personalize the advertising content. Canva does not sell, rent, or share the information we collect directly from you or about you from third parties with these third-party ad servers or ad networks for such partiesﾡﾯ own marketing purposes.
1795	0	When your personal information that is processed automatically you may object to such processing in some circumstances. Where your personal information is processed for direct marketing purposes, you may ask to cease processing your data for these direct marketing purposes. In order to exercise your right please contact the third-party services listed in the Section IV of this Privacy Policy to learn how you can object to processing your data. Most of them have clear instructions on their privacy pages, functional API or other options.
5069	0	We encourage you to periodically review this policy for the latest information on our privacy practices. We will also make prior versions of our privacy policies available for review.
3942	1	Some of Uber's products, services and features require that we share information with other users or at your request. We may also share your information with our affiliates, subsidiaries and business partners, for legal reasons or in connection with claims or disputes.
1278	0	"This Terms of Use Agreement (these ""Terms"") is a legally binding agreement that governs your access and use of the games, content, applications, activities, purchases and other services (the ""Services"") offered by LINEKONG GROUP, including but not limited to LINEKONG HOLDINGS LIMITED and their Affiliates. Affiliates shall mean any corporation, partnership, or other entity that, directly or indirectly, owns, is owned by, or is under common ownership with, such party hereto, for so long as such ownership exists. For the purposes of the foregoing, “ own”, ”owned”, or “ownership” shall mean ownership of more than fifty percent(50%) of the stock or other equity interests entitled to vote for the election of directors or an equivalent governing body. The Services may be made available through our website, third party social networking websites, or mobile versions thereof (this “Site”). By accessing and using any Services, you acknowledge that you have read, understand and agree to be legally bound by these Terms."
972	1	when we believe in good faith that disclosure is necessary to protect our rights, protect your safety or the safety of others, investigate fraud, or respond to a government request.
3891	1	You should visit the policies of such third parties for more information about their information-collection practices.  
837	0	"Certain Services may contain contents linking to advertisements, websites, products and other services provided by third parties in our Software (collectively, ""Third Party Services""). The use of such Third Party Services is subject to their privacy policies. You shall be aware that the use of the Third Party Services may give these third parties the ability to access, collect, store, and/or share your information, both your personal information and non-personally identifiable information. In order to clarify, we do not review, approve, monitor, endorse, warrant, or make any representations with respect to such Third Party Services and your access to any Third Party Services is at your own risk. We are not responsible for the information contained and/or made available through, the practices of, or your use or inability to use such Third Party Services. You expressly relieve us from any and all liability arising from your use of such Third Party and Services. We recommended that you read the terms, conditions and privacy policies of such third party before using or accessing any of them."
5192	1	We will not share your personal information with any company, organization and individual other than the service providers of Tantan, except in the following circumstances.
3741	1	If you decide, while using our Services, to use social sharing features such as “Share” or “Like” on Facebook or other third-party social network sites, this may allow the sharing and collection of personal and non-personal information both to and from such third-party social networks.
4236	0	If you wish to delete your account, you can do so by logging into your account or by emailing us using the contact details provided in Section 11 below. After it is no longer necessary for us to retain your Information, we will dispose of it in a secure manner according to our data retention and deletion policies, except as noted in Section 9 below.
1805	0	Information from our advertising partners: We receive information about you from some of our service providers who assist us with marketing or promotional services related to how you interact with our websites, applications, products, services, advertisements or communications.
1945	0	You may update your account at any time by logging in and changing your profile settings. If you have any questions about reviewing or modifying your account information, please contact us directly at support@GOGO LIVE.com.
2955	0	This includes, for example, sending you push notifications reminding you to exercise at appropriate times. The legitimate interest we rely on for this purpose is our interest to encourage you to use our Service more often. We also take into account the potential benefits to you of following your training and nutrition plan, which may lead you to a better and healthier lifestyle.
