	sentiment	review
423	1	We employ and allow third parties to perform tasks on our behalf, such as payment processing, data management and analytics, marketing, advertising, communication and IT services, and we need to share your Information with them in order for them to provide such products and services. Unless we tell you differently or you consent otherwise, these third parties do not have any right to use your Information beyond what is necessary to assist us in providing such products and services. Any uses of your Information by these third parties will remain governed by security and confidentiality obligations consistent with this Policy and applicable law.
2018	0	Customising the Service for you: We use information you provide us and information about you to make sure that your use of the Service is customised to your needs. For example, if you tell us your profession to recommend designs that are likely to be relevant to you.
2339	1	"We disclose information about you to the following categories of recipients based on the legal bases in Sections 6(1)(b), 6(1)(c) and 6(1)(f) of the GDPR (see a description of the legal bases above):Social networks, see more under ""Social Sharing features"";"
3348	0	lease carefully read the Statement of Industrial and Commercial Bank of China on User Information Confidentiality, and make sure that you have been aware of our rules on handling your user information. If you disagree to any term of the Statement, you should immediately stop access to the customer APP operated by ICBC.
1371	0	To fulfil a contract, or take steps linked to a contract: The use of your information may be necessary to perform the contract that you have with us, including:1) Providing services to you: We will use your personal information to complete and manage your online booking. In addition, we will provide you with related products and services through affiliates, business partners, and third parties.2) Fulfilling obligations: Dealing with insurance claims and payments that occur under relevant policies, processing commissions paid to partners, claiming for loss caused by service partners, or recovering payments made etc.
977	0	Information you give us when you register an account. We use your mobile phone number as your account identifier, and you will need to provide it to create an imo account. You also have the option of providing your first and last name, and a username in your profile;
3001	1	3.1.3 Sharing with affiliates: your personal information may be shared with our affiliates to facilitate our joint provision of services to you based on the associated account, recommend information that may be of interest to you or protect the personal safety of and prevent infringement of the property of the affiliates of Tantan, other users of Tantan or the public. We will only share the necessary personal information, such as sharing your necessary account information with our affiliates to facilitate your use of the Tantan account and the products or services of the affiliates, and we will seek your authorization and consent again if we share your sensitive personal information or the affiliates change the purpose for using and processing your personal information.
2025	0	Although imo makes good faith efforts to provide Individuals with access to their personal information, there may be circumstances in which imo is unable to provide access, including but not limited to: where the information contains legal privilege, would compromise others’ privacy or other legitimate rights, where the burden or expense of providing access would be disproportionate to the risks to the Individual’s privacy in the case in question or where it is commercially proprietary. If imo determines that access should be restricted in any particular instance, we will provide you with an explanation of why that determination has been made and a contact point for any further inquiries. To protect your privacy, imo will take commercially reasonable steps to verify your identity before granting access to or making any changes to your personal information.
3159	1	Merger, Sale, or Other Asset Transfers. We may transfer your information to service providers, advisors, potential transactional partners, or other third parties in connection with the consideration, negotiation, or completion of a corporate transaction in which we are acquired by or merged with another company or we sell, liquidate, or transfer all or a portion of our assets. The use of your information following any of these events will be governed by the provisions of this Privacy Policy in effect at the time the applicable information was collected.
174	0	To collect aggregated data from your chat history. We use the data to build language models which help us improve the Service. We will only collect this data on an aggregated basis, and in a manner which does not reveal any personally identifiable information about any individual user. We will use this data to help us understand our users’ interests, analyze trends, and customize the user experience.
3906	1	Amplitude USA Transmitted via the network when the Member uses the Service. Items listed as “Generated Information” in Article 1 above Used to improve the Service through big data analysis and is retained until membership withdrawal or termination/expiration of the outsourcing agreement.b
1004	0	You fill in the relevant information (including your personal information, contact information, and other file information when you create a member profile filled out); freedom when you fill out customer surveys, provide feedback and participate in the competition, provided the relevant information ; If you contact us, we will record your communication information; transaction information including your order from our website information about products and services; visit our website visitors, and their information has been recorded, may be entitled to the same login information and the right to correct information or to view the policies and rules of the relevant information. Visitors can contact us directly.
1889	1	We access Android ID only to analysis and provide you personalized content. And we will not share Android ID with any other third party.
1998	0	We may access, preserve and share your information in response to a legal request if we have a good faith belief that the law requires us to do so. This may include responding to legal requests from jurisdictions outside of the Turkey where we have a good faith belief that the response is required by law in that jurisdiction, affects users in that jurisdiction, and is consistent with internationally recognized standards. We may also access, preserve and share information when we have a good faith belief it is necessary to: detect, prevent and address fraud and other illegal activity; to protect ourselves, you and others, including as part of investigations; and to prevent death or imminent bodily harm. Information we receive about you may be accessed, processed and retained for an extended period of time when it is the subject of a legal request or obligation, governmental investigation, or investigations concerning possible violations of our terms or policies, or otherwise to prevent harm.
3830	1	These are app stores where you can download our app and they are also our payment processor.
5388	0	To comply with the law
416	1	We may disclose your information, including personal information:In response to a subpoena or similar investigative demand, a court order, or a request for cooperation from a law enforcement or other government agency; to establish or exercise our legal rights; to defend against legal claims; or as otherwise required by law. In such cases, we may raise or waive any legal objection or right available to us.
914	0	CXZH.LTD US Inc. (“we”, “us”, “our”) is committed to maintaining customer privacy through an ethical performance culture that is based on trust, simplicity and confidence. It is one of CXZH.LTD’s core principles to secure customer information while using our mobile applications (“products”), and provide privacy protection that is critical in maintaining trust and providing better services. CXZH.LTD’s individual privacy protection policy ensures the confidentiality of customer information under the defined terms and conditions below.
4088	0	How we use information we collect
3643	0	"This Privacy Policy sets out the ways in which Alibaba.com collect, use and disclose information in connection with its operation of the Platform including personal information about Platform visitors and representatives and employees of Buyers and Sellers (""you"").  This Privacy Policy also applies to use of our Platform via a mobile device, either through mobile applications or mobile-optimized websites. For details of the personal information that we collect when you use or interact with other Alibaba services, please refer to the applicable Privacy Policy to those services. "
4426	1	From time to time, we are approached by companies and organizations that provide products or services that we believe may be of interest to you, and we may share your personal information with such third parties in accordance with your choices and after we received your consent. We strive to limit use of the information you provide to those offers that we think you would appreciate receiving. If you do not wish to receive information from these third party partners, you can opt out at any time, including at the time of registration, by sending a request to us (see Section 13) or by modifying our preferences in your Account preferences page.
4284	0	Information about you collected from third parties
1989	0	Your personal data are processed for as long as necessary for the processing purposes mentioned above. AVCR will de-identify your personal data when these are no longer necessary for the said purposes, unless:a legitimate intrest of AVCR or a third party to archive your personal data in an identifiable form prevails over your intrest to de-identify;a legal measure, mandatory public authority measure or court order prevents such de-identification.
590	0	Duration of Processing of Personal Data.
631	0	Marketing. We will send you updates and information about our new products and services, upcoming events or other promotions or news by email or push notification. Where required by law, we will only send you marketing information if you consent to us doing so at the time you provide us with your Personal Data. You may opt out of receiving such emails by following the instructions contained in each promotional email we send you or by updating your user settings. In addition, if at any time you do not wish to receive future marketing communications, please contact us at support@languagedrops.com. We will continue to contact you via email regarding the provision of our Services and to respond to your requests.
3909	1	We also share information with third parties when you give us consent to do so.
2720	0	If you have additional questions about Alexadra Games's privacy practices related to children under the applicable minimum age, please contact us at support@alexandragames.com.
87	1	4. WHAT PERSONAL INFORMATION DO WE SHARE WITH THIRD PARTIES?
1603	0	Topface is a service for people who have reached the age of majority, whose main goal is to meet and communicate with new people. Use the services that we provide, you can in many ways: through our official website www.topface.com, through a mobile application for the Android platform or iOS. By registering with Topface, you enter into a legal agreement with us and we process your data for providing the service in accordance with the terms of this agreement.
4707	0	We will try to respond to any request in a timely manner. Please note that we are within our rights to decline your request if this is clearly intended to cause AVCR or our affiliated organisations harm or prejudice, e.g. by sending frequent (unfounded) requests in a short period of time. We also reserve the right to review your request for erasure against statutory or regulatory obligations that conflict with such erasure.
3363	0	The Services may use “cookies” and other technologies such as pixel tags, locally shared objects, and web beacons. Lima Sky treats information collected by cookies and similar technologies as non-personal data.
4582	1	Regardless of any choices you make regarding your Personal Data (as described in Section 7 below), we may preserve and disclose your Personal Data if we believe in good faith that it is reasonably necessary to protect the safety of any person, to address fraud, security or technical issues, to protect Hongarden Limited's rights or property, and/or to investigate or assist in preventing any violation or potential violation of the law, this Privacy Policy, or our Terms of Use.
2774	0	If you have any questions, comments or suggestions about this User Information Policy or your user information, please use the “Contact Us” function of the client to understand the customer service channels of the Bank, and contact us by calling the customer service of ICBC's overseas institutions or other means.
1931	1	 When we believe in good faith that disclosure is necessary to protect our rights, protect your safety or the safety of others, investigate fraud, or respond to a government request;
4008	0	The Software and the Services work over the Internet. We may store and process your information in various locations throughout the world. Where you located in the EEA, as required by law, you hereby provide us with your express consent to transfer your data to where may be outside of EEA once you use the Software and/or the Services. You may withdraw your consent at any time.
1280	0	We use this information to operate, maintain, and provide to you the features and functionality of the App, as well as to communicate directly with you, such as to send you email messages and push notifications, and permit you to share your creations on the App with your contacts or social media sites. We may also send you Service-related emails or messages (e.g., account verification, order confirmations, change or updates to features of the App, technical and security notices).
4120	1	We transmit Data to third parties only if this is necessary for the Purposes, due to a request from a national authority, due to a court ruling, or if you have consented beforehand.
4156	0	We also maintain administrative, technical and physical safeguards that are intended to appropriately protect Personal Information against accidental or unlawful destruction, accidental loss, unauthorized alteration, unauthorized disclosure or access, misuse, and any other unlawful form of processing of the Personal Information in our possession.
5331	0	Enable Accessibility features that make it easier for users with disabilities to use our services, such as those which enable deaf or hard-of-hearing drivers to alert their riders of their disabilities, allow only text messages from riders, and to receive flashing trip request notifications instead of sound notifications.
3327	1	I want to inform users of this Service that these third parties have access to your Personal Information. The reason is to perform the tasks assigned to them on our behalf. However, they are obligated not to disclose or use the information for any other purpose.
4359	1	CXZH.LTD assumes no responsibility when it or a third party uses your personal information in accordance with provisions of relevant laws or regulations or this privacy policy.
737	1	Cloud storage providers.
1564	1	We may disclose your personal information if it needed for objective reasons, due to public interest or in other unforeseen circumstances:as required by law;
1716	1	In certain instances, the Company may have contracts with third parties to provide products and/or services in connection with the Service. In those cases, the Company may share your personal information with Company’s third-party service providers, but only in connection with providing the services to you. For example, the Company shares your phone number or email with third party SMS and email providers to deliver the authentication SMS or email to you when you register with the Service. We contractually require that these third parties use your information solely to deliver SMS or email to you and to use appropriate security measures to protect your information. In addition, certain servers for the Service are owned and hosted by third party service providers. This Privacy Policy may not apply to the practices of third party service providers.
4763	0	If you have any questions about this Privacy Policy, you can contact us at legal@medium.com.
570	1	With all users and the general public. We may share the following information with all users as well as the general public:Public information like your profile pictures that you submit to Local. If a Local service is streamed on the web or broadcast in some other media, it may be viewed by the public at large.
4569	0	We want you to be in control of your information, so we provide you with the following tools.
4866	1	Disclosure and Transfer of Personal Data
1674	0	This page is used to inform website visitors regarding my policies with the collection, use, and disclosure of Personal Information if anyone decided to use my Service.
5151	0	All the information that you provide us is stored in a secure computing environment protected by secure firewalls to prevent unauthorized access. We control access so that only people who need to access the information can.  All staff are provided security training and are required to adhere to a comprehensive set of security policies, procedures, and standards related to their jobs. When you use secure areas of our Services, we use SSL with 2048bit encryption. This means that all the information sent between your computer and our secure computer environment is encrypted or scrambled so that no one can read it in transit. Secure areas of the site have a time-out feature.
4530	1	We use third parties to help us operate and improve our Services. These third parties assist us with various tasks, including hosting and maintenance, on-going development, analytics, customer care, marketing, advertising. We may also share information with advertising partners who distribute advertising in our Services.
5062	0	If you have any questions, comments or concerns regarding our Privacy Policy and/or practices, please contact us at support@greenpandagames.com. All other inquiries should be directed to our support page.
4347	0	We may use your information to:create game accounts and allow users to play our games;
505	1	We will share your personal information with our Service Providers for all purposes described in Section entitled “How do we use the information collected?” and as reasonably necessary in order to provide the Services to you or to carry out your instruction (for example, to process a payment instruction).  When our Service Providers collect or receive personal information, we require them to use such information only on our behalf and for purposes consistent with this Privacy Policy.
2178	0	Lima Sky, LLC (“Lima Sky”) has adopted this privacy policy (“Privacy Policy”) to explain how Lima Sky collects, stores, and uses the information collected in connection with Lima Sky’s products, services, and websites (together “Services”).
3223	0	We are able to deliver our Games and products, personalize content, and make suggestions for you by using this information to understand how you use and interact with our Games and products and interested in on our Games and products.
4139	1	Trials of Heroes may hire agents and contractors to collect and process personal data on Trials of Heroes’s behalf and in such cases such agents and contractors will be instructed to comply with our Privacy Policy and to use personal data only for the purposes for which the third party has been engaged by Trials of Heroes. These agents and contractors may not use your personal data for their own marketing purposes. Trials of Heroes may use third party service providers such as credit card processors, e-mail service providers, shipping agents, data analyzers and business intelligence providers. Trials of Heroes has the right to share your personal data as necessary for the aforementioned third parties to provide their services for Trials of Heroes. Trials of Heroes is not liable for the acts and omissions of these third parties, except as provided by mandatory law.
5040	0	(Last updated on 20th June. 2019)
3432	1	We inform you that our service providers implemented their own policies and rules concerning protection of personal data. For more information please visit websites of the service providers
789	1	Verification and Monitoring. We may need to share your information to third parties who assists us in verifying the accuracy of your information. We may also need to engage third parties who assist us with monitoring use of our Service, to detect and prevent fraud and collusion.
1787	0	By making available the Services we, acting reasonably and in good faith, believe that you:have all necessary rights to register on and use the Services;provide true information about yourself  to the extent necessary for use of the Services;understand that by the posting your personal information you have manifestly made this information public, and this information may become available to other Site users and internet users, be copied and disseminated by them;understand that some types of information transferred by you to other Service users cannot be deleted by you or us;are aware of and accept this Privacy Policy.
3365	1	Some embeds may ask you for personal information, such as submitting your email address, through a form linked to from a Medium post. We do our best to keep bad actors off of Medium. However, if you choose to submit your information to a third party this way, we don’t know what they may do with it. As explained above, their actions are not covered by this Privacy Policy. So, please be careful when you see embedded forms on Medium asking for your email address or any other personal information. Make sure you understand who you are submitting your information to and what they say they plan to do with it. We suggest that you do not submit your email address or other personal information to any third-party through an embedded form.
2350	1	This is an integrated service that allows us to track you as a certain user. This service identifies the user by unique ID (assigned to the device). It stores and processes data about users behaviour in game. It also stores and processes user’s IP to establish user’s country of origin.
2530	0	Last updated: 1 September 2018
2811	1	Medium doesn’t control what data third parties collect in cases like this, or what they ultimately do with it. So, third-party embeds on Medium are not covered by this Privacy Policy. They are covered by the privacy policy of the third-party service (so, when you watch a YouTube video embedded in a Medium post, the use of data about your interactions with the video would be covered by YouTube’s privacy policy).
5065	0	We take reasonable and appropriate measures to protect personal information from loss, misuse and unauthorized access, disclosure, alteration and destruction, taking into account the risks involved in the processing and the nature of the personal information.
2485	0	1.Information you give us
45	0	We use this information in order to manage and administer the Services provided to you.
1356	0	When you use the App, some information about your device and your user behaviour may be processed automatically. This information is generally non-personal, and we may access it only in aggregated form. We process this information on the ground of our legitimate interest in improving our App and giving our users the best experience. Otherwise we may not be able to provide you with all the requested services and features of the App.
3551	0	We will keep your Personal Data for as long as reasonably necessary for the purposes described in this Privacy Policy, while we have a legitimate business need to do so, or as required by law (e.g. for tax, legal, accounting or other purposes), whichever is the longer.
4220	0	A Thinking Ape is a gaming company, headquartered in British Columbia, Canada. Our main business is to publish game applications online and through downloadable applications.
4977	1	Other parties in connection with any company transaction, such as a merger, sale of company assets or shares, reorganization, financing, change of control or acquisition of all or a portion of our business by another company or third party or in the event of bankruptcy or related or similar proceedings; and third parties as required to (i) satisfy any applicable law, regulation, subpoena/court order, legal process or other government request, (ii) enforce our Terms of Use Agreement, including the investigation of potential violations thereof, (iii) investigate and defend ourselves against any third party claims or allegations, (iv) protect against harm to the rights, property or safety of Filmigo, its users or the public as required or permitted by law and (v) detect, prevent or otherwise address criminal (including fraud or stalking), security or technical issues.
2852	0	comply with all regulatory and legal requirements, and answer any requests from Data Protection Authorities or any law-enforcement agency
5051	1	We share personal data with third parties that we hire to provide services or perform business functions on our behalf, based on our instructions. We share your personal information with the following types of service providers:cloud storage providers
