	sentiment	review
185	0	"This is the Privacy Policy of MOVEFAST COMPANY (""Company"") and its live streaming broadcast service HAKUNA (""Service"") and is incorporated into and is subject to our TERMS OF SERVICE which can be found at https://hakuna.live/terms-of-service. Please read on to learn more about our data handling practices. Your use of the Service signifies that you agree with the terms of this Privacy Policy. If you do not agree with the terms of this Privacy Policy, you may not use the Service and must immediately terminate your use of the Service."
4997	1	and we will promptly remove you from ALL correspondence.
1807	1	You are always free to opt out from the future collection of your personal information by OUTFIT7 in accordance with this Privacy Policy by uninstalling all the Apps from each of your computing devices.
3402	0	"In addition we also use social media cookies. You may register for Platform membership and ""share"" Platform content through social media such as Facebook and Twitter. Sometimes we embed videos from websites like YouTube. These websites have their own privacy policies which govern their use of information, which you can find on the respective websites."
2249	1	As noted above, you may limit advertising tracking using advertising identifiers through your mobile device’s privacy settings.
2309	0	This Application does not collect precise information about the location of your mobile device. 
5288	1	We may send periodic promotional or informational emails to you. You may opt-out of such communications by following the opt-out instructions contained in the e-mail. Please note that it may take up some time for us to process opt-out requests. If you opt-out of receiving emails about recommendations or other information we think may interest you, we may still send you e-mails about your account or any Services you have requested or received from us. If you want to review, delete, or change the information we have about you, no longer want us to make active use of your information, or have additional questions, please send an email to us at the following address: privacy@bolegames.com with your request and identifying information in the body of the email, including your first name, last name, e-mail address or login name you use to access our Application and Services. We will respond to your email as soon as possible. Please note that certain records, for example those relating to payments or customer service matters, will be held for legal and accounting purposes. We may not be able to delete content posted on a public forum through the Services, if applicable. If you have previously allowed us to access your geolocation data or receive push notifications, you can stop making geolocation available to us or receiving push notifications by visiting your mobile device's settings for the relevant Application or in some cases, through the Application itself. In some instances you can also stop or limit the type of cookies you allow. Please note that you may lose some of the features and functionality of our Services and Applications because accepting cookies may be necessary to track and enhance your game play and other activities.
3578	1	Uber provides means for you to see and control the information that Uber collects, including through:in-app privacy settingsdevice permissions
1335	0	Uber retains certain information, including transaction, location, device and usage information, for a minimum of 7 years in connection with regulatory, tax, insurance and other requirements in the places in which it operates. Once such information is no longer necessary to provide Uber's services, enable customer support, enhance the user experience or other operational purposes, Uber takes steps to prevent access to or use of such information for any purpose other than compliance with these requirements or for purposes of safety, security and fraud prevention and detection.
4746	0	Device Information: We collect information about the device you use to access the App, including information about the device’s software and hardware, unique device identifiers (i.e. Device ID and advertising ID), device tokens for push- messages, mobile network information and time zone.
2127	0	In accordance to Article 15 of the GDPR you may request access to processed Personal Data. This includes confirmation as to whether or not personal data concerning him or her are being processed, and, where that is the case, access to the personal data and the following information:the purposes of the processing;the categories of Personal Data concerned;the recipients or categories of recipient to whom the Personal Data have been or will be disclosed, in particular recipients in third countries or international organizations;where possible, the envisaged period for which the personal data will be stored or, if not possible, the criteria used to determine that period;the existence of the right to request from the controller rectification or erasure of personal data or restriction of processing of personal data concerning the data subject or to object to such processing;the right to lodge a complaint with a supervisory authority;where the Personal Data are not collected from you, any available information as to the source;the existence of automated decision-making, including profiling, referred to in Article 22(1) and (4) and, at least in those cases, meaningful information about the logic involved, as well as the significance and the envisaged consequences of such processing for the data subject.
1560	0	You can always opt not to disclose information to us, but keep in mind some information may be needed to register with us or to take advantage of some of our features.
1897	0	It is possible that your personal information may be transferred outside of the EEA by Ad Networks or to Skillz. We recommend that you refer to the privacy policies and/or terms and conditions of these third parties if you are concerned about your data being transferred outside the EEA.
4190	0	"Ubisoft Ltd, Ubisoft Entertainment SA, Ubisoft EMEA SAS, Ubisoft, Inc., Ubisoft Mobile Games, Red Storm Entertainment, Inc., Blue Byte GmbH are part of the same group of companies (together, ""Ubisoft"" or ""we""). We respect the privacy rights of our customers and are committed to protecting the personal information collected about you. We have adopted this Privacy Policy to explain how we collect, store, and use the information you provide us. By using the Ubisoft Services, you signify your assent to the terms of the Privacy Policy. If you do not agree to this Privacy Policy, please do not use the Services. We reserve the right to make changes in this Privacy Policy, so please check back from time to time to ensure you are aware of any changes. Your continued use of the Services will signify your acceptance of these changes."
5193	0	This Privacy Policy applies only to personal information submitted and collected through the Services. By installing, using, registering to or otherwise accessing the Services, you are accepting the practices described in this Privacy Policy. If you do not agree to this Privacy Policy, please do not install, use, register to or otherwise access the Services. Codigames reserves the right to modify this Privacy Policy at reasonable times, so please review it frequently. Your continued used of the Services will signify your acceptance to the changes to this Privacy Policy.
1468	0	We may process non identifiable Analytics so that we can analyse and improve our Games and Online Services.
114	1	If you do not wish to receive notifications from us or be served with targeted advertisements you can opt-out by changing your advertising and notification settings on your device directly.
619	1	By using our application, you consent to our privacy policy.
4219	0	"If non-personal information is collected for an activity that also requires personal information, ""Mobirix"" may combine your non-personal information with your personal information in an attempt to provide you with a better user experience, to improve the quality and value of the Services and to analyze how our Service is used."
1955	1	You may enable/disable, or adjust, Uber's collection of rider location information at any time through the Privacy Settings menu in the Uber app, or via the settings on your mobile device. If you disable the device location services on your device, your use of the Uber app will be affected. For example, you will need to manually enter your pickup or dropoff locations. In addition, location information will be collected from the driver during your trip and linked to your account, even if you have not enabled Uber to collect your location information.
3698	0	2.2 Automatically collected information through the use of technology:
2678	1	Camel Games gives users the option to receive promotional email communications from Camel Games. Users may opt out of these communications. Instructions for discontinuing receipt of promotional email communications from Camel Games will be provided in email communications to users.
5391	1	You can opt-out from AdColony service by visiting the AdColony Opt-out page: http://www.adcolony.com/privacy-policy/opt-out/
2225	0	We also agree to the Individual Redress Principle which requires that individuals have the right to legally pursue enforceable rights against data collectors and processors who fail to adhere to the law. This principle requires not only that individuals have enforceable rights against data users, but also that individuals have recourse to courts or government agencies to investigate and/or prosecute non-compliance by data processors.
2344	0	To keep you informed of offers and promotions relating to our Services and those of other entities within our group, provided that you don’t “opt-out” from this option Legitimate interests so we can send you information about our Services (and promotions and offers) that you may be interested in
1	1	Camel Games also stores on a user's flash memory a unique authorization key that is either entered by the user or downloaded automatically during product registration. This authorization key is used to identify a user as valid and allow access to Camel Games's products, services and third party games. This key is necessary for Camel Games to supply any products and services subscribed by users.
3812	0	Your information may also be stored and process in any country in which we provide service to due to server facilities and third-party service teams. By using our service, you consent to any such transfer of information outside of your country.
21	0	(d) Right to request that your personal information is erased.
4829	1	The Privacy Settings menu in the Uber rider app gives users the the ability to set or update their location and contacts sharing preferences, and their preferences for receiving mobile notifications from Uber. Information on these settings, how to set or change these settings, and the effect of turning off these settings are described below.
499	1	You have the right to opt out of certain uses and disclosures of your personal information.
1797	0	UCWeb has created this Policy to explain our privacy practices so you will understand what information is collected, how it is used, and your rights to your information.
672	0	If you have previously consented to any direct marketing communication from us or subscribed to our newsletters, you can unsubscribe by clicking on a link available in each communication and newsletter we send you.
4084	0	Your privacy is very important to VivaVideo. We hope our policy is straightforward and easy-to-understand. Please take a minute to review the details of our privacy policy below.
3197	0	We may receive information about you from third parties. For example, if you access our websites or Service through a third-party connection or log-in, for example, through Facebook Connect, by ﾡﾰfollowing,ﾡﾱ ﾡﾰliking,ﾡﾱ adding the Canva application, linking your account to the Canva Service, etc., that third party may pass certain information about your use of its service to Canva. This information could include, but is not limited to, the user ID associated with your account (for example, your Facebook UID), an access token necessary to access that service, any information that you have permitted the third party to share with us, and any information you have made public in connection with that service. You should always review, and if necessary, adjust your privacy settings on third-party websites and services before linking or connecting them to the Canva Service. You may also unlink your third party account from the Service by adjusting your settings on the third party service. If you unlink your third party account, we will no longer receive information collected about you in connection with that service.
4151	0	Personal Data is collected for the following purposes and using the following services:Advertising
484	1	How to opt out or influence personalized advertising
4153	0	Access times.
4039	1	Please note that you may still receive advertisements from third parties within Green Panda Games apps even if you opt-out of tailored advertising, but they will not be based on your activity across unrelated web sites or apps.
3353	1	Some of our Services offer social sharing features which let you share actions you take in our Services with other media. You must be over the minimum age limit that is prescribed by the legislation in the individual jurisdictions to use any social sharing features integrated in our Services. The use of such features enables the sharing of information with your friends or the public, depending on the settings you establish with the entity that provides the social sharing feature. Our Services have social features from the following providers:Facebook - https://www.facebook.com/about/privacy/Instagram - https://help.instagram.com/519522125107875?helpref=page_contentAGE LIMITS
3713	0	AppGenre built the FanGenre - Get Followers for Instagram app as a Free app. This SERVICE is provided by AppGenre at no cost and is intended for use as is.
3899	0	Collecting this information enables us to better understand the visitors who come to our Website, where they come from, and what content on our Website is of interest to them. We use this information for our internal analytics purposes and to improve the quality and relevance of our Website to our visitors.
2549	0	Cookies and similar technologies
4236	1	If you wish to delete your account, you can do so by logging into your account or by emailing us using the contact details provided in Section 11 below. After it is no longer necessary for us to retain your Information, we will dispose of it in a secure manner according to our data retention and deletion policies, except as noted in Section 9 below.
176	0	Our processing for the above purpose is necessary for the performance of a contract to which you are party in order to facilitate the delivery of requested products and services, see Section 6(1)(b) of the GDPR.
5007	0	This privacy policy page was created at privacypolicytemplate.net and modified/generated by App Privacy Policy Generator
296	1	a. Email and phone communications
2759	1	If at any time you would like to unsubscribe from receiving future emails, you can email us at
3653	0	Withdrawing consent or otherwise objecting to direct marketing
5019	0	 your gender
3836	1	If you do not want us to use your location for the purposes set forth above, you should turn off the location services for the mobile application located in your account settings or in your mobile phone settings and/or within the mobile application.
2984	0	How do we respond to legal requests or prevent harm?
3354	1	To learn more about choices regarding cookies set through the Service, see our Cookie Policy.
3952	1	If you would like to find out more about the way these third parties collect and process your information please refer to their respective privacy policies and/or terms and conditions by clicking on the links provided above.
667	1	"You can log in to our site using sign-in services (""SN Service"")such as Facebook Connect, Apple’s Game Center, or an Open ID provider. These services will authenticate your identity and provide you the option to share certain personal information with us such as your name, email address, and resume to pre-populate our sign up form. Services like Facebook Connect give you the option to post information about your activities on this Web site to your profile page to share with others within your network."
1561	1	The information you choose to provide above may be shared with your contacts on our service. You have total control over your profile information and you can access to modify at any time. In addition, if you register to our service with your Facebook account (e.g. Facebook Connect), we may store your Facebook ID and corresponding token on our servers and, if you give us your expressed consent, we will have access to and may collect certain information that you make available on Facebook (for example, your first and last names, email address, profile picture, your friend lists and birthdays). Your Profile is available to other users of the Service who are connected to you on our service. In addition, unless you opt-out (which you may do so at any time in the settings of our application), your Profile is discoverable by other users. You may choose to “block” any user on our platform to prevent unwanted access of your Personal Information.
83	0	We will properly store your user information according to relevant laws and regulations of China and countries (regions) where our business is conducted.
2374	1	You may opt-out of receiving promotional emails from us by following the instructions in those emails to unsubscribe, or by emailing support@crazymaplestudio.com. If you opt-out, we will still send you non-promotional emails, such as emails about your accounts or our ongoing business relations.
789	0	Verification and Monitoring. We may need to share your information to third parties who assists us in verifying the accuracy of your information. We may also need to engage third parties who assist us with monitoring use of our Service, to detect and prevent fraud and collusion.
1534	1	You have the option to share your own personal information with other parties, in which case it will be governed by those parties’ own privacy policies – make sure to take a look at them.
5418	1	The online advertising industry also provides websites from which you may opt-out of receiving targeted ads from our data partners and our other advertising partners that participate in self-regulatory programs. You can access these, and also learn more about targeted advertising and consumer choice and privacy, at http://www.networkadvertising.org/managing/opt_out.asp, or http://www.youronlinechoices.eu/ and http://www.aboutads.info/choices/.
4526	0	We care about the safety of your data and, we have implemented industry recognized measures to protect it, but unfortunately we canﾡﾯt guarantee that nothing bad will ever happen to it. (A troop of rabid baboons springs to mind).
411	0	to link or combine information we get from others to help understand your needs and provide you with better service; and
2500	0	3.Under the condition that no private information of an individual user is disclosed, LIKE has the right to analyze the entire user database and utilize the database for commercial purposes.
963	1	Uber provides users with trip status notifications and updates related to your account. These notifications are a necessary part of using the Uber app, and cannot be disabled. However, you may choose the method by which you receive these notifications through the Privacy Settings menu in the Uber app.
839	0	Our legitimate interest for this purpose is our interest in improving our Service so that we understand users’ preferences and are able to provide you with a better experience (for example, to make the use of the App easier and more enjoyable, or to introduce and test new features).
1500	0	provide gaming experiences that you may like and functionalities you have subscribed to
1034	0	The data controller is Easybrain Ltd, with a registered address at 3 Krinou Street, 6th floor, The Oval, 4103 Limassol, Cyprus.
975	1	Who you may choose to share your User Content with
2376	0	Information we collect may be stored or processed on computers located in any country where we do business.
4433	1	post at Ubisoft EMEA SAS, 28 rue Armand Carrel, 93108, Montreuil-sous-bois, France (written in English language)
3268	1	We have created an opt-out option within some of our Apps. You may choose it by visiting ''Info Screen'', ''Settings'' and ticking the ''Disable Interest-Based Ads''. Choosing this option will mean that you will still be served ads, but they will not be tailored to your preferences. Should you decide to opt out of advertising altogether, you may make an in-app purchase to do so, or you can delete the App.
4986	0	We will not rent or sell your personal information to the third- party, but for your better use of the services provided by third-party organizations we may share your information with third-party organizations that provide automatic data processing technologies for the Software or providing service to the Software. We do not have power to control or influence these third- parties’ tracking technologies or how they may be used. Therefore, if you do not want to share your personal information with any third-party organizations, please do not use such service provided by that third-party organizations.
1608	0	You can manage your Facebook ads preferences here: https://m.facebook.com/ads/ad_choices
410	1	Share Live Location (Riders)
2459	1	You have control over your account settings, such as your account information and email notifications, but thereﾡﾯs some important stuff weﾡﾯll always send you.
4233	1	How to opt out or influence personalized advertising
46	1	To opt-out of receiving advertisements for our Services and products, send us request through the in-app support feature, by going to our app -> click on three dots (or more) -> click help (or support) -> and then click Contact us (or +) and send us your request.
1959	0	I want to inform you that whenever you use my Service, in a case of an error in the app I collect data and information (through third party products) on your phone called Log Data. This Log Data may include information such as your device Internet Protocol (“IP”) address, device name, operating system version, the configuration of the app when utilizing my Service, the time and date of your use of the Service, and other statistics.
3250	0	Provides us with analytics information based on segmented device data. IP addresses are used to provide geolocation information to customers. Following data is collected: Mobile ad IDs, Installation UUID, Android IDs, IP Addresses. Answers retains identifier data for 180 days.
5431	0	We may engage other companies and individuals to perform services on our behalf. Example of these services include analyzing data and providing customer support. These agents and service providers may have access to your personal information in connection with the performance of services for us.
728	0	What are your rights? Depending on where you live, you may have additional privacy rights. For example, in the EU (particularly under the new GDPR) you have the right to access and obtain a copy of your personal data we possess; you may have the legal right to contact us to request that we delete your personal data from our system; and you have the legal right to ask us to rectify/correct your personal data. We will use commercially reasonable efforts to honour your request, but we may decline requests that are unreasonably repetitive, are disproportionate, infringe the privacy of others or as otherwise permitted by law. Please note though that by withdrawing your consent or otherwise objecting to certain processing of your information, certain Nordeus Services may no longer function properly or be completely unavailable to you.
92	0	"Data with special protections: You can choose to provide information in your Facebook profile fields or Life Events about your religious views, political views, who you are ""interested in,"" or your health. This and other information (such as racial or ethnic origin, philosophical beliefs or trade union membership) could be subject to special protections under the laws of your country."
2431	0	your physical location and that of the devices you use to access our Services
4245	0	Adobe emails
1032	1	You can also control your cookie preferences though the Cookie Preferences Tool https://buyercentral.alibaba.com/privacy/cookie_setting.htm.
4488	1	Control the use of your data for interest-based advertising from Microsoft by visiting our opt-out page.
5443	0	We aim to maintain our services in a manner that protects information from accidental or malicious destruction. Because of this, after you delete information from our services, we may not immediately delete residual copies from our active servers and may not remove information from our backup systems.
2572	0	Subject to limitations in applicable law, you are entitled to object to or request the restriction of processing of your Personal Data, and to request access to, rectification, erasure and portability of your own Personal Data.
228	0	Does the Application collect precise real time location information of the device?
4569	1	We want you to be in control of your information, so we provide you with the following tools.
445	1	When you interact with an email sent from Medium (such as opening an email or clicking on a particular link in an email), we may receive information about that interaction.
