	sentiment	review
4899	0	Uber uses the information we collect to enable communications between our users. For example, a driver may text or call a rider to confirm a pickup location, or a restaurant or delivery partner may call a delivery recipient with information about their order.
4022	1	By using the Service, you are expressing your agreement to this Policy and the processing of your data, including your personal information, in the manner provided in this Policy. If you do not agree to these terms, please do not use the Service.
2875	1	In addition, most advertising networks offer you a way to opt out of targeted advertising.  If you would like to find out more information, please visit http://www.aboutads.info/choices/ or http://www.youronlinechoices.com. Alternatively you can follow the applicable links of the respective third party personalization cookie provided in the table above for details of how to opt out of use of particular advertising or personalization cookies.
1074	0	How will we notify you of changes to this policy?
1764	0	We do not knowingly collect or solicit personal information from anyone under the age of 13 or knowingly allow such persons to use our Service. If you are under 13, please do not send any information about yourself to us, including your name, address, telephone number, or email address. No one under the age of 13 may provide any personal information. In the event that we learn that we have collected personal information from a child under age 13, we will delete that information as quickly as possible.
2509	1	If you want us to stop collecting information about you, there may be some settings you can adjust in your browser or device. But Canva might be pretty boring without it.
2190	0	Aside from cookies, we may also use web beacons, pixel tags and other similar technologies on the website. For example, an email that we send you may contain a link to content on our website, and if you click this link, we will track this click to help us understand your preferences for products or services so that we can proactively improve the customer service experience. A web beacon is usually a transparent image embedded in a website or in an email. A pixel tag in an email allows us to know whether the email has been opened. If you do not wish to have your activity tracked in such ways, you may unsubscribe from our mailing list at any time.
1923	0	y our newsletter we inform you about us and our offers, changes, promotions etc.
5461	1	You can opt-out of from receiving push notifications by turning them off at the device level through the settings of the device.
2847	1	"Update your account at any time by logging in and changing your profile settings. Unsubscribe from email communications from us by clicking on the ""unsubscribe link"" provided in such communications. As noted above, you may not opt out of Service-related communications (e.g., account verification, purchase and billing confirmations and reminders, changes/updates to features of the Service, technical and security notices)."
451	0	Personal Data of Children:  We do not knowingly collect or solicit Personal Data from anyone under the age of 16 in the EU.  If you are under age 16 and reside in the EU, please do not attempt to register for the Services or send any Personal Data about yourself to us.  If we learn that we have collected Personal Data from an EU resident under age 16, we will delete that information as quickly as possible. If you believe that an EU resident under age 16 may have provided us Personal Data, please contact us at support@inkitt.com.
2085	0	Please note that certain features of the Services may be able to connect to your social networking sites to obtain additional information about you. In such cases, Eyewind may be able to collect certain information from your social networking profile when your social networking site permits it, and when you consent to allow your social networking site to make that information available to Eyewind. This information may include, but is not limited to, your name, profile picture, gender, user ID, email address, your country, your language, your time zone, the organizations and links on your profile page, the names and profile pictures of your social networking site “friends” and other information you have included in your social networking site profile. Eyewind may associate and/or combine as well as use information collected by Eyewind and/or obtained through such social networking sites in accordance with this Privacy Policy.
2102	0	Advertise and market to you, which includes sending promotional communications, targeting advertising, and presenting you with relevant offers.
4021	0	International transfers of personal information
824	0	Under this legal basis we:• Provide our Service (in accordance with our Terms and Conditions of Use)• Customize your experience• Manage your account and provide you with customer supportfor our (or others') legitimate interests, unless those interests are overridden by your interests or fundamental rights and freedoms that require protection of personal data;
3081	1	We will send push notifications only to users who allow us to do so in order to reengage them in terms of using the App. You may unsubscribe at any time by following the instructions in section Push Notifications of this Privacy Policy. We strive to ensure that the content of the push notifications will always be family-friendly. Push notifications are local, contextual and sent in app only and not from a server or in conjunction with other user information.
4341	0	If you contact us, we may keep a record of that correspondence.
703	0	Your information collected through the Service may be stored and processed in the Turkey or any other country in which Reports+, its Affiliates or Service Providers maintain facilities. Reports+, its Affiliates, or Service Providers may transfer information that we collect about you, including personal information across borders and from your country or jurisdiction to other countries or jurisdictions around the world.
1498	1	We may occasionally send you push notifications through our mobile applications to send you game updates, high scores and other service related notifications that may be of importance to you. You may at any time opt-out from receiving these types of communications by turning them off at the device level through your settings.
385	0	If you have any requests, questions or concerns about our use of your personal information and this Privacy Policy, please contact us at DataProtection@service.alibaba.com.
3245	1	In order maximize the benefits of the App, this mobile short notice lists the App's optimal collection practices. You'll be able to opt-in or modify collection settings according to your phone's privacy settings.
910	1	Any Member and/or Account Owner who wishes to have an account and all PII deleted can send an email to accounts@homerapp.com.
5429	0	We are entitled to change or update this privacy policy whenever we find it necessary. In case of changes, we will make this Policy available in the internet. Any changes to this policy will become binding within 30 days from publishing it. If you do not agree with the changes, we will ask you to cease to use our apps and services.
2702	0	Pages you visited before or after navigating to our website.
4041	0	You can always control what information you choose to share with us on the Service. To do so, you can change your settings in the Service or in your mobile device. Alternatively, you can remove the Service and the Application from your mobile device entirely.
1533	1	You may opt-out of receiving promotional emails from us by following the instructions in those emails by emailing us with the contact information provided in this policy.  If you opt-out, we may still send you non-promotional emails, such as emails about your accounts or our ongoing business relations.
4482	0	Sharing of information sometimes involves cross-border data transfers, including transfers outside of the EEA in accordance with the law. We only transfer Personal Data to entities in third countries that have provided appropriate safeguards to ensure that their level of data protection is in agreement with this privacy policy and applicable law, for example in accordance with the rules and procedures known as the EU-US Privacy Shield, or under contractual provisions which have been deemed by the European Commission to provide sufficient safeguards for personal data.
4492	1	Go to your Settings > Select General > Select About > Select Advertising > Enable the “Limit Ads Tracking” setting
817	1	There are multiple opt-out options for users of this Application:Opt-out of all information collection by uninstalling the Application: You can stopall collection of information by the Application easily by uninstalling the Application. You may use the standard uninstall processes as may be available as part of your mobile device or via the mobile application marketplace or network. You can also request to opt-out via email, at privacy@ku.co .
64	0	Album. We collect and store the photos or files you upload, download, or access with the Peekaboo Moments Service (“photos or files”). If you add a photo or files to your Peekaboo Moments that has been previously uploaded by you or another user, we may associate all or a portion of the previous photo or files with your account rather than storing a duplicate.
4192	1	marketing opt-outs
3742	0	When you use these social networking platforms and plugins, your username and password for the services and other information available about you or collected from you on these services may be shared with us. When you use social networking platforms and plugins, you share your information with them and their privacy policy applies to their collection, use, and disclosure of such information. In addition, they may be able to collect information about you, including your activity on our Services, and they may notify your connections on the social networking platform about your use of our Services. Such third party services may also employ unique identifiers which allow your activity to be monitored across multiple websites for purposes of delivering more targeted advertising to you. For more information about Facebook Connect, please visit http://www.facebook.com/help/405977429438260/. Please note that its privacy policy may be different from our own and we encourage you to read it.
5098	1	You may opt out of receiving promotional emails from Uber here. You may also opt out of receiving emails and other messages from Uber by following the instructions in those messages. Please note that if you opt out, we may still send you non-promotional messages, such as receipts for your rides or information about your account.
4485	0	Aggregated Data: In an ongoing effort to better understand and serve the users of the Services, Chatous often conducts research on its customer demographics, interests and behavior based on the Personal Data and other information provided to us. This research may be compiled and analyzed on an aggregate basis, and Chatous may share this aggregate data with its affiliates, agents and business partners. This aggregate information does not identify you personally. Chatous may also disclose aggregated user statistics in order to describe our services to current and prospective business partners, and to other third parties for other lawful purposes.
514	1	We allow you to choose not to receive promotional email messages from the Service and its service providers. You may opt-out by following instructions in the message sent by the Service on how to unsubscribe from that particular mailing. You may also opt-out by contacting us at help@hakuna.live.
3925	0	User Information: Information you choose to fill in when you use the APP, such as zodiac sign, birth date and gender.Our purposes of collecting the information are: (i) to improve and customize the APP and Services; and/or (ii) to maintain and improve the quality and operation of the APP and Services.
2925	1	Please refer to your mobile device or browserﾡﾯs technical information for instructions on how to delete and disable cookies, and other tracking/recording tools. Depending on your type of device, it may not be possible to delete or disable tracking mechanisms on your mobile device. Note that disabling cookies and/or other tracking tools prevents Canva or its business partners from tracking your browserﾡﾯs activities in relation to the Service, and for use in targeted advertising activities by Canva, including via third partiesﾡﾯ websites. However, doing so may disable many of the features available through the Service. If you have any questions about opting out of the collection of cookies and other tracking/recording tools, you can contact us directly at community@canva.com.
1275	1	c. Do Not Track
2798	1	"By using the Application, you are consenting to our processing of your information as set forth in this Privacy Policy now and as amended by us. ""Processing"", means using cookies on a computer/hand held device or using or touching information in any way, including, but not limited to, collecting, storing, deleting, using, combining and disclosing information."
2585	0	To notify you about changes to our service.
4925	0	We may also share your personal information with:Other companies owned by or under common ownership as Funimate, which also includes our subsidiaries (i.e., any organization we own or control) or our ultimate holding company (i.e., any organization that owns or controls us) and any subsidiaries it owns. These companies will use your personal information in the same way as we can under this Policy;Third party vendors, consultants and other service providers that perform services on our behalf, in order to carry out their work for us, which may include identifying and serving targeted advertisements, content or service fulfillment, or providing analytics services;Our business partners who offer a service to you jointly with us, for example, when running a co-sponsored contest or promotion;Third parties who we think may offer you products or services you may enjoy;Third parties at your request. For example, you may have the option to share your User Content with your friends through email, SMS text, or various social media sites;The public at your request. If you interact with our site or app on social media, for example by tagging your videos #Funimate on Instagram, that piece of User Content will be linked to Funimate on our website or social media profiles and Funimate may display your User Content publicly;Other parties in connection with any company transaction, such as a merger, sale of company assets or shares, reorganization, financing, change of control or acquisition of all or a portion of our business by another company or third party or in the event of bankruptcy or related or similar proceedings; andThird parties as required to (i) satisfy any applicable law, regulation, subpoena/court order, legal process or other government request, (ii) enforce our Terms of Use Agreement, including the investigation of potential violations thereof, (iii) investigate and defend ourselves against any third party claims or allegations, (iv) protect against harm to the rights, property or safety of Funimate, its users or the public as required or permitted by law and (v) detect, prevent or otherwise address criminal (including fraud or stalking), security or technical issues.
5416	0	If you have any questions or comments about this Policy, please contact us at info@samharris.org.
4032	1	You may be able to add, update, or delete Information as explained above. When you update Information, however, we may maintain a copy of the unrevised Information in our records. Please note that some Information may remain in our records for legitimate business reasons even after your deletion of such Information, such as our analyzing aggregated data regarding past usage of the Service (but not in a manner that would identify you personally). Additionally, through Google’s security settings page, you may revoke consent to the use of API Data related to you that was accessed or stored by the Service pursuant to such consent. Company shall delete all such API Data no later than thirty (30) calendar days following such revocation.
1263	0	We use this data to enable us to fulfill our obligations to you as part of the Services (e.g. in cases where you request restoration of your account).
2028	0	You may delete your chat history stored on imo’s servers by selecting the “Delete chat history” option in the settings of the imo app. You may delete your entire account, by selecting the “Delete imo account” option in the settings. Even if you delete your entire account, we may retain limited information about your mobile device for the purposes of fraud detection and enforcement of our Terms of Service.
5224	0	"Ubisoft collects your personal information when you register with us for our products, use the Ubisoft websites, videogames, mobile applications, online store or other services (""Services"") or otherwise contact us online. We use this personal information to: provide you the products or Services you have requested; create your user profile; to send you information about our products or Services and your registration; when you agree, to send you marketing information; and to respond to your correspondence."
2628	1	"If you'd like to opt-out from third party use of this type of information to help serve targeted advertising, please visit the section entitled ""Opt-out"" below."
3142	0	Medium uses third-party vendors and hosting partners, such as Amazon, for hardware, software, networking, storage, and related technology we need to run Medium. We maintain two types of logs: server logs and event logs. By using the Services, you authorize Medium to transfer, store, and use your information in the United States and any other country where we operate.
3396	1	You can opt-out from MobPub service by following the instructions on MoPub Opt-out page: http://www.mopub.com/optout/
299	1	If at any time you choose to opt out from allowing us to use your Information in the future, contact us directly via email to privacy@roosterteeth.com. Upon receipt and process of an opt-out request, we will, within a commercially reasonable period of time, remove your Information from any applicable listings. Note that requests to terminate disclosure to third parties may frustrate or render impossible our ability to provide the Website or conduct transactions initiated by you.
4252	1	Certain Services offered are social by their very nature, so your participation in such a Service will allow others to see your name and/or username, profile picture, social profile, and any other content you upload or disclose through that profile.
3597	1	Your rider rating is available in the main menu of the Uber rider app.
579	0	2.LIKE may collaborate with a third party (an affiliate or otherwise) to provide you with relevant Services. In this scenario, LIKE has the right to share your information with such third party, if such third party agrees to bear responsibility for providing privacy protection no less favorable to that of LIKE.
223	1	You can find the setting for your mobile device by following the directions below, or contact your device provider.
1033	1	You can unsubscribe from marketing email communications from us by clicking on the 'unsubscribe link' provided in such communications. As noted above, you may not opt out of Service-related communications (e.g., account verification, purchase and billing confirmations and reminders, changes, updates to features of the Services, technical and security notices).
766	1	b. Mobile devices
950	1	Notifications: Account and Trip Updates
4694	1	We may offer you the opportunity to invite your contacts from a SN Service (such as your Facebook friends) so that those contacts can be located here in us and/or you can invite them to join you in our games. Such contact information will be used only for the purpose of sending communications to the address.
127	1	Android: To opt-out of ads on an Android device, simply open the Google Settings app on your mobile phone, tap “Ads” and enable “Opt out of interest-based ads”. In addition, you can reset your advertising identifier in the same section (this also may help you to see less of personalized ads).
3931	1	Go to your Settings > Select Privacy > Select Advertising > Enable the “Limit Ad Tracking” setting
297	0	By adjusting the web browser, the Members can choose whether to accept all cookies, to be notified when cookies are installed, or deny all cookies; provided, however, if a Member refuses to install cookies, he/she cannot use some of the services that require the Member to log in.
3873	1	The reason for switching from device IDs to Advertising Identifier is that advertisers are able to use this identifier only for advertising and for no other purpose, while users can choose to opt out of tracking via the settings of mobile phone. Advertising Identifier is an anonymous identifier for advertising purposes which enables users to reset their identifier or opt out of interest-based ads. The parties participating in advertising are obligated to follow users’ choice for opting out of tracking according to the app store guidelines.
1020	0	How and With Whom Do We Share Your Data?  We share Personal Data with vendors, third party service providers and agents who work on our behalf and provide us with services related to the purposes described in this Privacy Policy or our Terms of Use. These parties include:Payment processors
3691	0	Overmobile processes this data to create the User’s account and to identify the User for the purposes of execution and fulfillment of EULA, i.e. to provide User with an opportunity to use the Application. Overmobile uses Social IDs of Users’s friends only to provide User with information about who of his/her social friends are also Users of the Application and their progress in game.
4466	1	You have the right to opt out of certain uses and disclosures of your personal information.
2949	1	What are my opt-out rights?
384	1	If you choose to opt out via “Do Not Track Settings” in your mobile phone all providers of advertising services are bound to comply with such “Do Not Track” setting, but we cannot provide any guarantees on their behalf. If you choose the opt-out option available via our Apps, we will not share your advertising ID with advertisers for the purposes of IBA. We provide no guarantees regarding the information provided prior to opting out. Some providers may have additional opt-out mechanisms implemented.
3832	1	All Users are advised they are responsible for the configuration of settings on their device. To the extent you have provided additional information, in the process of registering an Account you may opt-out of request changes to Privacy or Communications settings as you have authorized them in the process of registering your account by contacting Privacy@Camsurf.com.
3452	0	This Privacy Policy (together with our Terms and Conditions of Use) sets out the basis on which we process any personal information we collect from you, or that you provide to us through the Service.
1256	0	The types of personal information collected in accordance with the activities listed above may vary depending on the activity
2610	1	The online advertising industry also provides websites from which you may opt-out of receiving targeted ads from our data partners and our other advertising partners that participate in self-regulatory programs. You can access these, and also learn more about targeted advertising and consumer choice and privacy, at http://www.networkadvertising.org/managing/opt_out.asp, or http://www.youronlinechoices.eu/ and http://www.aboutads.info/choices/.
4560	0	"Certain APP and Services may include and/or enable you to add content to them. The content may be in the form of buttons, gadgets, links to third party advertisements, websites, products and services (including search services) as well as additional means that are provided to you by third parties (collectively, ""Third Party Content and Services""). The use of such Third Party Content and Services is subject to their privacy policies. You shall be aware that the use of the Third Party Content and Services may give these third parties the ability to access, collect, store, and/or share your information, both your PII and non-personally identifiable information. In order to clarify, we do not review, approve, monitor, endorse, warrant, or make any representations with respect to such Third Party Content and Services and your access to any Third Party Content and Services is at your own risk. We are not responsible for the information contained and/or made available through, the practices of, or your use or inability to use such Third Party Content and Services. You expressly relieve us from any and all liability arising from your use of such Third Party Content and Services. We recommended that you read the terms, conditions and privacy policies of such Third Party Content and Services before using or accessing any of them."
4420	0	LONG TECH NETWORK LIMITED provides the information to trusted partners who work on behalf of or with LONG TECH NETWORK LIMITED under confidentiality agreements. These companies may use users’ personal information to help 337 communicate with users about offers from LONG TECH NETWORK LIMITED and our marketing partners. However, these companies do not have any independent right to share this information.
4585	0	Use and navigation of websites and apps (collected through cookies and similar technologies, or by Adobe servers when you are logged in to the app or website);
