	sentiment	review
5237	0	If you use our Services on Facebook, we may receive any of your information you provide or permit to be provided to us via Facebook. Such data may include your user ID and your use of our game, including with whom you share our game on Facebook and your email address in case you wish to contact us for support. The information we receive depends on the Services you are using, Facebook terms of service and privacy policy, your privacy settings, and, if applicable, your friends’ privacy settings.
3652	1	You may enable/disable location sharing with your driver at any time through the Privacy Settings menu in the Uber app. You may use the Uber app if you have not enabled location sharing, but it may be more difficult for your driver to locate you.
1201	1	We neither have access to, nor does this Privacy Policy govern, the use of cookies or other tracking technologies that may be placed on the device you use to access the Services by non-affiliated third parties.
4831	1	You may enable Uber to send you push notifications about discounts and news from Uber. You may enable/disable these notifications at any time through the Privacy Settings menu in the Uber app.
2191	1	Choose whether you wish to receive promotional emails, SMS messages, telephone calls, and postal mail from Microsoft.
2988	1	You can set your web browser to warn you about attempts to place cookies on your computer or limit the type of cookies you allow. If you disable cookies, you may lose some of the features and functionality of our Services because Green Panda Games cookies are necessary to provide our web-based Services.
5102	1	By default all content you post on Canva is private. If you do choose to make designs or other information public, that information may remain visible even after your remove it via cached and archived pages, or if other users have made copies.
5213	1	If you receive an unwanted email from us, you can use the unsubscribe link found at the bottom of the email to opt-out of receiving future emails. We will process your request within a reasonable time after receipt. Note that you will continue to receive transaction-related emails regarding products or services you have requested. We may also send you certain non-promotional communications regarding imo and our Services and you will not be able to opt out of those communications (e.g., communications regarding updates to our Terms or this Privacy Policy).
5328	0	We collect technical data necessary for you to use our App and additional technical data that enables us to maintain and analyze the functioning of the App, to personalize the content of the App, and to display advertisements.
3053	1	You can visit the Site (CΗΑΤΟUS, Chatοus, Chatομs, Çhatous, Chаtous, Ꮯhatous, ᴄhatous) without providing any Personal Data. If you choose not to provide any Personal Data, you may not be able to use certain Services.
1790	0	We will retain your Personal Data only for as long as is necessary for the purposes set out in this Privacy Policy. We will retain and use your Personal Data to the extent necessary to comply with our legal obligations (for example, if we are required to retain your data to comply with applicable laws), resolve disputes, and enforce our legal agreements and policies.
4115	0	We are also linked to joint websites that are maintained by CXZH.LTD in coordination with one or more of our commercial copartners. When you are submitting information to one of our joint websites, it is possible that you are submitting such information to both CXZH.LTD and our commercial copartners, but the privacy policy adopted by the joint websites may be different from this privacy policy of CXZH.LTD. Therefore, we recommend that you read the privacy policy on any linked joint websites, so as to obtain the most complete information regarding the privacy criteria of such websites.
1102	0	These rights may be exercised by using the tools Overmobile offers on the Website or in the Application or by contacting Overmobile with your specific request through the methods described below. Overmobile will address any such requests in a timely manner. In certain cases, Overmobile may ask you to verify your identity before acting on your request. If you are unsatisfied with Overmobile’s response, you may refer your complaint to the relevant supervisory authority in your jurisdiction.
1301	0	We only share your Personal Information as described in this privacy policy in order to provide and improve the Services, facilitate a merger or sale of our business, or if required to do so by law. As stated above, we do not log your browsing data and we delete your IP address when you disconnect from the VPN. Here are some more specifics on whom we share your information with and why:To our third party service providers who provide services such as website hosting, payment processing, data analysis, information technology and related infrastructure provision, customer service, email delivery, fraud prevention, online advertising, auditing, and other services.
3216	1	You may opt-out of the use of your personal information, as further described below.
2483	1	Opting out of collection of your information
3766	0	Perform internal operations necessary to provide our services, including to troubleshoot software bugs and operational problems, to conduct data analysis, testing, and research, and to monitor and analyze usage and activity trends.
869	1	c. Do Not Track
1219	0	Crash and usage data
469	1	"By checking the box ""I agree"" accompanied with the link to this Policy you with your own free will and for your benefit give your written consent to the processing of User’s Data for the purposes and under the terms and conditions stipulated by this Policy."
592	1	a. Email and phone communications
1541	0	In addition, we create a unique user ID to track your use of our Service. We do not use your ID and information related to it outside the scope of the game with which it is associated.
1775	1	Once you register to our Services and/or purchase one of our products, Ubisoft will send you promotional communications about its own products and Services that you may be interested in by email. Along with every communication sent to you, Ubisoft gives you the opportunity to discontinue receiving future communications from Ubisoft.
4906	1	You can opt-out of interest-based advertising on mobile applications by checking the privacy settings of your Android or iOS device and selecting “limit ad tracking” (Apple iOS) or “opt-out of interest based ads” (Android). For personalized in-game offers opt-out, you can use the options provided in the game settings.
690	0	We may disclose your Personal Data to an actual or potential buyer (and its agents and advisers) in connection with any actual or proposed purchase, merger or acquisition of any part of our business, provided that we inform the buyer it must use your Personal Data only for the purposes disclosed in this Privacy Policy.
5078	0	In connection with our processing, we use data processors such as server hosting providers, technical service providers for supporting internal operations, user login services and analytics service providers.
4871	0	Profile information (such as a profile picture)
1392	1	iOS: On your iPhone or iPad, go to “Settings,” then “Privacy” and tap “Advertising” to select “Limit Ad Track”. In addition, you can reset your advertising identifier (this also may help you to see less of personalized ads) in the same section.
4662	1	You can also opt-out from AdColony through the Digital Advertising Alliance in the USA http://www.aboutads.info/choices/ or opt-out using your mobile device settings.
3167	0	NGEE ANN CITY SINGAPORE 238874
3917	1	Please know that when a Member engages in some of our Services, they may choose to share information that is considered PII. Currently, only Members have full access to all of the functionality in our Services. It is a Member’s own decision whether to provide us with your or your child’s PII. Moreover, Members have the ability to restrict access to any of the features associated with their account through the “Parent Settings” feature. In some cases, a Member declines to share such information with us, then we may not be able to provide him/her with certain Services.
4897	0	The Company asks for permission to access the stored data or functions within a Member’s mobile device when the Members use the Service through a mobile application. When required, the Company asks for such permission in the form of either access that is necessary no matter what to provide the Service and access that is not, which can later be changed by the Member through the “Settings” option on their mobile device.
3436	0	The scope of the services may depend on the type of account, subscription, or trial you have.
171	0	Within the present privacy policy of the LLC «WebmartGroup» under personal data the information relating to an identified or identifiable User is understood, in particular: name, surname, e-mail address.
3366	0	For the purpose of this Privacy Policy, “Personal Information” means any information relating to an identified or identifiable individual. We obtain Personal Information relating to you from various sources described below.
4369	0	We provide many choices about the collection, use and sharing of your Information.
3624	1	You may also opt-out of receiving SMS notifications from us, either via SMS or by emailing us.
4425	0	Trials of Heroes may use and disclose to Trials of Heroes’s partners and contractors the collected non-personal data for purposes of analyzing usage of the Services, advertisement serving, managing and providing the Services and to further develop the Services and other Trials of Heroes services and products.
3397	1	If you have enabled the device location services on your mobile device, you may also enable Uber to share your location with your driver from the time you request a ride to the start of your trip. This makes it easier for your driver to pick you up.
5318	1	"You may ""opt out"" of receiving marketing or promotional emails from us by following the instructions in those emails or by emailing us at support@geozilla.com. If you opt out, we may still send you non-promotional emails, such as emails about your accounts or our ongoing business relations. To opt out of push notifications, please edit settings within the app or change your settings at the device level."
3684	0	Advertisers on mobile devices and our third party advertising and analytics partners sometimes collect and use Advertising IDs to enable and optimize advertising. Advertising IDs are non-permanent device identifiers such as the Android advertising ID and/or Apple's ID for advertising.
4241	1	Opting Out of Certain Functions. By adjusting your browser, hardware, or mobile device settings according to the requirements of the manufacturer or carrier, you can disable certain features in your privacy settings. You understand that it is your obligation to make these adjustments to make this decision. You are also advised that if you opt out of any such service, you may not be able to use the full functionality of the Service.
3466	1	You have an option to opt out from sharing your information and data for the purposes of interest-based advertising at all times. When you opt out, you will not stop receiving ads, they just won't be based on topics you like, your interest, behavior, demographics, etc. You can opt out by choosing one of the following options (for more information please read the ''Opt Out'' Section of our Privacy Policy):
1691	1	If you do not want Ubisoft to send you communications about special rebates or promotional offers, you may opt-out from receiving these communications at the time your personal information is collected or by contacting us by:email at emea-email-support@ubisoft.com
5185	0	We also collect information you choose to provide to us when you complete any “free text” boxes in our forms (for example, support request or survey submission). In addition, we may collect Personal Data disclosed by you on our forums, blogs and our other areas of the Services to which you can post information and materials.
4130	1	Uber uses rider's device location services to make it easier to get a safe, reliable ride whenever you need one. Location data helps improve our services, including pickups, navigation, and customer support.
2590	1	When you install our apps on your mobile device you can choose to receive push notifications, which are messages an app sends you on your mobile device even when the app is not on. You can turn off notifications by visiting your mobile device’s “settings” page.
1160	0	We may update our Privacy Policy from time to time. We will notify you of any changes by posting the new Privacy Policy on this page.
740	0	Grounds for retention: E-Commerce Act
3759	1	Sometimes we’ll send you emails about your account, service changes or new policies. You can’t opt out of this type of “transactional” email (unless you delete your account). But, you can opt out of non-administrative emails such as digests, newsletters, and activity notifications through your account’s Settings page.
2780	0	We may take additional verification steps where we consider reasonable in order to verify your account.
3265	0	Welcome, here is our policy on privacy. Our privacy policy, if you will.
2032	1	Be advised that if you send messages or post material containing Personal Information, that information may be collected and used by others.
3416	0	facehunterlee@gmail.com].We would try our best to notify the third party of deleting the relative personal data, but no warranty as to the deletion is made by us.
68	0	For more information on how Google uses the collected information, please visit the “How Google uses data when you use our partners’ sites or app” page: http://www.google.com/policies/privacy/partners/ or visit the Privacy Policy of Google: http://www.google.com/policies/privacy/
3761	1	If you turn on “Limit Ad Tracking” on your iOS device or “Opt Out of Interest-Based Ads” on your Android device, you can restore interest-based ads by turning the settings off. When you opt out, you may still see the same number of ads on your mobile device; however, these ads may be less relevant because they won’t be based on your interests. Our advertising partners may continue to serve you ads based on other non-personal information, such as ads related to the content of the application you are using.
4280	1	Please see the Choice & Transparency section below for further information about these data collections and uses, how to opt in or out of them, and the effect of opting out of these on your use of Uber's apps.
2720	0	If you have additional questions about Alexadra Games's privacy practices related to children under the applicable minimum age, please contact us at support@alexandragames.com.
444	0	California Civil Code Section 1798.83 permits registered Account Holders of Camsurf that are California residents to request certain information regarding our disclosure of personal information to third parties, or to change privacy settings to the extent they are available. You may opt-out of communications, or request privacy related changes by contacting us at Privacy@Camsurf.com.
3661	0	When you use our Apps we may display contextual advertisements to you. In order to enable advertising we allow our advertising partners to collect online identifiers (such as Advertising ID on Android and IDFA on iOS) that might be considered as personal information under some legislations, but they should use it solely for the purposes of contextual advertising. For any other purposes they should use the information solely on anonymized and aggregated basis.
3650	1	You control your account information and settings
3325	0	The app does use third party services that may collect information used to identify you.
4718	1	You may also request that Uber provide you with explanation, copies or correction of your data.
1384	0	This policy sets out how Canva collects and uses the information that we collect about you when you use the Canva services. This policy also explains the choices that you can make about the way that we use your information.
4852	0	Please read and accept their Privacy Policies before you use our Services
757	1	Emails we send you may include a technology (called a web beacon) that tells Adobe whether you have received or opened the email, or clicked a link in the email. If you do not want us to collect this information, you can opt out of receiving Adobe marketing emails.
5251	1	Users may opt-out of certain Firebase features through applicable device settings, such as the device advertising settings for mobile phones or by following the instructions in other Firebase related sections of this privacy policy, if available.
1000	0	Business Transfers. If we are involved in a merger, acquisition, or sale of all or a portion of our assets, your information may be transferred as part of that transaction, but we will notify you (for example, via email and/or a prominent notice on our website) of any change in control or use of your Personal Information or Files, or if either become subject to a different Privacy Policy. We will also notify you of choices you may have regarding the information.
1326	0	Adobe ID, registration, and customer support
2554	1	When you choose to opt-out, advertising networks will consider this choice as a withdrawal of consent to personalized advertisement experience and they will show contextual advertisements and not personalized advertisements based on your interests.
4366	1	We may collect your email address when you contact our customer service group and we may use that email address to contact you about your gaming experience with us and notify you about company news and promotions.
193	1	Subject to your consent we can occasionally send you push notifications via mobile device in order to provide you with the updates for the games, data about the greatest number of the points gained and other messages connected with Overmobile’s services which can be important for you. At any time you can to give up on such communications and turn them off by changing the relevant settings on the device.
4979	1	After every trip, drivers and riders are able to rate each other, as well as give feedback on how the trip went. This two-way system holds everyone accountable for their behavior. Accountability helps create a respectful, safe environment for both drivers and riders
1362	1	You can stop all collection of information by the Application easily by uninstalling the Application. You may use the standard uninstall processes as may be available as part of your mobile device or via the mobile application marketplace or network. You can also request to opt-out via email, at support@gamebeartech.com.
3984	1	You can always opt not to disclose Information or to disable certain tools on your browser or device. However, this may limit your ability to fully utilize the Service.
2660	1	Following termination or deactivation of your account, Reports+, its Affiliates, or its Service Providers may retain information (including your profile information) and User Content for a commercially reasonable time for backup, archival, and/or audit purposes.
663	1	If you choose to use AppStore to finalize and pay for your order, you will provide your credit card number directly to Apple. Apple’s Privacy Policy will apply to the information you provide to Apple.
552	1	You have certain rights with respect to your information as further described in this section.
2034	1	Location Information
4375	0	In addition, the Application may collect certain information automatically, including, but not limited to, the type of mobile device you use, your mobile devices unique device ID, the Ipaddress of your mobile device, your mobile operating system, the type of mobile Internet browsers you use, and information about the way you use the Application.
1877	0	We do not use the facial tracking and mapping information to identify individuals or to target advertising. We do not share facial tracking and mapping information with third parties.
3302	0	Such information is the basic information that must be collected to render services.
2369	0	Network and connections: information such as the name of your mobile operator or ISP, language, time zone, mobile phone number, IP address, connection speed and, in some cases, information about other devices that are nearby or on your network, so we can do things like help you stream a video from your phone to your TV
1460	1	Note that certain information you post and communicate through a Service or a third party site or service is public information for which you have no expectation of privacy. You may choose to disclose information about yourself in the course of contributing user generated content to our sites or Services or in its chat rooms, blogs, message boards, user “profiles” for public view or in similar forums on its sites through mobile services and/or through third party sites or services.Information that you disclose in any of these forums is public information, and there is no expectation of privacy or confidentiality.
3540	0	Protect us, our business or our users, for example to enforce our terms of service, prevent spam or other unwanted communications and investigate or protect against fraud
920	1	You can opt-out from InMobi service by following the instructions as described on the InMobi Opt-out page: http://www.inmobi.com/page/opt-out/
1289	0	Finally, any time you access the Service, we may collect aggregate information including but not limited to internet protocol addresses, browser type, browser language, referring / exit pages and URLs, platform type, number of clicks, domain names, landing pages, pages viewed and the order of those pages, the amount of time spent on particular pages, and the date and time of this activity.
1450	1	As noted above, you may limit advertising tracking using advertising identifiers through your mobile device’s privacy settings.
2952	1	If we are required to provide you with notice of a particular event or incident, we will send you such notice by email.
1317	0	5.3 Unfortunately, the transmission of information via the internet is not completely secure. Although we will do our best to protect your personal information, we cannot guarantee the security of your information transmitted to our Service and any transmission is at your own risk.
4428	1	If you receive an unwanted email from us, you can use the unsubscribe link found at the bottom of the email to opt-out of receiving future emails. We will process your request within a reasonable time after receipt. Note that you will continue to receive transaction-related emails regarding products or services you have requested. We may also send you certain non-promotional communications regarding imo and our Services and you will not be able to opt out of those communications (e.g., communications regarding updates to our Terms or this Privacy Policy).
4803	0	In this section, we are letting you know what legal basis we use for each particular purpose of processing. For more information on a particular purpose, please refer to Section 2. This section applies only to EEA-based users.
1175	0	● Information you provide us directly:● Registration Information and Profiles.GOGO LIVE will allow the end user to use your mobile number or a third party platform account to register in the Product and create an account.When you create an account, we may collect the personal information you provide to GOGO LIVE, such as your name, gender, date of birth, username, password, email address, picture, or phone number and so on. We also collect the information from the third party account which can be used to identify you.● User Content. We collect the content, communications and other information you provide when you use our Services, including when you create, post or share your photo, voice, videos, messages or communications for the public to view in our Services. Your posted content is still under your control after you post, and you can choose whether you want to continue to post, display or delete such materials.● Communications Between Users and GOGO LIVE. When you contact us with questions, concerns or for purposes of customer/technical support, we collect the information contained in your message, which may include your name, contact details and any other personal information you provide. We may collect some personal information, such as your email address, and names and other information provided by you, when you communicate your opinions about our application and services via our feedback channel,● Geolocation Data. We will collect geolocation data if you choose to share it with us so that we can more accurately filter results on our Services. We may be able to approximate your geolocation based on other information you provide, such as your profile.
1822	0	2.1.6 statistical data about your browsing actions and patterns, which does not identify you. This means information about your computer and your use of our Services, including (where available) your IP address, unique mobile device identifier (UDID), International Mobile Equipment ID (IMEI), Android ID, device MAC address, social platform ID, advertising ID for Android platform, ID for advertisers (IDFA) and ID for vendors (IDFV) for iOS platform, OPEN UDID, ODIN, browser information, operating system, timestamps, the pages that you request, applications downloaded, traffic data, location data, weblogs and other communication data, and the resources that you access.
