	sentiment	review
5202	0	Tracking and fraud prevention for advertising purposes: for some of our Apps we use third party services for tracking and fraud prevention for advertising purposes and for privacy compliance purposes. Please see more in Tracking Section of this Privacy Policy.
1185	1	Please be aware of the open nature of certain social networking and other open features of the Services Magic Seven may make available to you. You may choose to disclose data about yourself in the course of contributing user generated content to the Services. Any data that you disclose in any of these forums, blogs, chats or the like is public information, and there is no expectation of privacy or confidentiality. Magic Seven is not responsible for any personal data you choose to make public in any of these forums.
4113	0	If you withdraw your consent, we will cease processing of the data for which you have withdrawn consent, unless we have a legal obligation to keep some or parts of your data.
4713	1	Notifications: Discounts and News
448	1	If you choose to use Google Checkout to finalize and pay for your order, you will provide your credit card number directly to Google Checkout. Google’s Privacy Policy will apply to the information you provide to the Google Checkout web site.
2827	0	This Service may contain links to other sites. If you click on a third-party link, you will be directed to that site. Note that these external sites are not operated by me. Therefore, I strongly advise you to review the Privacy Policy of these websites. I have no control over and assume no responsibility for the content, privacy policies, or practices of any third-party sites or services.
761	1	You may also choose to share your mobile device’s Contacts list with us (including names, numbers, emails, Facebook ID, Apple ID, etc) and we will store it on our servers to help you better improve our service, e.g. connecting with friends on our service. If you do not want us to store this information, you may opt-out through your account settings or notify us via email. If done so, we will not be able to offer some of our features on our service.
4136	0	We retain your Personal Data as long as we have an ongoing legitimate business need to do so for example to provide services or products to you, or as required or permitted by applicable laws, such as tax and accounting laws. When we have no ongoing legitimate business need to process your Personal Data, we will either delete or anonymise it or, if this is not possible (for example, because your Personal Data has been stored in backup archives), then we will securely store your Personal Data and isolate it from any further processing until deletion is possible.
1650	1	There are several places within Adobe’s websites and apps that allow you to post comments, upload pictures, or submit content for others to see. Sometimes you can limit who can see what you share, but there are some places where what you share can be seen by the general public or other users of the app or website. Please be careful when you share your personal information. Do not share anything you wouldn’t want publicly known unless you are sure you are posting it within an app or website that allows you to control who sees what you post. Please note that when you post messages on certain user forums on our websites and app, your email address or name and/or profile photo may be included and displayed with your message.
1260	0	Our processing for the above purpose is necessary for the performance of a contract to which you are party in order to facilitate the delivery of requested products and services, see Section 6(1)(b) of the GDPR.
631	0	Marketing. We will send you updates and information about our new products and services, upcoming events or other promotions or news by email or push notification. Where required by law, we will only send you marketing information if you consent to us doing so at the time you provide us with your Personal Data. You may opt out of receiving such emails by following the instructions contained in each promotional email we send you or by updating your user settings. In addition, if at any time you do not wish to receive future marketing communications, please contact us at support@languagedrops.com. We will continue to contact you via email regarding the provision of our Services and to respond to your requests.
4379	1	You have choices when it comes to the technology you use and the data you share. When we ask you to provide personal data, you can decline. Many of our products require some personal data to provide you with a service. If you choose not to provide data required to provide you with a product or feature, you cannot use that product or feature. Likewise, where we need to collect personal data by law or to enter into or carry out a contract with you, and you do not provide the data, we will not be able to enter into the contract; or if this relates to an existing product youﾡﾯre using, we may have to suspend or cancel it. We will notify you if this is the case at the time. Where providing the data is optional, and you choose not to share personal data, features like personalization that use such data will not work for you.
2942	1	imo may occasionally send you push notifications through our mobile applications. You may at any time opt-out from receiving these types of communications by changing the settings on your mobile device. We may also collect location-based information if you use our mobile applications. You may opt-out of this collection by changing the settings on your mobile device.
3431	1	Our applications may also deliver notifications to your phone. You can disable these notifications in your phone’s settings or by deleting the relevant application.
4385	0	If the content or information that you store on Adobe apps or websites contains personal information of other individuals, you must be legally permitted to share the personal information with Adobe.
4809	0	We will also aggregate your guest review data with feedback from other customers in order to sort and prioritize guest reviews. We may use the information in your reviews or in other destination-related information you share with us in an anonymous form, unless you have included this information in your public profile. This is to help travelers like you find the right destination and the best accommodation to suit them.
5436	1	You may update your account information by logging into your account and changing your profile settings. You can also stop receiving promotional email communications from us by clicking on the ﾡﾰunsubscribe linkﾡﾱ provided in such communications. We make every effort to promptly process all unsubscribe requests. You may not opt out of Service-related communications (e.g., account verification, purchase and billing confirmations and reminders, changes/updates to features of the Service, technical and security notices). If you have any questions about reviewing or modifying your account information, you can contact us directly at community@canva.com.
4739	1	in-app ratings pages
3940	0	Mimo applications for Android and iOS (“apps”), websites (“websites”), and related services (together with the apps and websites, the “services”) are operated by Mimohello GmbH, Schanzstraße 14/1.1, 1150 Vienna, Austria (thereafter “Mimo,” “us,” or “we”).
3642	1	You can opt in to receive mobile push notifications from the Company. If you change your mind later and no longer want to receive these notifications, you can use your device’s settings functionality to turn them off.
4835	1	We may occasionally email you with offers, promotions, and/or information of interest. To opt out of emails from us, please follow the unsubscribe instructions contained in the relevant emails or contact us at daybreaklegends@gmail.com.
3986	0	With NOVA GEIMS, OOO entities
3029	1	Android: To opt-out of ads on an Android device, simply open the Google Settings app on your mobile phone, tap “Ads” and enable “Opt out of interest-based ads”. In addition, you can reset your advertising identifier in the same section (this also may help you to see less of personalized ads).
3454	1	To learn even more about how to affect advertising choices on various devices, please look at the information available here.
2812	0	The User has the right to withdraw his or her consent at any time. The withdrawal of consent shall not affect the lawfulness of processing based on consent before its withdrawal. Withdrawal is made by the mere notification of the YUMOBI TEKHNOLODZHI, OOO via its Support service, i.e. by sending an e-mail to the addresssupport@umobiapps.com the topic “Consent withdrawal” or in the Settings menu of the application.
1475	1	We won’t email you to ask for your password or other account information. If you receive such an email, please forward it to us at legal@medium.com so we can investigate.
2769	1	You can always stop syncing contacts or delete them from our servers in Settings > Privacy & Security > Data Settings.
1015	0	Usage Data is data collected automatically either generated by the use of the Service or from the Service infrastructure itself (for example, the duration of a page visit).
369	1	"Opt-out from the use of information to serve targeted advertising by advertisers and/or third party network advertisers: you may at any time opt-out from further allowing us to have access to your location data by following those steps: in your device, go to Google Settings / Ads, and check ""opt-out of interested-based ads""."
5396	1	You can opt-out from Flurry Analytics service to prevent Flurry Analytics from using and sharing your information by visiting the Flurry's Opt-out page: https://dev.flurry.com/secure/optOut.do
1994	1	Wherever you are, with Topface you have the opportunity to communicate with your friends, make new acquaintances, and stay in touch with your contacts that you have purchased with our service. You can do this using a mobile phone or by visiting the official website www.topface.com.
2871	1	If you choose to opt out by following one of the third party IBA provider’s opt out mechanism, you should stop receiving interest-based and targeted ads via the selected IBA provider, but you may continue to receive interest-based or targeted ads through other IBA providers. For opting out from receiving interest-based or targeted ads through all IBA providers, please see opt out options b) and c) below.
5041	1	You can withdraw your consent by changing your advertising settings on your device or by deleting the Game at any time.
4460	0	Measurement partners.
134	0	Additional data you provide when you edit your Services profile or settings section such as avatar picture and language preferences.
2978	1	Remember that any exchange of information you make through our Services, in particular by sending private messages or through social media can result in sharing information about you. Such public information will become available to third parties. BOOMHITS is not responsible for your action regarding any of your personal data, or for the actions of any third parties to whom you transmit or share your data.
4554	0	The Application obtains the information you provide when you download and register the Application. Registration with us is optional. However, please keep in mind that you may not be able to use some of the features offered by the Application unless you register with us.
5305	0	We retain your Personal Data as long as needed to provide services or products to you, or as required or permitted by applicable laws, such as tax and accounting laws.
90	1	You may opt-out of the use of your personal information, as further described below.
636	0	The legal bases on which we rely to process your personal information include: your consent to the processing; satisfaction of our legal obligations; necessity to protect your vital interests; necessity to carry out our obligations arising from any contracts we entered with you or to take steps at your request prior to entering into a contract with you; necessity to process in the public interest; or for our legitimate interests as described in those sections. Below is a chart indicating the legal bases we rely in processing personal information.
4217	1	User Profiles and Submissions: Certain user profile information, including your name, location, and any video or image content that such user has uploaded to the Services, may be displayed to other users to facilitate user interaction within the Services or address your request for our services. Your account privacy settings may allow you to limit the other users who can see the Personal Data in your user profile and/or what information in your user profile is visible to others. Please remember that any content you upload to your public user profile, along with any Personal Data or content that you voluntarily disclose online in a manner other users can view (on discussion boards, in messages and chat areas, etc.) becomes publicly available, and can be collected and used by anyone. Your user name may also be displayed to other users if and when you send messages or comments or upload images or videos through the Services and other users can contact you through messages and comments.
2626	0	Parental Participation in Online Activities: Parents are strongly encouraged to participate in their children’s online activities and monitor their children’s use of e-mails and engagement in other electronic communication. Please help us protect your child's privacy by instructing them never to provide personal information on this site or any other without your permission.
3510	1	You should be aware that any personally identifiable information you submit in the course of these public activities can be read, collected, or used by other Users of these forums, and could be used to send you unsolicited messages. We are not responsible for the personally identifiable information you choose to make public in any of these forums.If you post a video, image or photo through a Service for public view, you should be aware that these may be viewed, collected, copied and/or used by other Users without your consent.We are not responsible for the videos, images or photos that you choose to post through a Service.
4618	1	If you do not want to receive tailored in-application advertisements from third parties that relate to your interests in apps on your mobile device, you may opt-out by adjusting the ad tracking settings on your device. You can also reset the “Advertising Identifier” (like an IDFA) from your mobile device’s settings page, which will prevent continued use of existing behavioral data tied to the previous “Advertising Identifier.” In addition, depending on the platform provider (such as Apple or Google), you may be able to download apps, such as the Digital Advertising Alliance’s “AppChoices” app, that offer to provide you with control regarding the collection and use of cross-app data for tailored advertising. Like the opt-out tools mentioned above for web, these mobile opt-out tools are provided by third parties, not Green Panda Games. Green Panda Games does not control or operate these tools or the choices that advertisers and others provide through these tools.
2070	0	- Messages and User Content. We collect information when you message other members of your Family through use of the service. We may also retain any messages you send to us.
3857	0	We will share personal information with companies, organizations or individuals outside of Adobe if we have a good-faith belief that access, use, preservation or disclosure of the information is reasonably necessary to detect, prevent, or otherwise address fraud, security or technical issues, as well as to protect against harm to the rights, property or safety of Adobe, our users, or the public as required or permitted by law.
5272	1	By tapping “Accept” button below you explicitly agree to the Terms and Conditions of Use, Privacy Policy (in particular, to sending your data to third parties, as described above and in the Privacy Policy).
306	0	9.1. We take  technical, organizational and legal measures, including, where suitable, encryption, to ensure that your personal data are protected from unauthorized or accidental access, deletion, modification, blocking, copying and  dissemination.
3524	1	For personalized advertisement experience, the advertising networks and their partners, that are listed below, and would like your consent unless they have another legal basis for processing, may collect or receive device information from our apps and other apps that include personal and non-personal information, such as advertising (or ad) identifiers, IP address, or other information regarding the delivery of advertisements and your interaction with them, inventory of installed apps and/or other tracking technologies to provide measurement services, personalization, ad selection, delivery, reporting, and optimize targeted ads. Ad identifiers are non-permanent device identifiers such as the Android advertising ID and/or Apple's ID for advertising (IDFA). More information on how to opt-out go to Opt-out of targeted advertising [hyperlink to take you above] further above. In addition, the advertising networks listed below, with the exception of Fyber, Mobfox and PubNative who act as data processors upon our instructions, are independent data controllers in respect of your personal data and you can learn more about how each handles your data by accessing their respective privacy notices using the hyperlinks below.
1396	1	Your iOS or Android mobile device may provide a “Limit Ad Tracking” or “Opt Out of Interest-Based Advertising” setting. When you have opted out using this setting on a device, our partners will not use information collected from that device to infer your interests, or to serve ads to that device that are targeted based on your inferred interests.
4736	0	It is your choice whether to send this personal information to us. Yet in some cases if the information provided is incomplete or inaccurate we may not being able to offer Services accordingly
4752	0	Engage in targeted marketing by determining the Members’ preferences and areas of interesting based on an analysis of how often Members and non-Members visited the website and/or used the Service.
495	1	To opt-out or withdraw your consent of receiving personalized advertisements, see below ‘Opt-out of targeted advertising’.
4087	0	Certain data we collect may be defined as personal data under applicable data protection law (“Personal Data”).
4037	1	Your driver rating is available in the Ratings tab of the Uber Partner app.
2970	0	We provide you with the rights described below when you use our Services. Please contact us at support@GOGOLIVE.com if you would like to exercise your rights under applicable law. When we receive an individual rights request from you, please make sure you are ready to verify your identity. We may limit your individual rights in the following ways:● Where denial of access is required or authorized by law;● When granting access would have a negative impact on other's privacy;● To protect our rights and properties; and● Where the request is frivolous or burdensome.● Right to withdraw consent. If we rely on consent to process your personal information, you have the right to withdraw your consent at any time. A withdrawal of consent will not affect the lawfulness of our processing or the processing of any third parties based on consent before your withdrawal.● Right of access and rectification. If you request a copy of your personal information that we hold, we will provide you with a copy without undue delay and free of charge, except where we are permitted by law to charge a fee. We may limit your access if such access would adversely affect the rights and freedoms of other individuals. You may also request to correct or update any of your personal information held by us, unless you can already do so directly via the Services.● Right to erasure (the “Right to be Forgotten”). You may request us to erase any of your personal information held by us that: is no longer necessary in relation to the purposes for which it was collected or otherwise processed; was collected in relation to processing that you previously consented to, but later withdrew such consent; or was collected in relation to processing activities to which you object, and there are no overriding legitimate grounds for our processing.
5326	1	Most mobile platforms (iOS, Android, etc.) have defined certain types of device data that apps cannot access without your consent. And these platforms have different permission systems for obtaining your consent. The iOS platform will alert you the first time the Uber app wants permission to access certain types of data and will let you consent (or not consent) to that request. Android devices will notify you of the permissions that the Uber app seeks before you first use the app, and your use of the app constitutes your consent.
3818	1	Any information or content that you voluntarily disclose for posting to the Service, such as User Content, becomes available to the public, as controlled by any applicable privacy settings. Subject to your profile and privacy settings, any User Content that you make public is searchable by other Users. If you remove information that you posted to the Service, copies may remain viewable in cached and archived pages of the Service, or if other Users have copied or saved that information.
2673	0	We maintain servers around the world, the data that we collect from you may be transferred to and stored at, a destination outside of the country where you live. It may also be processed by staff who work for us or one of our suppliers. By using the UCWeb Services, you consent to your personal data being transferred outside of the country where you live.
4784	1	iOS: On your iPhone or iPad, go to “Settings,” then “Privacy” and tap “Advertising” to select “Limit Ad Track”. In addition, you can reset your advertising identifier (this also may help you to see less of personalized ads) in the same section.
691	1	You may opt-out of certain Firebase features through your mobile device settings, such as your device advertising settings or by following the instructions provided by Google in their Privacy Policy: http://www.google.com/intl/en/policies/privacy/
4537	1	Please note, if you withdraw your consent to processing or you do not provide the data that we require in order to maintain and administer the Services, you may not be able to access the Services.
53	0	Uber may process personal information, including disclosing data with law enforcement authorities in case of threats to the safety of users or of others.
4584	1	However, users can disable cookies by changing their browser settings.
2624	0	For marketing purposes, such as sending marketing messages, or campaign attribution and optimization for user acquisition
3846	0	Medium retains personal data associated with your account for the lifetime of your account. If you would like to delete your personal information, you can delete your account at any time. Deleted account profile pages will yield an error 404 “file not found” page, immediately upon initiating deletion, and will become unrecoverable in our system after a period of fourteen days. It may take several additional days for your personal data to be de-indexed from search engines, depending on those search engines’ practices, over which Medium may have limited or no control.
2555	1	b. Mobile devices
2342	0	If we are required by law to disclose your information, we may share your information with law enforcement or other competent authorities and any third party, as may be required (e.g., to detect, prevent or otherwise address fraud, security, or technical issues; to respond to claims or satisfy any legal process, subpoena, or governmental request; or to protect the rights, property, or personal safety of the Company's users, its partners, or the general public). In the event the Company goes through a business transition such as a merger or acquisition by another company, consolidation, change of control, reorganization, or sale of all or a portion of its assets, your information will be among the assets transferred.
1490	1	Your choices about your information
2267	1	imo may occasionally send you push notifications through our mobile applications. You may at any time opt-out from receiving these types of communications by changing the settings on your mobile device. We may also collect location-based information if you use our mobile applications. You may opt-out of this collection by changing the settings on your mobile device.
4023	0	4.5. An advertiser or maker of recommendations may also choose to upload a list of emails, phone numbers and identities to our systems so that we (but not the adviser or maker of recommendations) can check for user matches.  They will see the number of matches but not the matches themselves.
3323	0	Fraud prevention and integrity service providers
5095	1	You can opt-out from AdMob by Google service by following the instructions described by Google: https://support.google.com/ads/answer/2662922?hl=en
3423	0	Google single sign-on application:email address, full name, gender;language;IP address; andprofile picture.2.3
2068	1	Please be sure to include your email address and a telephone number where we can reach you. To protect you and your child’s privacy and security, we will take reasonable steps to help verify your identity before granting you access to the personal information that we collect and maintain about you or your child.
